,title,author_info,rating,pros,cons,helpful
0,Great culture and community balance makes this is special,,5.0,People are great to work with Emphasis on giving back Paid fairly for work,Sales is stressful but that’s anywhere. You’re hired for a reason so the expectation is you can execute and close business.,Be the first to find this review helpful
1,The real deal - top software company that stays true to core values,,5.0,- incredible culture - best in class platform and marketing team - opportunity to do meaningful work - great benefits,- change is the only constant so you must be comfortable being uncomfortable,Be the first to find this review helpful
2,Wonderful place to work,,5.0,-learn from the best of the best -selling a solution you believe in -company mission,-just a number -not always recognized,Be the first to find this review helpful
3,No longer a good place to work,,2.0,-Good pay -Good benefits -Nice office space,-No time to enjoy the perks -Lots of pressure from management who don’t take the time to figure out why teams aren’t performing -Poor work like balance -Poor support from management -Employee surveys are not anonymous,17 people found this review helpful
4,Just another cog in the tech machine. You don't matter.,,1.0,"Benefits, meeting other unhappy colleagues who helped me during my terrible experience at Salesforce","Another tech giant trying to spread the company culture kool aid but doesn’t recognize or address terrible leaders and managers or self appointed “lead EAs”. Very toxic, backstabbing politics going on amongst executive assistants which creates an entire group of disgruntled, distrustful, and power hungry EAs and makes most EAs carry a bad reputation at Salesforce. Execs and managers who have EAs: some of them need serious management training and learn how to treat everyone under them fairly. This was by far some of the worst treatment I’ve ever seen from an exec who had an EA. Micromanaging, having other people spy on the EA and report back to him about the EA's whereabouts and movement.. The EA was treated like a prisoner. Also, there are some EAs who support C-level people and they act as if they are the exec's themselves. They wield their execs' status for their own power and control over others. It's ridiculous and I don't know if the execs who have EAs even know that their EAs are doing this. I hated working with any execs who had EAs. It was always a massive hinderance to my work progress. I don't understand Salesforce and the EA culture.. some are really great EAs but some are terrible and unfortunately they are the EAs at the top.. usually supporting SVP and up. I wouldn’t buy into their culturally appropriated “OHANA” and other Hawaiian sayings. It’s all a facade.",22 people found this review helpful
5,Egos are as large as new tower,,2.0,Good product vision. Phenomenal following and loyalty of clients.,Too many managers worrying about getting ahead and looking good vs focus on clients and employees. Degrading behavior and not recognizing or acknowledging different experiences and views. Only select few making money,19 people found this review helpful
6,Amazing company to work for,,5.0,"-The core values of Salesforce really show in the day-to-day, making you truly feel valued as an employee -Wonderful management who cares about your future, consistently having career projection conversations","A little bit overloaded with work, but better to have too much work, than not enough. Also need to get certifications which is very difficult when you're working full-time.",Be the first to find this review helpful
7,Love this place!!,,5.0,"the culture is so ""good"" for you; it makes me a better person",no cons for me to state,Be the first to find this review helpful
8,Loving work (and life) at Salesforce,,5.0,- Remote friendly company that equips team to succeed - pay is good - market leader so lots of activity from deal perspective - wide product set to sell - innovative and relaxed culture - lot of resources to help get the job done,"- monthly forecasting (big company, high accountability to monthly numbers) - sometimes hard to navigate but overall people are willing to help - product is highest priced in market (good and bad, very competitive space)",Be the first to find this review helpful
9,cut throat culture,,3.0,nice perks at all levels,terrible leadership across the company,10 people found this review helpful
10,Great,,5.0,The job itself is very manageable and prepares you well for a future in sales.,The management can be a bit strict with PTO,Be the first to find this review helpful
11,BDR,,4.0,"Pays well, a lot of autonomy to do your job",Not many cons. Must multitask well!,1 person found this review helpful
12,Great company. High Stress/Low focus on employee well being,,2.0,"working with some really great, bright individuals, Salesforce hires top talent good snacks in the office lots of opportunities to volunteer and give back to the community","your success is predetermined by your territory, timing, and talent (in that order) you can often feel like just a number in the company versus management honestly caring about you, your goals and your well being not often transparent about the future of your career path unrealistic expectations with unattainable monthly quota metrics (only ~20% hit their annual quota)",12 people found this review helpful
13,Wow! Best employer ever,,5.0,"If you research the company online, you will find that the great things said about Salesforce are really true. The culture is very positive and success oriented. The company values employees - customers, shareholders and society too! The benefits are good.","The company waivers between a startup culture and a big mature business culture. Some people thrive in one environment or the other, but Salesforce seems to have a little of both. For instance, travel approval requires multiple levels of approval up to a EVP; on the other hand, a phone call secured two programming resources to work on a really cool side project. The con is, I'm not sure what kind of response I'm going to get - startup or big company.",1 person found this review helpful
14,Great place to work... if you aren't in Sales.,,3.0,"Salesforce runs a sales organization like no other. Even if you have been a seller for 30 years, one full year at Salesforce will elevate your game. You will leave here a far better seller than when you arrived. Their operational expertise, sales execution, deal inspection, etc., are better than anyone in the business (for now). I've worked with some of the smartest people I ever have in Enterprise software. Imagine the top 10% of the sellers at your current company. Now imagine that the entire Salesforce sales organization consists entirely of that top 10%. Yeah, that describes the intensity.","The executive leadership team at Salesforce exemplifies the values they espouse and they truly believe that the world can be changed by business. Unfortunately, the values that are core to our belief system (doing what's right for the customer, trust, etc.) do not filter down to the actual sales process. There's a tendency to encourage customers to do things unnatural to their buying process, all in the interest of making the month. You will subjected to immense pressure here. The company, to their credit, has tried to emphasize wellness with meditation rooms in each office, etc. But much like volunteer time off, I know very few sales people that have time to enjoy those perks outside of offsites. With only 50% of AEs exceeding plan, your success depends entirely on timing and territory. AEs who have not missed their number in years come to Salesforce only to fail because the alchemy involved in assigning quotas. There's a reason why so many AEs turn over after less than 2 years. It's unfortunate as the company really wants to do well in the world. The",24 people found this review helpful
15,Great Place To Work,,5.0,Salesforce is an incredible place to work and they provide great opportunities to make an impact externally in the community.,No cons that I can think of,Be the first to find this review helpful
16,Positive overall,,4.0,"Growth opportunities, the people and culture, mobility within the company",Pace and growth can be challenging,Be the first to find this review helpful
17,The reviews are true! 5 stars,,5.0,"Incredible culture, fantastic benefits, great leadership who seems to truly care about their employees and want to see them promoted. Pay is extremely competitive & on the high end - especially in the ATL area. So many fantastic perks and networking opportunities.",Parking is a monthly cost in ATL- that’s all I can think of!,Be the first to find this review helpful
18,Lives up to the hype,,5.0,Great perks and benefits. Very welcoming and relaxed environment. Lots of events during work hours to keep you busy when you need a break for every day procedures.,"Not many. Minor gripes being that the Portland office lacks some of the things that make the San Francisco HQ great, although it looks like this is being improved. Also, not a lot of opportunities to move into roles outside of support, unless you want to move to the bigger offices in SF, Seattle etc.",Be the first to find this review helpful
19,What's not to like?,,5.0,"There are a lot more Pros than Cons, their health benefit package is very generous, so is their vacation time and other incentives, plus, they have offices all around the World.","No cons really, but maybe building a tower in Hawaii wouldn't THAT bad of an idea ;)",Be the first to find this review helpful
20,Best workplace of my career,"Nov 27, 2019 - Senior Specialist in Indianapolis, IN",5.0,"Company lives up to the hype by being true to its values, and isn’t afraid to challenge issue that are brought forward. I assume everyone I work with is fantastic at their job, and I’m rarely proven otherwise. Amazing internal mobility and growth opportunities.",People are still people and you’ll still run into a few that hinder others.,Be the first to find this review helpful
21,Not a Safe Place to work. Completely Corrupt HR Organization and massive bullying,"Nov 1, 2019 - Senior Sales Engineer in San Francisco, CA",2.0,Well Known Product Well Thought Out Documentation Good Equipment Plenty of Events & Snacks,"* Yelled at for seeing Doctor while employed * Scheduled Vacation Prior to Initiating Employment, later yelled at for being on leave when we had previously scheduled * Massive Manipulation and Lying * Use of Sexual Innuendo to Manipulate in Sales * Constant Changing of Hours and Needs making home life and commuting unbearable * Management Yelling in Conference Rooms * Inpatient Colleagues who disconnect calls while on phones with clients * Talking to other colleagues is very frowned on in other departments * Absolutely no bad talk allowed of company anywhere, despite the difficulties you will be fired if any word of a complaint is uttered. * Constant Stream of people coming and going. Definite preference for young people. * Forced Signing of Documents due to duress. * Use and training given to management on guilt shamming and utilizing coworkers to destroy team members. * Very little severance to compensate for medical issues associated with employment.",30 people found this review helpful
22,Good company,"Nov 9, 2019 - Senior Product Analyst",5.0,"People are very humble and willing to help.I have the independence to control my workload, and I also like that I feel my work is connected to both my team and the company's overall strategy.Diversity & Inclusion is really good, Interesting work and endless opportunities .Good benefits and a lot of VTO activities to get involved in.","Was told that there is flexibility to work from home but it depends on the teams.My team prefers working in the office.I prefer working remote as I feel I am productive when I work from home as I can work more without having to stress out being stuck but I am pressurized to get to work.Being a global company, I think the managers need to be offer many remote/home-based work options and not micro manage about working from the office. Of course those instructions need to come from the leadership which this company lacks.",5 people found this review helpful
23,"Great pay, well-rounded workforce (not as competitive as google/stripe/fb), work-life balance","Nov 12, 2019 - Director of Sales and Marketing in San Francisco, CA",3.0,"Work life balance, volunteer time off","Poor middle management, managers need to be trained, sorely lacks diversity although posters show otherwise. Sadly another tech company run by white and Indian men and white women.",14 people found this review helpful
24,Great company with lots of growth and opportunities,"Nov 25, 2019 - Senior Vice President in San Francisco, CA",5.0,Ambitious company with a lot of runway and a strong culture of giving back,Nothing unusual for a bigger company,Be the first to find this review helpful
25,Good salary,"Dec 5, 2019 - Program Manager",4.0,good salary and fun to work,Sometime management don't know the ground reality,1 person found this review helpful
26,Not going to retain top sales talent,"Nov 10, 2019 - Sales",3.0,- Great product and vision - great benefits - decent salary,"- if you are coming for consistent huge commission checks think again. - quotas over 400% of PY actuals - comp plans do not encourage the right behavior, if you can even figure them out - you will sell, but will take multiple years to paint a vision that ends up in a sale large enough to hit your quota.",14 people found this review helpful
27,Nope,"Dec 22, 2019 - BDA in Chicago, IL",1.0,"Competitive environment, good snacks and drinks",The Chicago office is extremely competitive. They make you feel as if you’re going to be hired and they kick you out the door. Unfortunate. The employees are great but the management is awful. This program really needs to redo their management.,11 people found this review helpful
28,"Great culture, great business, poor engineering","Dec 6, 2019 - Director, Product Management in San Francisco, CA",4.0,"Culture is exceptional. Business opportunities are great, a lot of customers and potential growth.",Things are slow... Releasing only 3 times a year doesn't work anymore.,Be the first to find this review helpful
29,Horrible experience once the koolaid wears off,"Dec 10, 2019 - Strategy Analyst in San Francisco, CA",1.0,Offices and snacks are nice. HQ is eco friendly with ceramic dishes and utensils that staff wash for you. Fitness center with instructor led courses. Benefits are great!,"Favoritism. Political. Get in with the inner circle (decision makers) and you're golden. Salesforce talks a lot about Ohana, even setting their top method/ measure as ohana - but as many other reviewers mentioned. It's all smoke and mirrors. The culture is cut throat and people help you if they think you can help them in the future. There's no sense of boundaries or work life balance. Managers and stake holders text you nights and weekends asking for something ASAP. Managers manage up here and if your work isn't 100% what they need they question your intelligence. They don't want to mentor or manage, they want robots ready to push out work.",25 people found this review helpful
30,Good,,4.0,Great company values and philanthropy.,Tough work life balance to maintain,Be the first to find this review helpful
31,Starting to see growing pains but still incredible place to work,,5.0,Most recognized product stack in the industry that customers love and build their careers on.,Our internal complexities are sometimes difficult to shield from customers.,2 people found this review helpful
32,Amazing experience so far,,5.0,"Great work life balance, great benefits, flexible hours, work from home",A bit sales-heavy when you're new to that world,Be the first to find this review helpful
33,Most Innovative Company,,5.0,Company with long term vision and strategy. 1-1-1 philanthropic model to help communities gives the employees a fulfilling experience. Working with super smart people always making right decisions to give customers a whole new experience. Great place to work with work life balance.,Long hours but rewarding experience.,Be the first to find this review helpful
34,Amazing Company with Uncanny Kindness,,5.0,- Fast to put ideas into actions. - Management backs eachother up. - Management back employees up. - The company has unlimited resources for employees to use. - The IT department is always there to help within seconds. - People genuinely want you to succeed. -,"- The company moves very fast. - There is very little room for mistakes. - People expect you to put in 110% all the time, which is easy if you love your job.",3 people found this review helpful
35,No work life balance for SEs,,3.0,"Salesforce has been a great place to learn. For the most part, I get to work with smart people that I consider my friends. I get exposure to a lot of interesting companies and have upped my technical game and SE skills through that exposure and enablement.","While there are some down times, its not uncommon for me to work 10+ hours a day and into the weekends with travel (more normally 1x/week but sometimes 2x/week). With our diverse product set, the list of what a CORE SE is supposed to know grows constantly with insufficient specialist support. I'm a high performer in terms of ACV, but since our comp is more weighted towards team goals I'd rather have a life than have the extra few bucks. I've been asking for help all year, but hiring hasn't kept up with attrition on the team so its getting worse rather than better. I think management does care, but it takes so long to hire and onboard new SEs it takes 3-6 months to get any relief. The promotion process is murky, leaving me wondering if its even worth it to do this. The company says it cares about health and wellness, but Sales is a company within a company with its own culture. In that culture ACV > everything.",12 people found this review helpful
36,You're able to have an impact and develop your career,,5.0,"- Great exposure and recognition - Fantastic benefits and office environment - Tons of opportunities to grow within the company - Because of the growth, there's a lot of opportunity to have an impact on the company","- Staying motivated can be tough in such a fast paced environment, but they encourage you to utilize your benefits and lean on your team",2 people found this review helpful
37,Best Career Move I Ever Made,,5.0,"The culture, the benefits, the opportunity. They ask a lot of their employees, but give you the resources to succeed. Would absolutely recommend working here to anyone.",The sales side of things can be hyper-politicized at times. We're a high-performing sales team with big quotas and big goals; with that comes big egos.,2 people found this review helpful
38,First interview with a 21st century company,,5.0,"Interview was remote, comfortable, and applicable to the job responsibilities",There were large gaps of time between communications and interviews,1 person found this review helpful
39,Lack of training,,3.0,- Free food and drinks - Work events - Ohana Floor,- Open floor seating (makes concentrating on a task very hard) - Workflow is extremely sporadic - Cool kids club - Hardly any training. This was over-promised and under-delivered,7 people found this review helpful
40,People Company,,5.0,Great culture with support from management across the board.,Acquisitions have started to spread positions thin but hiring is ongoing.,Be the first to find this review helpful
41,Account Executive - GRB Core,,5.0,"I loved being a part of the Ohana. My team was tight knit and super helpful as I was ramping. My manager knew the insurance and outs of the company having been here for over 5 years. There is a system in place that you tap into for lead generation, upselling accounts, prospecting, and events. You have a team of people you sell with from product experts to solution engineers. The job is challenging but the people are awesome. Culture-wise the Ohana groups are a fantastic way to meet people and get involved in shaping office culture.",Honestly not many that I can think of. The NYC office has great leaders and great AEs.,1 person found this review helpful
42,"Employee focused, but with issues",,3.0,"A LOT of effort is spent focusing on employee emotional wellness, empathy, and giving back.",VERY silo-ed. You can't swing a surfboard without hitting several VPs. This makes getting large initiatives done a thing of nightmares. The left hand rarely knows what the right hand is doing.,11 people found this review helpful
43,Sales,,5.0,Sales Are the best baby,Blah blah blah blah blah,Be the first to find this review helpful
44,Unattainable Sales Quotas,,2.0,"Good products, culture and benefits.","Unattainable sales quotas for the individual contributors. Way too many and unnecessary levels of sales managers (RVP, AVP, etc.) It's like a pyramid scheme here now where the majority of Account Execs don't come close to hitting their number.",15 people found this review helpful
45,Things are going great!,,5.0,The culture is exactly what you read in the news. Salesforce is extremely passionate about creating an inclusive workforce. I feel valued in my role and I get so much trust from my management team that I never feel micromanaged. I believe the company does invest in their employees in any way possible. I am able to network with upper management frequently and have access to clear expectations on my career path.,"I started contract and then moved full time after 6 months. I am ok with this process and understand that this is how people are brought on into the recruiting org, however I do not feel there was full transparency through the onboarding process. The info I was given first interviewed (as contract) regarding the full time process was not super clear. While I am completely happy now and ok with the situation, I do feel this communication could be handled better.",1 person found this review helpful
46,GRB AE,,5.0,"Culture, growth potential, scheduling flexibility","Supporting resources, career growth coaching, pay",Be the first to find this review helpful
47,The best job I’ve ever had.,,5.0,"Competitive pay, generous benefits and a very positive environment.",Remote workers are unable to travel to meet teams,2 people found this review helpful
48,All of these positive reviews are definitely fake,,2.0,- Generally good culture - Great snacks - Free shirts,"Complete lack of transparency. If your manager tells you anything, you're likely not getting the full story. I'm guessing it used to be a great place to work, but the sheer size of Salesforce has made it impossible for anything to get done.",14 people found this review helpful
49,Core Account Executive,,5.0,"Phenomenal culture and unmatched support. Coming to work every day is a pleasure, the work environment is collaborative, exciting and challenging all at the same time.","Not many - it can be slightly serious at times but for a high growth company, that's not a surprise.",Be the first to find this review helpful
50,Knockin on the Boy's Clubhouse Door,"Mar 19, 2016 - Anonymous Employee in Chicago, IL",2.0,Marc Benioff is an envisionary leader. The innovation that he inspires as well as his passion to build a company that embraces equality and diversity makes for a compelling set of reasons to be part of this great company.,"While the west coast may be working on meeting Marc's lofty goals, the midwest(specifically midwest CSG) is swiftly becoming the white male centric world. Women are not staying within various roles within CSG in growing numbers and it's becoming very obvious that this is a white man's world. If you read the Chicago Tribune this weekend, you will not that more and more diversity factors(black, Hispanic, etc) are leaving for more favorable areas from every company, not just SF. If anyone would do the data analysis for CSG Chicago, warning bells should go off. The executive leadership is slowly but surely driving women out of their workforce vs embracing Marc's culture.",17 people found this review helpful
51,"Dynamic Growth comes with pluses and minuses, but more pluses","Oct 20, 2016 - Anonymous Employee",4.0,"Salesforce has a great culture and it's a company at which many employees feel proud to work . There's a real sense that we're making a difference both in our industry and through our philanthropy. The company is relentlessly focused on growth and anyone who has worked at place with 25% growth year after year after year, knows that there are growing pains. Bulleted Pros: Innovative company where ideas are given credence 1-1-1 model is real and matters to most people Very smart, self-starting, motivated coworkers","Most of the cons can be summed up by growing pains. The rate of growth at times creates confusion and certainly poses organizational and system challenges. Salesforce is future focused and perhaps doesn't always take the time to look back to evaluate past performance, instead preferring to move on to the next big thing. The result is that sub-optimal processes don't always get corrected. As the company has grown, a lack of focus on small details results in some areas of the business suffering until something serious occurs that draws attention to it. Salesforce is unabashedly a Customer Company. When given the choice to pivot to Customers, Shareholders, or Employees, the company will always choose Customers. This has resulted in the past with some haphazard and poorly though-through HR decisions. Lots of Employee-related initiatives seem to be thrown together at the last minute.",Be the first to find this review helpful
