,title,author_info,rating,pros,cons,helpful
59,Strategy,"Feb 8, 2017 - Anonymous Employee in Toronto, ON",5.0,"flexible, fun, great office, motivated people, great company values","work life balance is blurred, travel a lot",Be the first to find this review helpful
60,Awesome Aloha spirits,"Feb 8, 2017 - Anonymous Employee",5.0,Work with best of the best,Too fast too furious to work.,Be the first to find this review helpful
61,Sr Account Executive,"Feb 6, 2017 - Senior Enterprise Account Executive in São Paulo, São Paulo",5.0,"Values, innovation, growth and people",High concentration of the people in Sao Paulo,Be the first to find this review helpful
62,Great place to work,"Feb 5, 2017 - Anonymous Employee in Sydney",5.0,"Fantastic culture with switched on colleagues Awesome employee benefits Volunteering opportunities locally and overseas Culture & character fit looked at being as important as knowledge when interviewing Great career opportunities, which should to be utilised (see Cons below)",Some IT positions seem fairly silo'd compared to other places (but moving into different roles seems easy enough to keep your skills/knowledge up to date),Be the first to find this review helpful
63,Linux Systems Engineer,"Feb 4, 2017 -",5.0,"Strong on ethics, equality and diversity Exposure to new / a range of technologies in this role. No sacred cows. Willing to adapt the technology and processes at a great pace. Fun friendly atmosphere and a generally healthy work life balance is promoted. The CEO",Be ready to embrace change and learn quickly.,Be the first to find this review helpful
64,"Great Employer, very agile organization","Feb 1, 2017 - Solutions Engineer in Zürich",5.0,You have a lot of resources and support to get your job done. People care about each other. There are a lot of opportunities to grow,"If you are not in a hub office you don't get as much attention, benefits and office life quality.",Be the first to find this review helpful
65,Great Company,"Jan 30, 2017 - Sales Development Representative",5.0,"Company Culture, Fast Growth, Great retribution","There is really nothing to say, maybe better snacks?",Be the first to find this review helpful
66,Enterprise Sales,"Feb 11, 2017 - Anonymous Employee",4.0,"Good communication, collaboration and connection",Limited focused countries and cities,Be the first to find this review helpful
67,It's the best,"Jan 18, 2017 - Account Executive in Toronto, ON",5.0,"As a salesperson, it rocks, because you are selling what is literally THE best product in the CRM marketplace. You can be proud of what you sell. From a culture standpoint, the company cares a ton about ""Ohana"" (family) and equality. We have major initiatives for LGBT groups, our women's network, and many other employee resource groups. A lot of people are young and become friends so you might expect a bit of a ""bro culture"" but it's definitely the classiest of the bros as there is zero tolerance for bullying or disrespect of any kind. Salesforce is very inclusive.",Quotas are steep and products are ever-changing so you need to be on top of your game. You will definitely get managed out if you aren't pulling your weight.,2 people found this review helpful
68,Hit or miss..,"Jan 16, 2017 - Account Executive in London, England",2.0,"-Working with some great individuals -Lots of perks such as benefits, healthcare, pensions, etc -Pay is in line with the current market","-Lots of middle management are poor at their jobs -Not enough mentoring or knowledge within middle management -Full of politics -Some really shady practices in middle management with managing subordinates, 'mentoring', etc",18 people found this review helpful
69,The good and the bad =),"Jan 30, 2017 - Business Development Representative in Toronto, ON",4.0,"- Great benefits (education, health, social outings, etc.)","- competitive nature - difficult to move around internally in the hubs (since they tend to be sales focused, primarily)",2 people found this review helpful
70,Sales Manager,,4.0,"fast growing, dynamic, career progression, learning curve, culture and Ohana spirit, multinational, outstanding products, benefits","office location, food availability, company politics, work life balance, times of uncertainty",Be the first to find this review helpful
71,review,,5.0,great perspectives for the company,hard balance pro/perso in this company,Be the first to find this review helpful
72,Salesforce,,1.0,Travel and food meet some cool people and fun parties also there are some good jobs there in the US office I hear. The URL teams are mostly 20 yr old though and mostly men in leadership roles,No support for new hires,8 people found this review helpful
73,Customer Success Support Engineer,,5.0,"- A fantastic team and lots of challenges to deal with on a technical front. I get to work with a really talented and smart bunch of people who are willing to help other out when stuck. I have never been involved such work that makes you happy. We get to work on a variety of issues that affect people real time, and working on a plane higher than the developer allows us to better prepare for higher positions later on in our careers. - Lots of in house support to learn new skills. I was recently part of a seminar to learn Lightning hosted by a team that actually built it and it is just one of the many I have attended. - The idea of giving back to the society. The vision of our CEO has called upon AL of us to volunteer. I was never too big on it before I joined Salesforce, but over here after my first activity, I have been hooked on it. All thanks to Salesforce! - Transparent management The upper management never really makes you feel left out of any decision process that is regarding you. I have had almost weekly chats with my manager regarding the work and life in general and it is good to know that the management has your back. - Fantastic perks and benefits We enjoy full medical cover, and so do our four of immediate family. Free food, great break out areas, in house cafe, etc","I cannot really count anything here. Maybe expect a bit of a hectic rampup if you are a laid back fellow, since only the best are expected and if you're not willing to keep up, be prepared to be left behind, but only after multiple attempts to rescue you!",Be the first to find this review helpful
74,"Challenging, Rewarding and Fun",,5.0,"At Salesforce you are in a position to define and shape your own career. There is nothing you can't achieve if put in hard work, time and take the philosophy that it's on your shoulders to define what you want and go and get it.",If you don't enjoy that kind of freedom and prefer a more structured environment where there are simpler and more defined demands placed on you then this is not the place for you.,1 person found this review helpful
75,"Director, alliances",,4.0,"Great Culture, values employees, good benefits",not enough transparency between management and employees,Be the first to find this review helpful
76,"Want to constantly be challenged and remain engaged, join Salesforce!",,5.0,"- Amazing team and Ohana culture - Bucket loads of talented people to learn from - The V2MOM process is the best tool used for alignment, making sure everyone is going in the right and same direction, and that they know their work adds meaning to the overall company goals - Giving back...wow! This is so powerful on so many levels 1-1-1 model - Lots of smiling faces",- Numbers driven - Not local enough - Weak mid level management - Engaged in to much lip service - Full of politics and egos,4 people found this review helpful
77,Best company to work for within Sales,,5.0,Great management Transparent communication and organisational structure Great working environment & culture Intelligent and smart colleagues Great salary and perks Great managers to mentor you to become a better sales rep & person,Great company with smart individuals and a lot of learning.,Be the first to find this review helpful
78,Positive,,5.0,Good culture overall Exceptional technology stack,Becoming slightly jobs for the friends type of business in certain locations regardless of merit.,Be the first to find this review helpful
79,"Great Culture, High Performing Sales Environment",,4.0,"Working with top talent Great product Great vision and roadmap - ahead of innovation curve Great executive leadership Fun, vibrant, energetic culture Decent staff benefits",Challenging sales environment - 1 in 5 hit target Limited career growth / progression for those early in their career Many resources diverted to handful of big global accounts,1 person found this review helpful
80,Growing,"Jan 11, 2017 - Account Executive in Sydney",4.0,Growing at a fast pace and acquiring new companies which is exciting,"There are always cons at any company, however Salesforce have few. Any con largely depend on manager, role, department etc...",Be the first to find this review helpful
81,Good work place,"Dec 28, 2016 - Anonymous Employee in Bangalore",5.0,Good culture Great learning place Career growth Fast paced Nice perks,Not for the faint hearted Parking for employees,Be the first to find this review helpful
82,Good company,"Jan 10, 2017 - Anonymous Employee",4.0,Give back to the community Supportive for career development,Not competitive on salary for existing employees,Be the first to find this review helpful
83,Customer intelligence trainee,"Dec 17, 2016 - in Dublin, Dublin",5.0,Good opportunities to get a full time position,Work can be rather generic at times,1 person found this review helpful
84,Sales apprentice,"Dec 29, 2016 - Anonymous Employee in Toronto, ON",3.0,"Free food and snacks, fun events, espresso machine, some people were nice","False promises ""Fake"" culture Highschool mentalities Inexperienced-management Politics-lot of sucking up to mgmt Everyone's brain washed ""#dreamjob""",3 people found this review helpful
85,Fantastic place to work,"Dec 19, 2016 - Senior Solution Engineer in London, England",5.0,"Fantastic people to work with - and being able to combine the incredible innovation of a world leading tech giant with the opportunity to work exclusively with organisations focussed on making the world a better place - perfect! Great benefits, Great people, Great place to work",It's hard work - but you'll be rewarded for it. Sometimes the US-rest of the world focus is a bit too visible!,Be the first to find this review helpful
86,Great career move,"Dec 16, 2016 - Sales in London, England",5.0,The Ohana culture is pervasive throughout the organisation and makes Salesforce a really enjoyable place to work. The excitement and buzz around the products both internally and from customers is fantastic. Opportunities for career progression in the longer term. Focus on customer success. Great innovative products which customers seem to love. 1:1:1 model offers the chance to do some valuable work and give something back Inspirational CEO,Structure for managing multi-national accounts still needs some refinement. Free chocolate,Be the first to find this review helpful
87,RVP App Cloud South Europe,"Dec 12, 2016 - RVP App Cloud South Europe in Paris",5.0,"Innovation, very Sharp team, 1-1-1 Volunteer program, high growth, Saas & Paas leader, Customer oriented = THE PLACE TO BE","Work/Life balance, quite a lot pressure (even if positive)",1 person found this review helpful
88,Good to work,"Dec 16, 2016 - Software Development Engineer in Bangalore",5.0,Good to work. very nice enviourment to work. Very friendly nature.,Salary is law after 3 months,Be the first to find this review helpful
89,"The ""1 year in"" review","Dec 12, 2016 - Business Development Representative in Dublin, Dublin",5.0,"Wonderful workplace with engaging, thoughtful and well matched people. Benefits are extraordinary. Pension, stock options, health insurance. Free snacks/drinks and fruit. Wellness benefit which covers gym membership and anything else you can imagine. Real and tangible focus on giving back. Each employee gets 7 days off a year to volunteer with an organisation of their choice.","The work is tough and a lot is expected, however I wouldn't list this as a black and white con, as I believe that what we get in return is more than enough to justify workload.",1 person found this review helpful
90,Incroyable,"Jun 23, 2017 -",5.0,"ADN, Workplace, 1-1-1 model, Compensation, Flexibility",Huge amount of work for a small team,1 person found this review helpful
91,Great - but not for me,"Nov 30, 2017 - Exécutive in Paris",2.0,"Lots of perks, such as free drinks, fruit, snacks etc. Pay is good. Great opportunities to give back to the community.","No real onboarding, arrogant colleagues . Long working hours. I feel the company hides behind being its values but does not do put them into practice.",10 people found this review helpful
92,Business Development Rep,"Jan 29, 2018 - Business Development Representative in Dublin, Dublin",5.0,Challenging Growing company Career development Enablement and training Good atmosphere,Growing pace makes target more challenging,Be the first to find this review helpful
93,Technical Support Engineer,"Apr 8, 2018 - Anonymous Employee in Melbourne",5.0,Life balance and great values,none since I started 6 months ago,1 person found this review helpful
94,Key Account Director,"Jun 30, 2018 - Director, Key Account Management in Mumbai",5.0,Product Acceptance in the market,Nothing I could think as of now,1 person found this review helpful
95,Developer Support Engineeer,"Jul 5, 2018 - Anonymous Employee",5.0,Values Work culture Good management Amazing facilities Good pay Creative work,None I can think of,Be the first to find this review helpful
96,Best place to work,"Feb 16, 2019 - Anonymous Employee",5.0,Pays well Good employee benefits Not too stressful,No regular increments Too many hires from 1 single company,Be the first to find this review helpful
97,Business Development Representative,"Apr 1, 2019 - Business Development Representative",5.0,Learnt so much during my 1 year here.,"Once you're in, you'll drink the Salesforce kool aid.",Be the first to find this review helpful
98,Nice place to work,"Jun 1, 2019 - Anonymous Employee",5.0,Package is more than industry standards,Middle management is not good,1 person found this review helpful
99,Manager,"Oct 22, 2019 - Manager in Dublin, Dublin",5.0,"111 model, 7 days each year to volunteer",Will be in Dublin City in a couple of years,Be the first to find this review helpful
100,Job Title 1,,5.0,Best place to work in Dublin,Nothing bad to say currently,Be the first to find this review helpful
101,#Dreamjob,,5.0,"- Really smart people - All put in lots of effort to get stuff done - You are given almost everything you need to succeed in your role - Onboarding is amazing. - I have a team environment , that is supportive. - I have an amazing manager, who leads and supports her team. - IT Systems are amazing. - Concierge is amazing. - I feel like the management structure is flat / welcoming. - CEO speaks out on things that he believes in publicly - Equality, Fair pay etc - Parker Harris leads by example.. when NA24 went down.. his internal briefing was amazing.. and made me proud to join Salesforce.","- I think there maybe too many Oracle people coming across that may eventually lead to a change in culture, make sure we only take the culture fit ones :) - Salesforce markets to the customer so well... sets the vision and goes on executing it.. there should be a communication strategy laid better to inform and communicate this to front line staff. - I think in some roles ( not my own ) aren't given the opportunity to expand on what they are doing they are placed in a box and have to wait their time to get some flexibility in what they can do / given a runway or roadmap ( this is just an observation on certain teams, this is not the case in my case ) so this maybe ill-informed.",8 people found this review helpful
102,Developer Support Engineer,,5.0,Loved the ohana culture very much. Loving to work here beautiful experience no stress at all. Very supportive and responsive. Feeling great to work with salesforce.,No cons seen so far. Even if seen i think it can be ignored.,1 person found this review helpful
103,Customer Success Director,,4.0,Great people and collaborative culture,Rapid growth leading to tendency towards fiefdoms,Be the first to find this review helpful
104,Best company I've worked for,,5.0,"True #aloha spirit. Great company with a true focus on career and personal development for employees. Due to the transparency and open communication lines, you feel that you are part of the big picture and future of the company. The time, opportunities and encouragement to give back to the community is amazing.",The pace is immense and can be overwhelming. You have to be disciplined in making sure you stop to take a breath! However the feeling of achievement balances this out.,Be the first to find this review helpful
105,Bad management,,3.0,"Good work environment, flexibility to work from home, on / above par salary.","The management, especially in the technical support team doesn't back their team and never try to understand the challenges from the team's perspective",7 people found this review helpful
106,Very proud to work here,,5.0,"- Ohana spirit - Values - Trust, Growth, Transparency and Equality - Constant innovation - Inspiring CEO - Great scope for career development - Inspiring events and marketing - Fantastic pay and benefits - Foundation",- Pace can be relentless sometimes - Short term focus - Economy flights to San Francisco,Be the first to find this review helpful
107,HR manager,,2.0,"It an digital images processing company, Good management system and good company for poor knowledgeable people.",No value for the knowledge,4 people found this review helpful
108,Vibrant company culture,,5.0,Great company! success is always celebrated by all. Great benefits and nice work place.,Not many technology job openings in Singapore.,1 person found this review helpful
109,Account Executive,,5.0,"Pay, culture, flexibility in life/schedule",demanding sales environment - high velocity. Monthly driven targets can be stressful - need to be able to keep your calm and ride the waves (both up and down),Be the first to find this review helpful
110,Top Culture,,5.0,"Employees Engagement, Culture and Career Progression are the cornerstones of this amazing company.",Not much to say here,Be the first to find this review helpful
111,The best place I've ever worked,,5.0,"Salesforce is a fast paced innovative company where you will learn and develop your skills and knowledge more then any other company I have come across. Their is a huge support network to help you achieve your goals and endless resources for anything you may need. One of the greatest perks of the job is the volunteering you can do for local charities. I have been lucky enough to work some charities and get to meet some genuinely amazing people, all within my working week. Their is a reason they are in the top employers in the UK year on year, it is a well deserved accreditation. This is why I keep enrolling all my friends to join.","Keeping up with all the products, their seems to be a new product every other day. Also the drawers of snacks and treats are too tempting!",Be the first to find this review helpful
112,Senior Account Executive,,5.0,- Excellent Solution - Culture of equality,- Low work life balance,Be the first to find this review helpful
113,Remote worker in the UK,,4.0,"The 1-1-1 model is amazing. The company is proud to be volunteering and it is not only appreciated if you do, but also encouraged. SF promotes equality (hired last Month a chief equality manager), got the best reference cases from customers themselves and is very good for the healthcare of the employees. It is a company that cares for her employees and her customers plus got very innovative solutions. The onboarding was amazing and the company does make you feel proud that you work there.","Equality: There is a good focus on equality which is good as it is needed. In my eyes there is a lack of female managers or managers that understand how to use the strengths of having woman in the sales team. Overall, all managers have a checkbox they need to complete by hiring or interviewing woman, I think in the end they will be better in also give specific trainings to managers on how to actually manage a woman better. Remote worker: The biggest downfall of SF. A remote worker means they expect you to be in the office on a weekly base, rather more than less. Being used to work with Lync or Skype, there is a lack of the internal technology (acceptance) to make remote workers more involved remote instead of face to face. Everyone is using google hangouts or GTM. Internal presentations and meetings in my eyes should be 80% of the time remote.",3 people found this review helpful
114,Loving the Ohana culture here in Salesforce!,,5.0,"A year back, I decided to join Salesforce after reading the feedback on Glassdoor and it was one of the best decision I have made. This is a great company with everyone in office treating each other like family. The company provides good benefits and welfare and the management truly believe that it's the people that makes a company great.",It's a fast pace work environment and change is the only constant here in Salesforce. With this dynamic environment brings stress and the pressure to perform as everyone is putting their best forward.,5 people found this review helpful
115,Consultant,,4.0,"High level of responsibility, great colleagues, interesting projects","Not paid enough. Long working hours, not compensated for",Be the first to find this review helpful
116,Account exective,,3.0,High Sarary & Good Office,Japanese Small Business Market is bad for cloud,Be the first to find this review helpful
117,Account Executive,,5.0,"This is a company that is driven by the success of their customers. I feel this is certainly replicated through to employees and everything is set up for you to be successful in your career. The commitment to making you the best you can be is phenomenal and the amount resource they provide to make sure you're succeeding is second to none. It is extremely fast paced, what else would you expect from such an innovative company, one of the many reasons I love Salesforce.","It is a fast growing, large company with a complex org structure. Navigating the right teams and people takes time, but everyone is willing to help you.",Be the first to find this review helpful
118,Best choice for your career,,5.0,"Mentoring, sales skills, Wonderfull product, great energy, innovation","Bigger and bigger, far from city center",2 people found this review helpful
119,What a place to work!,,5.0,"- Constant communication so you are aware of all of the new and exciting things that are happening across the business - Endless, amazing volunteering opportunities to give back to the community - 56 hours a year! - Colleagues across the business listen and are interested in advising in terms of career development - Lots of opportunity to learn and develop knowledge through seminars, round tables and lunch & learns - Wellness is one of the key values at Salesforce and it definitely shows - our benefits are second to none!","- Some teams don't practice all of the values of Salesforce, they only focus in on a couple - transparency is one that I feel needs to be developed more - London and Staines are very separate entities. By bringing more seminars and events to Staines, it will enrich the culture and lay some of the pressure off of the work space issue in London",8 people found this review helpful
120,Account Executive,"Dec 11, 2018 - Anonymous Employee in Toronto, ON",5.0,"Great training, great atmosphere, exciting challenges","nothing, really great place to work",Be the first to find this review helpful
121,Amazing employer,"Jan 5, 2019 - Anonymous Employee",5.0,"Benefits, flexibility, supportive and friendly culture",Career development can be somewhat limited,1 person found this review helpful
122,Developer,"Mar 13, 2019 - Anonymous Employee",5.0,Culture in salesforce is very good,"None as of now , there are no drawbacks as of now",Be the first to find this review helpful
123,just getting started,"Mar 18, 2019 - Anonymous Employee",5.0,I can learn a lot in this company.,I just get starting so I don't know.,Be the first to find this review helpful
124,Very professional,"Apr 29, 2019 - Anonymous Employee",5.0,great company to work for!,"numerous interviews, but i personally do not consider it as a minus",Be the first to find this review helpful
125,Identify and qualify high potential E-commerce Project,"Jun 30, 2019 - Business Development Representative in London, England",5.0,1-1-1 model & Ohana Spirit Selling strategy Equality,Hard working environment No more Cons,Be the first to find this review helpful
126,My best employment so far,"Aug 5, 2019 - Technical Architect in Copenhagen, Capital Region",5.0,"Trust in employees, awesome Compensations & Benefits.",Rapid organisational changes takes time to manifest.,Be the first to find this review helpful
127,Best work place,"Oct 20, 2019 - BDA in Singapore",5.0,friendly working environment and the best place to develop myself,so far no cons founded yet...,Be the first to find this review helpful
128,Best Place to work,"Nov 3, 2019 - Sales Programs Associate in Bangalore",5.0,Great Work Culture Employee benefits Growth Opportunities,No cons for the company,1 person found this review helpful
