,title,author_info,rating,pros,cons,helpful
240,Account Executive,,5.0,"The most challenging and competitive work environments I've been around. Salesforce has incredible management and leadership to help enable and guide folks like myself through the challenging landscape of tech sales. Lastly, few companies promote equality, social service and professional excellence like Salesforce does.",Paid under market value and it's tough to rise through the ranks via promotion with the company being so large,Be the first to find this review helpful
241,Technical Architect,,5.0,"I love the opportunity to work with amazing set of people who are talented , inspiring and if given a chance then can build a rocket as well, If I have to tell you Salesforce is full of such people.","navigation through the organization chain, little or less clarity on what is going on at higher level.",Be the first to find this review helpful
242,Manager (Finance),,4.0,"- Very positive and exciting culture / environment. Everyone is happy to be here. - Flexibility (compared to last employer) - Team has been hands on in getting to know me and getting me up to speed - Good interaction with business partners (everyone seems eager to learn, help and do well)","- Have encountered ""too many cooks in the kitchen"" phenomenon, sometimes leaving things difficult to get done efficiently and effectively. - (Similar to other tech companies) Autonomy-focused culture makes for difficulty in making decisions because everyone's opinion must be heard (and accepted) - Still determining whether there's really the opportunity to suggest something different and prompt change. They say it is, but I have seen an actual tendency to stay within a ""safe"" box. Still TBD.",1 person found this review helpful
243,One month down - Loving it!,,5.0,- Great work events - Amazing team members - On-boarding process is efficient and smooth - Health and wellness opportunities are fantastic - Commuter cost assistance is a great perk - Trailblazer paths are really interesting and a great way to get to know the company and use as a tool - Concierge is insanely user friendly and an excellent resource,- Trying to figure out where I'll be sitting / changing buildings to in the next few weeks - Not having two screens to work from,1 person found this review helpful
244,Salesforce Tech,,5.0,Freedom & Flexibility allows a perfect work life balance,Pretty large company - makes it hard to get a full look at everything,Be the first to find this review helpful
245,Salesforce Review,,5.0,The culture and resources at Salesforce are fantastic. It is truly a family in spite of its size.,It can be difficult to understand the nature of specific roles until you are into conversations with hiring managers.,Be the first to find this review helpful
246,Account Executive - Growth Business,,5.0,Salesforce is a phenomenal place to work!,"Monthly cadence can be tough to keep up with, but management works with you to align with personal & professional goals to overcome the hustle.",Be the first to find this review helpful
247,Can't think of anything bad to say,,5.0,I sometimes wish I still worked there,I'm often glad I no longer work there,Be the first to find this review helpful
248,So far so good!!,,5.0,Great culture Great people Great benefits Great perks Great name I’m a little more than a week into my new role at Salesforce and loving it so far.,"At this point, nothing that I can think of. Though the interview process (for a Solution Engineer role) was quite challenging and time consuming. That’s not necessarily a con, as it allowed me to prove my value and interest in the organization, but it was something that was a little unexpected.",Be the first to find this review helpful
249,Great Company Overall,,5.0,Great company with great culture Great benefits and perks Flexible works hours and locations,Harder to build relationships with your team since you won't see them face to face as much. Everyone can work from home. So many resources and tools you need to learn from. It could be confusing at first.,Be the first to find this review helpful
250,"Vice President of Sales, AMER","Sep 6, 2016 - Vice President Sales in San Francisco, CA",4.0,Great products and people (for the most part). Benefits and office environment is great. Accountability and ownership are big value drivers for those who seek independence.,Monthly cadence for sales organization is difficult. The pressure to perform monthly sometimes works at cross purposes of developing a trusted advisor/relationship status with your clients.,5 people found this review helpful
251,Customer Success Manager,"Nov 18, 2016 - Customer Success Manager in Boston, MA",5.0,"One of the best companies in the world. Very fare, organized and give you room to grow.","If you are looking to coast this is not the place. They demand passion, energy, and helping all colleagues to achieve a customer focused company. If you the type of person who has said ""that is not my job"" then you will not fit the culture. Everyone at Salesforce is like a big family and you must contribute.",Be the first to find this review helpful
252,Best Internship!,"Dec 25, 2016 - IOS Intern in Palo Alto, CA",5.0,"- Incredible people, everyone is extremely talented but everyone is down-to-earth and willing to grab a beer and talk - Fast-moving, customer-driven culture that makes you proud of what you're working on - As an intern I got to work on stuff I wanted to work on, and made several features and fixes that went to production very quickly","Nothing really! Location (DT Palo Alto) is kind of a pain, since interns can't get parking permits.",Be the first to find this review helpful
253,Great and honest company,"Feb 21, 2017 - Anonymous Employee",5.0,"Great benefits, very nice culture. I have heard phrases along the lines of ""at least we're paid well to do it"" multiple times in passing now. There is a saying that if others at your company talk about being underpaid, chances are you're being underpaid as well. This place is definitely not the case.",Some old technology. Salesforce is a successful business running on an 18 year old application.,1 person found this review helpful
254,Sr Strategic Account Executive,"Mar 15, 2018 - Senior Account Exdcutive in Mobile, AL",5.0,Been a great experience working with a group of dedicated and focused individuals. Ohana and the core values are truly the core and focus for all decisions,"As they grow and expand the tribal knowledge can be challenging. Gmail and suite is TERRIBLE! Hours are wasted in finding, sorting etc., email. Calendar and conferencing tools need improvement",1 person found this review helpful
255,So far so good!!,"Jun 11, 2018 -",5.0,Great culture Great people Great benefits Great perks Great name I’m a little more than a week into my new role at Salesforce and loving it so far.,"At this point, nothing that I can think of. Though the interview process (for a Solution Engineer role) was quite challenging and time consuming. That’s not necessarily a con, as it allowed me to prove my value and interest in the organization, but it was something that was a little unexpected.",Be the first to find this review helpful
256,"Lots of flexibility, work-life balance, competitive salary and benefits","Jul 29, 2018 - Anonymous Employee",4.0,"Opportunities to work on own projects, volunteer to heart's content, and make an impact on interesting and innovative products and services","Unlike other companies in the Bay area, Salesforce is a very marketing- and sales-led company. While engineers and product owners are encouraged to innovate and make an impact, the founders are very much in charge, and the company is driven by Dreamforce and marketing messaging. (Despite this, hard work can also make a huge impact, even when it's not aligned with Marketing, Sales, Dreamforce)",1 person found this review helpful
257,SALESFRAUD,"Jul 29, 2018 - Account Executive in San Francisco, CA",2.0,HQ offers nice perks for employees such as snacks and coffee.,"Uber policial on social issues, but only when the Salesforce machine can generate free press and market share awareness. The company as a whole discriminates against older employees, in favor of millennials. Ignored the social issue going on at the border, due to having larger contracts with the federal government.",12 people found this review helpful
258,A corporation that feels like a family,"Oct 24, 2018 - Anonymous Employee in Hillsboro, OR",5.0,"I worked for both large and small companies, and even though Salesforce is not small (over 30000 employees and counting!) it does feel like one, rather than a megacorp. I don't know how they've been able to retain this culture for almost 20 years but it is definitely working! Salesforce does care about its workforce as a whole and every member of the family individually.",Can't think of any right now.,Be the first to find this review helpful
259,Best Place to Work,"Feb 4, 2019 - Senior Specialist in San Francisco, CA",5.0,"Everything you've heard is true - wellness reimbursement ($100/month), great benefits, up to 10% of salary bonus, commuter benefits, snacks/beverages complimentary, free work out studio and classes in SF, psychologically safe work environment, positive/energetic co-workers, flexible work schedules (WFH in some positions), inspiring leadership","Some processes are still painfully manual, some ""Face time"" obligations.",2 people found this review helpful
260,Director,,5.0,Great benefits and caring for the community.,Get ready to live month to month in sales. That's all it's above. Make the month.,Be the first to find this review helpful
261,Great Company!,,5.0,"Culture, Perks, 401k matching, opportunities to grow, great pay","Nothing, nothing, nothing, nothing nothing",2 people found this review helpful
262,This place is AMAZING,,5.0,"Everyone talks a good game about caring for their employees or feeling as though an employee is a part of a family. And, speaking from experience, that's usually where that sentiment ends...with talk. Salesforce consistently PROVES how much they care about their employees, their customers and their customer's customers. I have never worked for an organization that worked so diligently to provide a healthful, relaxed and comfortable place in which to excel. This organization is truly unique and truly head, shoulders, knees and toes above every other place I've ever chosen to be employed. They earn their ""Best Places to Work"" status every day and I am proudly soaking up the culture of inclusiveness, equality and contributing to the greater good. Happy days!",There are more health snacks than I can allow myself to eat on a daily basis...,1 person found this review helpful
263,Great place to work.,,5.0,"Strong values, Employees always encouraged to do the right thing.",Company too big for individual contributors to make any meaningful impact.,1 person found this review helpful
264,Truly Amazing,,5.0,"In my first 30 days this journey at Salesforce has been nothing short of inspiring! I have been in the workforce over 35 years, working for corporate America, small companies and large tech companies as well. Never have I felt so much enablement, support and encouragement as I have felt and witnessed here at Salesforce. I have always told my family, ""company culture"" is more important than salary and benefits.","It's hard not to be overwhelmed in the first couple of weeks, but all the pieces start to connect, just keep moving...",1 person found this review helpful
265,"Co-Prime Account Executive, Heroku",,5.0,"Great onboarding. Amazing experience thus far. Heroku is a strong team, and is getting much more Enterprise focus recently. There's no wonder why Salesforce was voted Fortune Magazines #1 Best Company to Work For in 2017.",None that I can think of,Be the first to find this review helpful
266,Great company to work for.,,5.0,"Dynamic and awesome culture, lots of social events. Lots of training and knowledge sharing opportunities. Great benefits. Working from home frequently (this may depend on the team). ""No meetings"" Thursdays.","Personal con is that my commute takes now longer. Luckly, Salesforce provides shuttles to/from SF.",2 people found this review helpful
267,"Marketing Director, Customer and Market Insights",,4.0,"Fast-paced environment where you can contribute and grow while working with the smartest professionals on the planet. Salesforce is a company that believes in social justice, equal pay, equal rights and giving back.",Finding the right managers and mentors is critical to finding rewarding opportunities to grow. It is important that you always be looking for new opportunities. Staying in one position for too long may get you typecast as a professional that can't grow or go in new directions.,1 person found this review helpful
268,Incredible,,5.0,"Great environment, friendly and ambitious people, great work/life balance, amazing benefits.",None that come to mind,Be the first to find this review helpful
269,Mid-Market Sales,,4.0,"Good benefits, very social atmosphere","Work is really your main focus, both from 8-5 and then afterwards with your team. Super young employee population....not great for those with a family.",Be the first to find this review helpful
270,Account Executive HLS,,5.0,Amazing on boarding experience. The company culture really shines and everyone is very helpful and willing to give time to help out.,Very fast paced and time consuming tasks,Be the first to find this review helpful
271,"Wonderful Culture, Wonderful People",,5.0,"Supportive folks are everywhere at this company. Everyone wants everyone to be successful because they want the company to be successful. There's a wonderful culture of giving, Ohana, and equality. Everything at Salesforce moves fast, but it's so worth it.",None that I can think of besides a common tech company perk - food,1 person found this review helpful
272,A company with heart,,5.0,"Volunteering and giving back is usually just feel good marketing but helping others is built right into the salesforce business model. The Volunteer Time Off policy grants every employee 60 paid hours each year to support their favorite causes, and this begins with day 1 orientation. One of the first things I did at salesforce was have breakfast with other new employees, and then hop on a bus to transform a community garden. This is only one example of how Salesforce has heart, but look to the many causes of our outspoken CEO Marc Benioff and you'll see Salesforce leads by example.",Salesforce is growing at an astounding rate and the challenge is to keep its character intact.,1 person found this review helpful
273,Sales,,4.0,Good product. They Focus on the customer And they’re all experience. People are very friendly and the CEO is very dynamic.,The company is huge and very bureaucratic. I have strange rules for sales people and have hired too many people for the number of accounts.,Be the first to find this review helpful
274,"Hard work, but amazing!",,5.0,"The 1-1-1 Model here (google it) and a tangible benefit that results of it is 7 full days of VTO (volunteer time off) to be used responsibly at your discretion. Matching gifts to a non-profit of your choice. - Benefits here overall are incredible - ESPP is attractive - Time off is generous - comp package works in your favor- i.e. hard work does in fact = revenue. - equipment is all up-to-date and excellent (iPhone as work phone, and MacBook as laptop) - Training that consists of bootcamp in San Francisco, and further training at a local hub. Ongoing trailheads and updates also keep you on your toes. - Fast-paced environment - Great culture - Talented professionals - Collaborative environment across different segments - Brand recognition - Smooth employee processes in the background (payroll, time logged, benefit tracking, incentive tracking, employee profile, etc). - Continuous acquisitions of companies continues to strengthen our products and offerings. - Snacks, events, and happy hours - Flexibility and autonomy given to consult with your clients - Networking opportunities here are endless","- You can feel ""left-behind"" here at times, so it's crucial to stay organized to keep up with the pace, especially early on. - Work-life balance (self-induced): it's easy to become attached to your work and your accounts, and it trickle over into your personal life after hours, or on weekends. - Difficult quota to hit, but that's for a reason. if this were easy I suppose they would let anyone in. Can't think of anything else. It's hard to find things wrong with Salesforce, in fact this section took me a lot longer to provide the bullet points above then the pros section.",174 people found this review helpful
275,Accommodation Manager/ Employee Relations Operations,,5.0,"Ohana culture, strong Employee Success Team (HR), great technology, high paced culture. Very excited to join the Ohana, and looking forward to an exciting career at Salesforce!",No Cons as of yet.,Be the first to find this review helpful
276,Associate Business Partner,,5.0,Great culture and teammates. Very supportive environment,Very competitive to get a job change,Be the first to find this review helpful
277,Good place to work but room for improvement,,3.0,Benefits! Work/life balance Giving Back/VTO High growth company Great company to have on a resume,T&E - little to no budget for team events or travel to see customers/team members Cliquey - execs mostly keep to themselves Where's Marc? Haven't heard him on a Quarterly Call in awhile...,3 people found this review helpful
278,Sales Development Representative,,5.0,"I feel so lucky to be apart of Salesforce. Interview process and bootcamp was fantastic and everyone truly wants you to succeed. I was skeptical of the “Ohana” culture prior to my first day but it is the real deal. Yes, it can be stressful at times but that is to be expected with any leading company.",There are truly no cons about working at Salesforce. I love everything about this company. Keep doing what you’re doing.,Be the first to find this review helpful
279,Recruiter,,4.0,"The culture and people are fantastic! Everyone is very friendly, and I'm happy to come into work everyday.",No free lunch or dinner,Be the first to find this review helpful
280,Business Development Rep,,4.0,"It is a company build and run to change the world. However, there is a lot of opportunities to give back and work on other projects you are passionate about.",Constantly asked to do double what you did before in half the time. Very easy to burnout and you constantly feel like your feet are to the fire.,Be the first to find this review helpful
281,Salesforce Developer Support,,4.0,"Great company values, very well run corporation that sees genuine value in diversity and transparency. Innovative and technically excellent tech workforce.","Rapid pace of innovation and growth cause issues with adoption, and support of new technologies. New technology is often released without adequate testing, and support can lag behind in learning and adopting new technology.",1 person found this review helpful
282,Easy to get lost in the sea of things,,2.0,"- Good pay and great benefits - Coworkers are among the most friendly, genuine, inclusive people I've met in my life - Comfortable job: you can be complacent and clock in / out for a very long time without any repercussions","- Work environment is highly politicized in projects, promotions, and basically anything you do - Not everyone is pulling their own weight - Very little accountability in the organization. The company did away with formal performance reviews a few years ago. There is a culture of praise here, so constructive feedback is rarely given - Roles and teams are incredibly silo'd now. This is not the place to be if you're looking to grow and develop your career in a multitude of different ways - Easy to get lost in the sea of things: the company has grown way too large in recent years - Growth and progression are slow. Career development is non-existent if you remain in your current position. Since there are so many employees now, each job that an employee has is incredibly specific, so if you want a change of pace, you'd have to change out of your role entirely Also, for what it's worth, I strongly believe that Salesforce actively reaches out to news outlets and pays to get on those ""Best Employer"" lists that come out yearly. I wouldn't be surprised if they had people in HR write numerous positive reviews to artificially inflate the Glassdoor scores.",14 people found this review helpful
283,Alliances Manager,,5.0,"Culture, energy, benefits, flexibility, and work ethic.","Upward movement, LOT of changes,",Be the first to find this review helpful
284,"Mostly good, easy place to work.",,4.0,Good product and culture for sure,So much beaucracy that its choking,Be the first to find this review helpful
285,What a place to learn,,5.0,Amazing company culture. You will become a sales assassin,"No cons, No cons, No cons",1 person found this review helpful
286,Account Executive,,4.0,Great company Tons of opportunities Startup culture Global company,Must drink the daily punch which is ok but sometimes too much!,Be the first to find this review helpful
287,Great,,3.0,Great company to work for.,I can't think of any cons.,Be the first to find this review helpful
288,"Great Culture, Outstanding Growth, but Aging Technical Infrastructure",,4.0,"The culture at Salesforce is great. People and teams are collaborative and helpful overall, and people seem to work within the framework that we're working toward a shared goal as opposed to competition against each other as I have experienced at previous jobs. Management seems willing to listen to employee's ideas, concerns, and grievances and do what they can to address them. Lots of decent perks, good pay (I'm not in the bay area, so can't speak for there), and reasonable workloads.","Working on the core Salesforce product can be a huge pain and giant time sink. They've let it go way too long to address the numerous issues that make developing on it a pain. The company also has a bad habit of Not Invented Here Syndrome, so instead of using something like React for our UI we're writing our own component framework. To make matters 10x worse it's all driven by Java ;_;",2 people found this review helpful
289,Great place to learn and grow,,5.0,-supportive and fun culture -great benefits -opportunity to learn,-very high quotas (high commission comes from exceeding quota),Be the first to find this review helpful
290,Amazing Culture,,4.0,Great work culture. Smart people. Good Work life balance.,Average Compensation and Perks. Big company like management.,Be the first to find this review helpful
291,Hybrid Engineering is causing chaos,,3.0,Great company culture. Good work life balance. Smart developers with good problem solving skills. Great career growth opportunities. Planning of work is better than most other companies that I have come across.,"Hybrid Engineering has pros and cons. However, in Indy, the strategy for hybrid transition is causing a significant loss in engineering productivity. First, Pros: 1.) Hybrid engineering has brought more focus on using contemporary tools for automated testing. 2.) This helps in improving system reliability and make developers better at their jobs since testing is not considered an afterthought anymore. 3.) Huge investment in automated testing upfront is a good overall strategy that will help in system scalability and reduce buggy software releases. Cons: 1.) The idea for depending more on automated testing than on manual testing has translated into demanding all manual / semi manual qa testers to learn how to code. 2.) This is the strategy that has not panned out at all. While, the self help tools like online courses, mentoring resources and in-team guidance have been a proactive ongoing effort, this approach is taking massive hits on productivity for developers as well as for testers all around. 3.) You can find developers on any given day spending quite a bit of time (hours at times) going over basic step by step process (over and over again) with the testers to resolve minority non-mission critical bugs. 4.) Testers, especially who are not from a programming background / havent coded in a while, are overwhelmed and stressed out about the tickets they have to complete each sprint. 5.) For a company that champions engineering productivity and no interruption time for developers, developers are spending less time on quality features/innovative/disruptive work and more time getting bogged down by the process+manual testing+ incremental work . Dont get me wrong, the notion of ohana is embedded deep in the organization and engineers are glad to help their peers anytime. However, this is a massive hit on productivity.",9 people found this review helpful
292,The hype is true!,,5.0,"Incredible technology, culture, and benefits. This is a world class organization that everyone feels thankful to get to work for. That energy is present through out the organization.","This will be the best job of your career that will take you to new heights, but it will be long hours and intense travel. Know that before signing up.",3 people found this review helpful
293,Great place to work.,,5.0,The company takes care of all employees and makes sure everyone is happy with their job and feels valued.,There is a political bent to executive leadership that can rub some employees the wrong way.,Be the first to find this review helpful
294,Sales,,1.0,Products and Market Leader and strong client support.,"All of the discussion about Equality is all marketing. There are so many situations where there is discrimination and now because of all of the news, placing people in places causing now other discrimination.",26 people found this review helpful
