,title,author_info,rating,pros,cons,helpful
100,good company,"May 11, 2022 - Senior UX Engineer",5.0,great place to work and good culture,The pay is fair but i see opportunity to be competitive as other companies,Be the first to find this review helpful
101,Great,"May 11, 2022 - Solutions Engineer",5.0,"Great team, great product, endless opportunities",Politics sometimes get in the way,Be the first to find this review helpful
102,Great place to work,"May 11, 2022 - IT Suppoirt",5.0,"Work flexibility, Allowances, Focus time",nothing as such until now,Be the first to find this review helpful
103,Company Review,"May 12, 2022 - Salesforce Support Engineer in Hyderābād",5.0,Best company to work with,No Cons as of such,Be the first to find this review helpful
104,good place,"May 25, 2022 - Product Manager in Tel Aviv-Yafo",4.0,big and stable company with a lot of growth,you are not a decision maker as in small startup,Be the first to find this review helpful
105,Great Place to work; increase diversity,"May 26, 2022 - Account Executive",4.0,Superb tech Great company values Many benefits and perks A true sense of community & culture,Middle management from the northern beaches of Sydney are out of touch with the reality of customers.,Be the first to find this review helpful
106,How to destroy companies the Salesforce way,"Jun 12, 2022 - Account Executive in London, England",1.0,Great benefits package Work from home,Toxic culture Incompetent leadership Disdain for customers More bureaucratic than the Soviet Union Politicised Unrealistic sales targets,6 people found this review helpful
107,"solid place, solid team solid product, a grindhouse of work","May 4, 2022 - Business Development Representative",5.0,great team great product amazing leadership lot of career growth if you play your cards right,"takes a lot to ""get "" salesforce being so big of a company -lots of cliques and groups. if you are not in with the ""cool kids"" you wont go far at salesforce",2 people found this review helpful
108,Best Company,"May 7, 2022 - Salesforce Solution Engineer in London, England",5.0,Best company to work for,No cons in my opinion,1 person found this review helpful
109,Great place to work,"May 10, 2022 - Account Executive in Stockholm, Stockholm",5.0,"Good leadership, great environment, good pay and benefits. Onboarding is the best I have seen",None to share about Salesforce,Be the first to find this review helpful
110,Excelente company,,5.0,Competitive benefits Awesome culture Competitive salary Flexible work policy,I didn't have any issues for now,Be the first to find this review helpful
111,A Decade well spent!,,5.0,Spend a decade here and this company gave me most of the things that I have in life right now! Unmatched work culture and growth in a company of this size!,Company is getting bigger and starting to get siloed.,Be the first to find this review helpful
112,Awesome Place to Work,,5.0,It is a great place to work with some brilliant minds who are always ready to help you. It provide a lot of opportunities to grow your self.,you will be in love with salesforce,Be the first to find this review helpful
113,gREAT PLACE TO WORK,,5.0,Extremely employee-friendly. Focused on career development Tons of benefits and perks,none. I dont see any cons,Be the first to find this review helpful
114,Amazing,,5.0,"Incredible culture, surrounded by smart people. Amazing benefits",Can be competitive but that isn't a bad thing,Be the first to find this review helpful
115,Great company,,5.0,"great place to work , really recommend",no issues or cons here,Be the first to find this review helpful
116,Great company to work,,5.0,"Great work life balance , great benefits , Supports family values , great career opportunities.",I don't have anything so far.,Be the first to find this review helpful
117,Great place to work and grow,,5.0,"Success anywhere (and any time) Great workplace culture, love the diversity Lots of learning opportunities Great employee benefits",Breakneck pace Can be quite streeful,Be the first to find this review helpful
118,Amazing Culture,,5.0,"Culture, team, opportunities, diversity and inclusion",Slow progression and head count issues,Be the first to find this review helpful
119,Great,,5.0,THE Company where the humain is the most important thing,Nothing to say against Salesforce,Be the first to find this review helpful
120,AAA,,4.0,"Well treated, good salary, fair manager",Can be high pressure at times,Be the first to find this review helpful
121,Work life balnce,,5.0,Salesforce is an employee centric company that extends some great benefits around work-life balance.,Work could sometimes be stressful,Be the first to find this review helpful
122,Food is good,,5.0,"Great food when available, but not always",Food not always available when there,Be the first to find this review helpful
123,Technical Consultant,,4.0,Surrounded by subject matter experts,Opportunities due to nature of Professional services. Culture when promotions come around. A lot of it's who you know not what you have done,Be the first to find this review helpful
124,Salary,,5.0,Great salary comparing to the market,Too many sales people - really depends on the team you joined,Be the first to find this review helpful
125,Best Pay,,5.0,Compensation will be way better than you imagine,"Support role, guess it will be difficult to change carrier to development",Be the first to find this review helpful
126,great company to work for and learn,,5.0,work life balance pay culture,stock refresh not there stock prises going down,Be the first to find this review helpful
127,Good Company,,4.0,"Good leadership, culture, industry leaders, friendly and helpful people. Ticks a lot of boxes.","Long onboarding process, a lot of different products to get your head around but it offers a great learning experience. Territories are small, AE's don't tend to manage more than a few deals at a time.",1 person found this review helpful
128,Unbelievably Awesome,,5.0,"Great Culture, Great Work Life Balance, Great Benefits, Great Compensation, Friendly Environment, Great Opportunities to Grow Quickly.",The technology I’m working is not a futuristic one.,1 person found this review helpful
129,Account executive,,4.0,"Very well organised, many processes for AEs to succeed","A lot of information to take in, many tools and processes",Be the first to find this review helpful
130,Great place to grow your Salesforce Skills across different Platforms,"Mar 1, 2022 - Cx Engineer in Dublin, Dublin",5.0,"The atmosphere is very healthy. Great work/life balance, you have plenty of time to grow and learn new skills, such as certifications. Hence, you have the ability and flexibility to organize your own work schedule, and trust is given from day 1 once you have demonstrated you bring impact to the team and being responsible for your work. Really recommend applying when early in a salesforce career.",Missing seniors in the team that have a good level of platform technical knowledge to lead and motivate others.,Be the first to find this review helpful
131,"Interview process, worklife and pay package","Mar 13, 2022 - Technical Architect in Toronto, ON",5.0,"There were 3 rounds for the TA Position. 1. Technical: Mainly focused on Integrations, Projects I worked on, Security, Encryption related questions. 2. Consulting 3. Panel Interview: Like CTA, you need to present a project scenario if your choice which was implemented by you in your past projects. The presentation should contains problem statement, requirments, implementation strategy, solution, etc.",Nothing I can think of,Be the first to find this review helpful
132,Working at Salesforce,"May 5, 2022 - Business Development Representative",5.0,Very good benefits across board.,Fast paced but it’s not for the weak,Be the first to find this review helpful
133,Salary,"May 7, 2022 - Account Executive in Dublin, Dublin",5.0,Great salary comparing to the market,Too many sales people - really depends on the team you joined,Be the first to find this review helpful
134,Good place to get your career started!,"Jan 15, 2022 - Business Development Representative in Toronto, ON",5.0,"I worked at a very small SaaS company before coming to Salesforce. I wanted my next step to be at a company where there were options for moving up career-wise and have the potential to increase my income. Both SDR and BDR roles can be a grind but you learn a ton, have great colleagues and are compensated fairly for your successes. They also have good benefits, an ESPP plan and 401k / RRSP matching. Post-BDR, there are multiple AE avenues for you to explore (core, verticals, or co-prime) and other options such as becoming a Renewals Manager or Solution Engineer (though not as common). Overall, I would recommend Salesforce as a great place for people to get their career started.",Metrics can be intense sometimes and a grind.,Be the first to find this review helpful
135,Good Pay,"May 12, 2022 - Benefits in Toronto, ON",5.0,Great culture overall and benefits,Very political on the small dpts,Be the first to find this review helpful
136,Excelente company,"May 10, 2022 - Anonymous Employee",5.0,Competitive benefits Awesome culture Competitive salary Flexible work policy,I didn't have any issues for now,Be the first to find this review helpful
137,good,"Apr 23, 2022 - Cloud Sales Executive in Tokyo",4.0,"Year after year, product capabilities have been strengthened, and the vision that customers want to achieve can be completed by a single company.","The amount of information about the increasing number of products and their multiple Also, the number of recruits has increased so much that we are having a hard time dealing with those who do not have sufficient knowledge.",1 person found this review helpful
138,Great,"May 10, 2022 - Associate Technical Consultant in Casablanca, Greater Casablanca",5.0,THE Company where the humain is the most important thing,Nothing to say against Salesforce,Be the first to find this review helpful
139,Overall good,"May 19, 2022 - Strategy Solution Consultant in Toronto, ON",3.0,Good company to improve your current skill sets.,Squad structure - different culture according to different squads.,Be the first to find this review helpful
140,Great to company to work at,"May 3, 2022 - Software Engineer (MTS) in Tel Aviv-Yafo",5.0,Full flexibility Great managers Top technology,Less RSU than other companies,Be the first to find this review helpful
141,Top company,"May 3, 2022 - Account Executive in Brisbane",5.0,Great work life balance Very aligned to my values Good comp Great support Great family benefits Great alignment to help local community,Overwhelming amount of information coming a you all the time so you need to develop a filter,Be the first to find this review helpful
142,Great Values,"Apr 28, 2022 - Anonymous Employee in London, England",5.0,Amazing on-boarding process and values. Actively encourage all employees to participate in volunteering. Diversity and Equality is seen throughout the business,"Loads of information to digest, can sometimes be a little overwhelming.",1 person found this review helpful
143,Best Place to Be,"Apr 29, 2022 - Senior Business Architect in Paris",5.0,"Salesforce is the best company in the CRM Market today, from a product and from a culture and people standpoint.",None that I can think of,1 person found this review helpful
144,Good Company,"May 1, 2022 - Systems Specialist II in Hyderābād",5.0,Best Company to work in India,Technologies are changing day by da,Be the first to find this review helpful
145,One of the best companies to work,"May 1, 2022 - Software Engineer AMTS",5.0,Great eokr culture and perks.,Some teams have maintenance based work.,Be the first to find this review helpful
146,Great to enter at a more senior level,"May 1, 2022 - Solution Engineer in Sydney",5.0,"- Great culture, great perks, wellness days - Great people - Great learning community, great opportunities to develop and grow","At more entry levels, it takes longer to progress and the title is not reflective of the work you do. Eg Associate SEs are meant to only shadow and support builds, but often do their own demos from month 3, and are forced to stay as 'Associates' for min 2 years until they are ""eligible"" for promotion. Would recommend coming in as Senior SE or above. Internal promotes get much much less than the external market rate. Mgmt are willing to let go of internals and hire externals at the rate the internals were asking for and lose 6 months sales productivity for people who will take longer to ramp.",Be the first to find this review helpful
147,One of the Best Company,"May 2, 2022 - Developer Support Engineer in Hyderābād",5.0,Employee focused and benefits Very Best,Work Load sometimes becomes too much,Be the first to find this review helpful
148,"Great perks, great career progression.","Apr 30, 2022 - Senior Product Marketing Manager",5.0,Many challenges to solve Great colleagues to hang out Fun offices worth commuting,Toxic positivity Frequent leadership turnover Corporate mumbo jumbo,Be the first to find this review helpful
149,Great work culture,"Apr 30, 2022 - CSSA",5.0,"Good benefits, Good work-life balance, Equality","Management, Compensation evaluation issue, Opinion placement",Be the first to find this review helpful
150,Great Culture,"May 1, 2022 - SMTS, Quality Engineer in Bangalore",5.0,"- Employee benefits such as wellness reimbursement every quarter, Number of leaves, Good cafeteria food, focus on employee's health to name some - Great scope of innovation, no micro management - Managers are highly talented people here. You can look up-to them and discuss your issues in weekly 1:1. Managers are very much involved in employees well being - Transparency in company's and product's vision. From top level, you will get every information you would be looking out or not looking out",Could not find any cons,Be the first to find this review helpful
151,working at salesforce,"May 15, 2022 - Senior Customer Success Manager in Tel Aviv-Yafo",4.0,great company very structured hard to progress,"to big company hard to get noticed, salaries raise slowly",Be the first to find this review helpful
152,Chaotic,"May 8, 2022 - Customer Success - Director",3.0,Great benefits and extras. And some really good people as colleagues,Very chaotic. A lot of noise. Poorly defined processes and RACIs. They seem to have normalised this chaos. Very inefficient. May be good for someone starting their career. Challenging for someone who has worked in more efficient organisations. Over hire - senior people doing very admin heavy roles.,3 people found this review helpful
153,55555,"May 15, 2022 - Architect",3.0,"rom the beginning, Salesforce sought to make the world a better place through technology that builds stronger relationships. Between companies and their customers or between employees and their teams; Salesforce was founded with three foundational core values: 1. Trust, Salesforce wins through transparency, security, compliance, privacy and performance the trust of customers, employees and extended families. 2. Innovation, innovation is not only reflected in the design of software, but also includes encouraging employees to innovate within the company, encouraging employees to use their imagination, and allowing each employee to use their imagination to create miracles. 3. Equality, Salesforce believes that everyone should be seen, heard, valued and empowered to succeed, and listening to each employee's different perspectives fosters innovation, deepens human connections, and enables Salesforce becomes a better company. Salesforce has also built an employee communication site, where employees can speak up, make their own suggestions and the company's shortcomings.","Salesforce donates 1 percent of its software, 1 percent of its equity, and 1 percent of its employees' time to pay it forward. As a result, Salesforce has topped a list of workplaces that give back.",Be the first to find this review helpful
154,Business Development,"Apr 29, 2022 - Sales Development Representative (SDR) in Dublin, Dublin",5.0,"Great work/personal time balance. Great people, great culture.",Achievable but hard targets to reach - having regard to the inbound lead flow.,Be the first to find this review helpful
155,So impressed...,"Apr 29, 2022 - Account Executive",5.0,"Just starting, but the recruiting/hiring process has been nothing short of incredible. The communication, effort and details were on point. Cannot wait to get going with this energizing group of people that I have met with over the past couple of weeks.",None that I know of.,Be the first to find this review helpful
156,Amazing company to work!,"Apr 25, 2022 - Business Development Representative (BDR)",5.0,"Amazing work - life balance, management very nice and very supportive. Career progression, set for success and amazing learning structure.",Sometimes sense of chaos and lack of interdepartamental communication,1 person found this review helpful
157,Good place to start,"May 10, 2022 - Account Executive in Dublin, Dublin",3.0,"Good product, great benefits, lots of different paths to take",Very cliquey and can be a toxic environment,1 person found this review helpful
158,Great company culture outside of sales,"May 10, 2022 - Business Development in Dublin, Dublin",2.0,Generous professional development and well-being budget Good salary compared to industry average Good stock allocations Good healthcare / dental,- 1 promotion in 2 years in BDR EMEA team (open preference for external candidates) - Toxic positivity from management - Mass exodus following discussion of pay inequity,2 people found this review helpful
159,Best Company and culture,,5.0,"whatever you are reading about Salesforce, it's true","if you work in sales, you'll get stressed but that's everywhere",Be the first to find this review helpful
160,Best company,,5.0,Good place to work with,No cons at all here,Be the first to find this review helpful
161,Fantastic place to work,,5.0,"Inclusive company, great company culture and a lot of growth opportunities",Growing Pains Fast moving company Some clouds/solutions don't get the same care and attention as some others,Be the first to find this review helpful
162,"Great company, inconsistent management",,4.0,Salesforce does care about employees and often tries to do the best for them. It's also a great brand that will open up new opportunities for you down the road.,"My manager was weak. Her leader often bullied. Employee reviews and investigations determined that. Rather than dealing with the root cause, leadership focused on eliminating the complaints rather than addressing sub - standard leadership. This resulted in needless attrition of highly talented people.",1 person found this review helpful
163,Great place to work,,4.0,great benefits wellness days snack in the office paid voluntary time off 25 days vacation,Manage a global team - long hours Quite political at times,1 person found this review helpful
164,Mixed,,3.0,Smart people. High Growth. Great Offices. Good package and benefits.,Conflicted Culture. People being promoted in advance of experience.,2 people found this review helpful
165,Software Engineer,,5.0,Best place to work Onsite Opportunities,None that I can think of,Be the first to find this review helpful
166,Great workplace,,5.0,amazing work culture in Salesforce,None that I can think of,Be the first to find this review helpful
167,Very good company,,5.0,I've really enjoyed for Salesforce for a couple of years. It's a great company,Highly demanding and challenging operations and businesses. Personal and work life balance is difficult to achieve.,Be the first to find this review helpful
168,"One of the best IT firm, Great place to work",,5.0,Undoubtedly the best place to work.,"Nothing as of now, everything is great.",Be the first to find this review helpful
169,Amazing Apprenticeship Company,"May 6, 2022 - Apprentice Solution Engineer",5.0,Well supported through course industry qualifications,None that come to mind,Be the first to find this review helpful
170,Values and clear objectives,"Apr 6, 2022 - Strategic Account Executive in São Paulo, São Paulo",5.0,"The values of Salesforce was clear observed in people I've been interacting, but the process prove it too. Their commitment with information transparency and the clear objectives for company momentum explicits their focus.",Nothing contrary to alert. They still right on the way.,Be the first to find this review helpful
171,Great company,"May 8, 2022 - Professional Services Manager in São Paulo, São Paulo",4.0,"Great culture , salary seems average with the Industry. Grows like crazy thus internal processes are always broken but the good values , brand and climate compensates","Siloed areas that report to headquarters don't allow for ideal local collaboration. Internal support areas such as Finanças , Procurement , Legal , Payroll SUCK !",Be the first to find this review helpful
172,"Good People, Slow Processes","Jun 8, 2022 - Implementation Architect in London, England",3.0,Lots of useful training and learning opportunities Good and smart people,"Very slow-moving, and lots of beauracracy Surprisingly underpaid compared to other partners in the ecosystem",Be the first to find this review helpful
173,Best company I've ever worked for,"Apr 1, 2022 - Account Executive",5.0,"Personal development, Meaningful work, Talented colleagues, Value driven, Very focused on personal and mental health of their employees, Marc Benioff is just the bomb","You need a good work-ethic, be professional and effective, and take care of yourself. It is easy to get lost in work.",Be the first to find this review helpful
174,Good,"Jun 17, 2022 - Anonymous Employee",4.0,Good work exposure and culture,low pay as compared to industry,Be the first to find this review helpful
175,Great place to work,"Apr 25, 2022 - Director in Sydney",5.0,People are fantastic and company is truely driven by its values,Career progression not well defined outside of sales roles,Be the first to find this review helpful
176,Working experience,"Apr 24, 2022 - Account Executive",5.0,Everything is supreme. they take care of everything,"Harsh onboarding, its long, about 2-4 months, but its the best school in the industry",Be the first to find this review helpful
177,Great Place to Work,"Mar 16, 2022 - Business Development Representative in Toronto, ON",5.0,- Great compensation - Great benefits - High performing work culture - healthy corporate culture - good work/life balance,- a bit of an echo chamber,2 people found this review helpful
178,na,"May 4, 2022 - Senior Account Manager",5.0,great culture to work in,hectic and time consuming work,Be the first to find this review helpful
179,"Great values, average salary, slow career progression","May 22, 2022 - Solution Architect in London, England",4.0,"Good environment, great people, excellent company culture, low stress overall.","Average salary for the area, not many clear possibilities for career progression in less than 5 years, not very experienced professional services staff.",2 people found this review helpful
180,Poor Worklife balance,"Jan 25, 2022 - MTS-DevOps in Hyderābād",4.0,"Great benefits like free hifi food, iPhone, AirPods, monthly 5k for fitness, swags, 1 wellbeing day off per month free to move teams after one year in a team and complete process will be done anonymously without intimation to current manager working on latest technology","no internet bill reimbursement no work life balance at all , 12 hours work 365 days too many meetings engineers will be involved even in quarter planning for 7 ppl in team for sr.manager and sr.product manager. 3.5L their for employee education/certification but you can claim only if you pass... very bad, looks like for namesake this is there. small teams less than 10 ppl including manager and product manager.",8 people found this review helpful
181,Former Giant,"Mar 30, 2022 - Account Executive",2.0,Working for a massive organization Opportunity to learn and get exposure to an enterprise business operation Good Parental Leave Great 'badge' on your resume,"Dashboard Managers Micromanagement New reps are not setup for success, handed the worst territories and still expected to perform. Managers live in the past - talk about the days they crushed quotas, when everything was inbound, ignore the reality. Under pay for the market 'because they are Salesforce and can get away with it' Very heavy in-office culture and they struggled hard to adapt to WFH and remote onboarding Sell the Salesforce Way - most clients don't buy the Salesforce way...",8 people found this review helpful
182,"Great culture, great place to work","Apr 15, 2022 - Anonymous Employee",5.0,Inclusive division I work in that offers great opportunities to work with challenging customers and interesting tech,Limited career progression at senior level if not in sales,Be the first to find this review helpful
183,Toxic work culture,"Jun 8, 2022 - Business Development Representative (BDR) in London, England",2.0,Great benefits Amazing office Fun events Great rep,Unattainable targets Toxic management Bullying No team work,5 people found this review helpful
184,Work,"Jun 9, 2022 - Support Engineer",4.0,Great compensation Great benifits Nice work balance,Work is little more in support Have to consider many things and take up daily cases,Be the first to find this review helpful
