,title,author_info,rating,pros,cons,helpful
0,Contracts Intern,,4.0,"The Company is a awesome place to work, benefits excellent.","There is no much career opportunities,",Be the first to find this review helpful
1,Drinking from the Fire Hydrant,,4.0,- Community involvement is high with 7 days (56hours) of VTO during business hours encouraged - Better culture for women than most tech companies - Commitment to equality and doing better (appreciating no one is perfect and entrenched bigotry/sexism/racism takes a long time to overturn) - Chief Equality Officer Tony Prophet - Regular salary comparisons to eliminate inequality in salaries based on gender - Australian private health insurance paid by the company - Flexible working arrangements in some teams so you can work remotely,"- Depending on your role, your manager might not support the VTO during work hours - Depending on your role, you might not have any male salaries to compare against - The company and larger industry is still male-dominated, and you will still come up against entrenched sexism, this isn't utopia - ""Drinking from the fire hydrant"" is the work load. You either step up or leave during probation. If you do step up, you will reach your limit, then be overloaded again. If you're a workaholic and can balance that in a healthy way, great, but SFDC plays lip service to work-life balance in many departments. The work-life balance is often achieved through working from home while your family is asleep. - 99% of opportunities outside of the USA are sales-focussed",2 people found this review helpful
2,The Sky is the limit!,,5.0,Fantastic and inspiring colleagues Great Products Company Culture & Values Winning Attitude of people Lots of room to grow Cool new acquisitions making Salesforce even more attractive to partners and customers Trailheads - Life Long Learning is reality Volunteer Time Off,Pace of Innovation can be exhausting Very hard to get a good work-life-balance Dynamic Growth of Employees putting strains on Employee Success and sometimes creates chaos,Be the first to find this review helpful
3,"Great company with best culture, values and excellent product",,4.0,"Mark & Parker leadership Compensation wise it will be in top 3 companies in Hyderabad Core values and trust wise it is no. 1 as far as I know. Work life balance is great with optional work from home option Opportunities wise its improving a lot with lot more teams forming in Hyd. Nice Cafe bar and Free food is great a plus as it matters for working couple :) Occasional US/Europe trips for R&D Great benefits like fitness, optical reimbursement","1. Problem in hiring due to brand value - We need to increase brand value of Salesforce to attract best talent in India. 2. Some rules are not common across globe in Salesforce and thats confusing sometimes for example WFH, paternity leave etc...",3 people found this review helpful
4,Great Place to work,,5.0,"Best in class Benefits, Ohana Culture , Growth opportunities , equality , performance based appraisals",Metrics for employees in support makes employee feel a bit pressure,Be the first to find this review helpful
5,Growth,,4.0,"Tons of opportunity. Warm welcoming and great ""aloha"" ""ohana"" spirit. Lots of work. Flat org. Open environment and open-minded management. Not a place for those willing to lay low.","Initial stage as a service consultancy. You have to find your own way. LACA region is pretty new and needs a lot of external expertise to build itself. Although it is necessary, it is still like a Frankenstein of methodologies and approaches that vary with management and teams.",Be the first to find this review helpful
6,Sr Account Exec,,5.0,"Work with top talent, Innovative platform, Customer Success","Stressful monthly cadence, lots of prospecting, zero gimmes",1 person found this review helpful
7,A great company,,5.0,"Innovation, Giving Back and good compensation","Not a real manager, need to promote",Be the first to find this review helpful
8,Enjoyable Atmosphere,,5.0,"Free food, wellness allowance, educational allowance",Overly positive American culture can be a bit much at times,1 person found this review helpful
9,An abundance of opportunities,,5.0,"Management genuinely care about individual development and progression, competitive pay, great training and development, clear progression path and fun and welcoming offices to work in.","Rapid growth leading to short notice change and seems to leading be a rumour heavy organisation. Offices bursting at the seams due to relentless hiring. Desk shortages for hot deskers, insufficient parking facilities for those who have to drive (Dublin has poor public transport infrastructure).",Be the first to find this review helpful
10,marketing manager,,3.0,The team was very friendly and nice.,Nothing in particular to discuss here,Be the first to find this review helpful
11,Best company I've ever worked for!,,5.0,Salesforce is like a family and really lives the one Ohana Spirit! Benefits are great! Volunteering time off. Super smart colleagues.,"Keeping up with everything. Very fast paced. You can easily get lost. Required learning path, certifications and badges for your role can be tough. High pressure on getting certified starting on day 1!",1 person found this review helpful
12,Senior Business Development Representative,,5.0,"Motivational, charitable, worried about employees",growing in a fast way,Be the first to find this review helpful
13,Professional,,4.0,It is a fast growing company,Right now I cannot see any cons,Be the first to find this review helpful
14,A company that takes care of its employees,,5.0,"Salesforce understands that happy employees work better and makes sure you are happy, through good salary, benefits, flexible working, great offices, a diverse employee population, etc...","We work way too much. It's not necessarily that there's management pressure for it, but we just feel passionate about the company and our work, so we end up working all the time. It takes conscious personal and management efforts to ensure we stick to not working, evenings, on weekends and holidays.",1 person found this review helpful
15,Top class employer,,5.0,"7 days a year paid time off to volunteer (VTO) for the charity of your choice. Fabulous offices. Pay, pensions, wellness payments, yoga, bike racks, central london. A CEO who really wants to change the world and believes in doing the right thing.",Nothing that would make you think twice about signing up.,1 person found this review helpful
16,"Salary is good, people are fine",,4.0,"Salary, smart people, office environment , vision are good. It is good enough that I don't have to make any comparison outside the company","There seems not enough path to change role. Also, in branches, sales members are treated like a king and less attention for back office employees",Be the first to find this review helpful
17,Technical Architect MC,,4.0,Fast paced environment. Plenty of challenges and opportunities if you can connect with the right people,Too much work means less play. Hard to progress in the current role,Be the first to find this review helpful
18,"Infrastructure org is worst, Ex-MSFT atelier",,1.0,"- Work life balance. - The value of Trust and Security. - Volunteering, 1:1:1 model - Agile - Free Food - Lucky for you if you are part of R&D/Engineering team *not* Infrastructure org",- Ex-Microsoft employee factory in infrastructure org. - No innovation or automation opportunities provided across multiple teams especially in infrastructure delivery. - Silo teams/individuals working for their own growth and stock renewals. - Lack of transparency from Ex-MSFT Management. - Cross-cloud collaboration is worst. - People outside HQ (San Francisco/US) are left to their own fate. - No encouragement from local managers on career growth. - No encouragement from local leadership to participate in OOM. (Opportunities in different teams) - People working in infrastructure org are treated as third class citizens.,22 people found this review helpful
19,Supportive and encouraging working environment,,5.0,"Excellent benefits, supportive management structure that always encourage innovation. Good access to relevant external training opportunities.",None that spring to mind,Be the first to find this review helpful
20,Account Manager,,4.0,Fantastic suite of expanding market leading products allowing you to resonate with most customers interested in innovating and bringing their business to the next level. Autonomy to get out there and sell without too much interference as long as you are closing!!,Too many sales people and ever diminishing territories. Lower than average basic salary and huge competition for management roles within sales. High attrition of AE's with new new hires from outside poorly supported with a high failure rate.,4 people found this review helpful
21,Enterprise Account Executive,,5.0,A spectacular place to be right at this moment. Salesforce is leading the transformation to the fourth industrial revolution. A lot of exciting opportunities with a great team.,Work life balance is a challenge but it is supported by management.,Be the first to find this review helpful
22,"Great company to work for, but some projects might be boring",,4.0,"Decent pay, RRSP matching, stock options, great colleagues. 4 weeks of vacation only after 2 years of employment and 5 weeks after 5 years.","Frequent changes of priorities, legacy work with outdated technologies. Hard to move up a career ladder, but that is caused by the seniority of the peers.",Be the first to find this review helpful
23,The right place to be,,5.0,"Innovative, fast, amazing company. Work hard, play hard. Working like in a Family",Hard work and challenging environment. For many but not for all,Be the first to find this review helpful
24,Great company to work for,,5.0,"Great company, products, culture, people, benefits. 10/10",N/A N/A N/A N/A N/A N/A,1 person found this review helpful
25,People Managers not great in Hyderabad Office,,1.0,"- You will find great individual contributors to work with - Work is good in some teams, but not in all teams - Good work-life balance - Good pay",- Some managers say trust is no.1 priority but they don't seem to trust the employees - Some managers don't encourage OOM and trouble the employees who try to move to other teams through OOM - Manager's are hardly technical and fear getting technically challenging work to Hyderabad center - Some managers favoring selected employees and providing them with favors. Managers hiring their relatives in their hierarchy which should not be allowed.,9 people found this review helpful
26,Great company but the rot is starting to show,,4.0,"Supportive overall, great, flexible work environment and work-life balance. Aggressive direction by top management to do the right thing and improve products.","Mid management showing the classic signs of maturing IT companies. Ethnic managerial cliques that only hire subordinates from their culture. Lack of rigor or attention to proper processes and procedures. Overselling internal developments and projects to upper management solely to obtain promotions. ""Don't care"" attitude and lack of transparency. ""We'll fix it in phase 2"" attitude to badly-planned projects. Phase 2 never happens though.",5 people found this review helpful
27,Best company I have ever worked for,,5.0,"Leadership who empowers you to make decisions, and stand by them thereby promoting individual growth of team members Excellent work/life balance opportunities Excellent benefits, bonuses and employee stock purchase program","At this moment I honestly cannot think of any legitimate cons to working for Salesforce. Any company will have unique challenges which will require adjustment on the part of staff, and Salesforce is no different. That isn't a con, but merely reality.",Be the first to find this review helpful
28,This is I had been looking for my entire professional life!,,5.0,"I have been a professional for about eight years have held various positions with different employers in different locations - Salesforce is by far the best place to work. The culture is amazing and it is felt on a daily basis. As an employee, I feel valued and trusted; Salesforce invests a lot in its employees and the career opportunities are incredible. I wouldn't want to work anywhere else.",I can't say that there are any cons.,3 people found this review helpful
29,April 2017,,4.0,"Great product, vision, and innovation",The problems of growing quickly,Be the first to find this review helpful
30,Easily work with Exchange Email Recovery,"Mar 22, 2017 - Anonymous Employee",5.0,"In company there are great people that work and they also make it pleasant for another to work there. The location is also too suitable for users to travel as well. For designer, there are lots of opportunities for working on something very interesting. In other words, we can say that the company has great and excellent communications, mind-blowing training and the great service user’s participation I have ever seen.",Nope fraud from my side as we need to find it’s in ourselves first,Be the first to find this review helpful
31,Customer Success,"Mar 18, 2017 - Senior Customer Success Manager in São Paulo, São Paulo",5.0,Ohana culture; Product; Collaboration; onboarding;,Senior management priorities; no career conversations;,Be the first to find this review helpful
32,#dreamjob!!,"Mar 13, 2017 - Recruiting Manager",5.0,"The people are incredible, hence the culture is amazing. We are leading the way in innovation in cloud technology and are growing at a phenomenal pace.",Not enough people know how awesome Salesforce is but the market is slowly becoming aware of what we do and the incredible impact we can have on their businesses and their customers.,1 person found this review helpful
33,Best place to Work :),"Mar 29, 2017 - Business Development Representative in Dublin, Dublin",4.0,- Great teams - Clear career path - Good compensation - 1-1-1 Model - Great Sales school,Some regions are managed poorly but everything goes really fast pace @ Salesforce so it doesn't last. Management need to be more balanced between regions.,Be the first to find this review helpful
34,Good place to exercise best practice,"Mar 24, 2017 - Sales Representative in Singapore",4.0,"Great work place Friendly team, helpful boss Good room for career development",Very fast pace A lot of rules to follow,2 people found this review helpful
35,INCREDIBLE PLACE TO WORK,"Mar 10, 2017 - Account Executive in Montreal, QC",5.0,"Truly, honestly, a great place to be. It's not hard to see why employees rave about working here: the culture is genuine (they do EVERYTHING to help you succeed), the people are great and hard working, their products are leaders in every category, and you make a ton of money.","If you're not someone that likes a go go go environment, this is not the place for you. Numbers don't lie, and you are tracked on everything.",1 person found this review helpful
36,Account Executive,"Mar 7, 2017 - Account Executive in London, England",3.0,"Fantastic company good introduction into the world of SaaS selling. Thier are so many pros working for Salesforce, for example, the offices in Heron Tower are breathtaking - will inspire anyone. The quarterly Town Halls are great to keep everyone geed up and in the know. Great insight into some of the top businesses in the world and you get to speak with and learn from some of the best in the industry.","Management or lack of Management. Misunderstanding in selling solutions - so many solutions when faced with a customer can become confusing to the customer what exactly they are speaking to SF.com about. Is it a CRM, Marketing Platform, Lead gen, Web Personalisation, Ad platform, Services?? I feel the AE's are sometimes spread to thin with so much to offer.",10 people found this review helpful
37,A company with strong values,"Mar 12, 2017 - Anonymous Employee in Sydney",5.0,"- Great values that you are actively encouraged to practice: equality, giving back, trust, customer success - Work on exciting projects and engagements - Some great people and and an inclusive Ohana culture - Good compensation, good perks (medical, stocks, stocked kitchen etc.) - The 1-1-1 model that allows us to volunteer up to 7 days per year","- Can be stressful at time, and a real drive to perform, sell and grow at a rapid speed - Be prepared for long hours from time to time",Be the first to find this review helpful
38,Account Executive,"Mar 24, 2017 - in Dublin, Dublin",2.0,Very good salaries and a visionary CEO.,Management are always moving the goal-posts.,3 people found this review helpful
39,CIT,"Mar 8, 2017 - CIT in Dublin, Dublin",5.0,sales profits hard working challenge,hard work hard work hard work hard work,1 person found this review helpful
40,Senior Director,"Mar 20, 2017 - Senior Director in Toronto, ON",4.0,compelling vision great leadership Learn a lot smart people awesome products make a difference to the community,"work life balance is difficult to achieve. getting too big, bureaucracy and politics is growing",2 people found this review helpful
41,Account Executive,"Mar 3, 2017 - in Sydney",2.0,- Decent Pay - Great Benefits - Good Training and Development,- Brainwashed culture exists using Orwellian terminology like #dreamjob and Employee Success for HR - High school fist bumping mentality - Constant hypocrisy from the predominantly Caucasian management team who preach about diversity.,15 people found this review helpful
42,Great place to work,"Mar 7, 2017 -",5.0,"The team is supportive, management generally listens, opportunity to grow and change roles.",For those who don't like change - this is not the place for you. If you thrive off change - you will be right at home!,Be the first to find this review helpful
43,Voted Best Company to Work at for a reason!,"Mar 5, 2017 - Account Executive in London, England",5.0,"Salesforce is all about culture, collaborating with individuals with similar values, goals and ambitions. I was looking for the next big step in my career, whilst working for a top tier 1 tech company that also valued giving back to the community - Salesforce meets both those requirements, working for a tier 1 global tech company that has core values of ensuring all staff align themselves with charities and organisations where they can give back. Salesforce gives you paid time off to do volunteering, not just locally, but worldwide. One of the fastest growing tech companies in the world, with an innovative leader and world class cloud solutions, I'm in my best job ever and am constantly fending of recruiters. They are big on building your career internally and provide guidance and clear paths of career advancement. I.Love.Salesforce.",None so far.,Be the first to find this review helpful
44,Salary,"Mar 20, 2017 - Anonymous Employee",4.0,Clear career path and promotion,I can say nothing much for downside,Be the first to find this review helpful
45,Account Executive,"Feb 28, 2017 - Anonymous Employee",5.0,Amazing corporate culture and positive environment. Great work life balance and a fantastic place to challenge yourself and grow your career.,Very challenging ramp and time to onboard. Highly competitive with so many AE's and very intens. If you're lacking self motivation and reflection you will find it very challenging to work here.,1 person found this review helpful
46,Succes Graduate Program,"Mar 3, 2017 - in Salisbury, MD",5.0,Culture - Innovative - Fast growing - Philanthropy - Pleasant applying process,None - None - None - None -None,Be the first to find this review helpful
47,"""Amazing Company""","Mar 13, 2017 -",3.0,"Employee Friendly, can gain knowledge, HR approach amazing you can never find an HR as Awesome Management",Nothing that i noticed. No cons,Be the first to find this review helpful
48,Great company to work for,"Feb 25, 2017 - Sales Development Representative in Grand Rapids, MI",5.0,Huge focus on personal development Amazing perks Great colleagues Internal progression,Moving elsewhere will make you consider your decision,Be the first to find this review helpful
49,Best place to work yourself to death,"Mar 16, 2017 - Engineer in London, England",1.0,Free fruit free coffee free chocolate. You learn many technical skills and good company to have on CV,8 cases per day unmanageable. Exhausted to such an extent you have no energy to even go out on the weekends. Salesforce is all work and more work unrealistic figures made up on the fly. It is pure exploitation and I resigned for the simple reason it took a toll on my health. You can't keep up this pace with out screwing your health. It's a good name to have on your CV stay a year and leave if you care about your well being.,23 people found this review helpful
50,Exciting Workplace,"Feb 23, 2017 - Anonymous Employee in London, England",5.0,Great team of people Diversity promoted Work life balance Opportunity for growth High energy environment Philanthropy promoted,High-Pressure Environment Management from dashboards Self-Training,Be the first to find this review helpful
51,Manager,"Feb 20, 2017 -",5.0,A Great place to work,Few that I can think of,Be the first to find this review helpful
52,Success is fun and creates opportunities,"Feb 17, 2017 - Anonymous Employee",5.0,"Salesforce is very successful as a business, which means that it's a fun place to work and there are always opportunities to expand into new roles",You can't forget that it's still a business that needs to make money,Be the first to find this review helpful
53,Salesforce is a good place to work,"Feb 10, 2017 - Business Development Representative in Toronto, ON",5.0,"-Great company culture -Tier 1 software platform, we do well against competition -Money is good",-Sometimes can get stuck waiting for headcount for promotions leading some to switch to external and then jump back in at a higher role -At times may need to battle internal politics,2 people found this review helpful
54,New to Salesforce as a CSM,"Feb 8, 2017 - Customer Success Manager in London, England",5.0,"The place is welcoming. When they talk about Employee Success they mean it. On my first day induction, a member of the leadership team gave us a number of tips, the top 2 were, 'Look after yourself' and 'Look after your work/life balance'. I've worked at some big organisations and this appears on the list with them, but somewhere in the middle! They take philanthropy seriously, its in the DNA of the firm from it's inception, so although its early on in my career, I really feel like I'll be able to make a difference here.","The culture can be a bit cheesy and cringe worthy and I believe that change is a constant. I don't see that as a Con personally, but it maybe for other people.",2 people found this review helpful
55,Dreams come true,"Feb 10, 2017 - Sales Executive in Dublin, Dublin",5.0,"Great people, opportunities for development, excellent strategy and work environment.",Not identified. Need more sun - if you need any con.,Be the first to find this review helpful
56,An OK job,"Feb 25, 2017 -",3.0,"- A fantastic team and lots of challenges to deal with on a technical front. I get to work with a really talented and smart bunch of people who are willing to help other out when stuck. I have never been involved such work that makes you happy. We get to work on a variety of issues that affect people real time, and working on a plane higher than the developer allows us to better prepare for higher positions later on in our careers. - Lots of in house support to learn new skills. I was recently part of a seminar to learn Lightning hosted by a team that actually built it and it is just one of the many I have attended. - The idea of giving back to the society. The vision of our CEO has called upon AL of us to volunteer. I was never too big on it before I joined Salesforce, but over here after my first activity, I have been hooked on it. All thanks to Salesforce! - Transparent management The upper management never really makes you feel left out of any decision process that is regarding you. I have had almost weekly chats with my manager regarding the work and life in general and it is good to know that the management has your back. - Fantastic perks and benefits We enjoy full medical cover, and so do our four of immediate family. Free food, great break out areas, in house cafe, etc","I cannot really count anything here. Maybe expect a bit of a hectic rampup if you are a laid back fellow, since only the best are expected and if you're not willing to keep up, be prepared to be left behind, but only after multiple attempts to rescue you!",Be the first to find this review helpful
57,Great Company!,"Feb 9, 2017 - Business Architect in Munich, Bavaria",5.0,"Innovative, agile, transparent, highly competitive, smart people, sound business model, very dynamic, high speed, highly performance orientated, combines best practices in technology & business, supports personal growth & learning,","You have to cope with overwhelming infos , ambuiguity provided by constant change. You have to be comfortable with lots if business travel",Be the first to find this review helpful
58,Trainee/ Intern,"Feb 9, 2017 - Trainee/Intern in Dublin, Dublin",5.0,"Great start to a professional career, Salesforce provides you with the best environment and tools to succeed. Excellent benefits and competitive salary and huge possibility ion securing a FT position","Not a start-up anymore! Less potential for getting what a fast growing company has to offer. If you were starting your career here 10 years ago, you would be in a great place now",Be the first to find this review helpful
