,title,author_info,rating,pros,cons,helpful
70,Great company,"Jun 30, 2020 - Senior Account Executive in Dublin, Dublin",5.0,"Everything, great culture, opportunities, benefits and work life balance.","There are zero cons, this is one of the best companies you could work for.",Be the first to find this review helpful
71,Best,"Jul 22, 2020 - AMTS Software Engineer in Hyderābād",5.0,Best place to work Best work culture and time,No one found yet. No cons,Be the first to find this review helpful
72,good place,"Nov 30, 2020 - Anonymous Employee",4.0,work life balance is good,dependence on tech stack and generated code,Be the first to find this review helpful
73,Culture Culture Culture,"Jul 9, 2020 - Account Executive in Munich, Bavaria",5.0,A team spirit and culture I've never seen before,Fast growing company which is getting more and more complex,Be the first to find this review helpful
74,Great company to work at.,"Jul 12, 2020 - Software Engineering SMTS in Bangalore",5.0,1. Great people to work with. 2. Ohana culture. 3. Challenging work.,Could not think of any.,Be the first to find this review helpful
75,Generally Great Company,"Nov 16, 2020 - Professional Services in London, England",4.0,"Company Ethos and values, extensive benefits, strong CEO","Inconsistent application of values, some poor management in specific roles",Be the first to find this review helpful
76,Great company to work for,"Nov 29, 2020 - Consultant in Sydney",3.0,Great culture and financial perks.,Rapid growth and recent redundancies,Be the first to find this review helpful
77,GPTW,"Jul 22, 2020 - Consultant",5.0,"Positive Culture, Great Team, Good Growth Opportunities",Nothing that I recall as of now,Be the first to find this review helpful
78,Best Place to work,"Jul 3, 2020 - Techforce Analyst in Hyderābād",5.0,"Very good culture, hikes, and benefits",None as such best place to work i feel,Be the first to find this review helpful
79,Very goof team spirit and exciting product,"Jul 15, 2020 - Business Analyst",5.0,Good product Interesting Customer engagements SF support,None that I am aware of.,Be the first to find this review helpful
80,Culture Culture Culture,,5.0,A team spirit and culture I've never seen before,Fast growing company which is getting more and more complex,Be the first to find this review helpful
81,Great experience,,5.0,"Dymanic, evolving, leading, open-minded, visionary, growth","politics, very complex product offer, sales focused",Be the first to find this review helpful
82,Fast and challenging employer which lives up to its reputation,,5.0,"Fast and vibrant environment. Open communication, flat hierarchies. It´s a networking company. How far you come depends partly on whom you know. Great benefits; flexible working hours, lots of independency",Politics decide some promotion decisions. Extraordinary speed is sth you must be able to deal with. Might not be a fit for everyone.,Be the first to find this review helpful
83,Great place to work,,5.0,"Great company that cares for its employees, customer and employee focused. Core Values are visible everywhere. The culture they express exists in everything they do. Equality for all and thumbs up for the support provided during the pandemic.",Nothing that I can think of.,Be the first to find this review helpful
84,Good work life balance,,5.0,Good benefits and work life balance,Lot of politics and women not allowed to reach leadership grade,Be the first to find this review helpful
85,Great Company,,5.0,"The company culture is great. The company is very focused on giving back to the communities and it involves its employees to be a part of that. Great employee benefits as well, some of the best in Australia at least.",It is a bit political at times and the communication during the recruitment process was very poor.,Be the first to find this review helpful
86,"Fast pace, high energy, full of resources",,5.0,"Easy to connect, a lot of holistic support and positive encouragement.","Fast pace, high growth. Things move quickly.",Be the first to find this review helpful
87,Great Culture and Processes,,5.0,"Everything Works - Onboarding, Training, Development, support, benefits, overall methodology",Lots of information to take in - takes ~ 3 Months to become effective,Be the first to find this review helpful
88,A Real feel of being part of the Ohana (family),,5.0,"- Support from leadership on individual developments - Dedicated support, followups, and actions on individuals career growth - Salary standards, free meals..","Still need improvement on work-life balance, especially for those who work with multiple time zones.",Be the first to find this review helpful
89,"Great people, strong leadership, good perks, give back to the community.",,5.0,"You will be working with the best engineers with the latest technologies. Management will engage with you. Tremendous opportunities to grow. Volunteer work, giving back to the community is unique to this company.",There is some inertia working for a company with 55000 people. Amount of information can be overwhelming. Can be hard to find the right channel to talk to.,Be the first to find this review helpful
90,Deserve their position as technology's leading light organisation,,5.0,"An unparalleled opportunity to learn and grow both personally professionally, and forge a career","The place to be for fast learners and people who are constantly open to change and improvement, it might not be for everybody",Be the first to find this review helpful
91,"Work hard, play semi-hard",,4.0,"Good company culture, benefits, office perks, younger crowd","All about the numbers without little looking at the causes. If you're unfortunate enough to have a bad territory that year, good luck trying to get out of it. Everyone knows it's about timing and territory but management will never admit that and will blame you for your lack of sales",1 person found this review helpful
92,Ahh,,3.0,"Nice benefits and salaries, nice facility","Problematic management, technically the work is not interesting",1 person found this review helpful
93,"A great place to work, a company that challenges you every day in a good way",,5.0,"Values. Salesforce really lives trust, innovation, customer success, equality. The company really cares for their people. Salesforce learned me to really look for opportunities in a crisis like Covid-19.","You have to find your way in the company, it is sometimes not clearly organised. Think of a start-up with 50.000 people :) Salesforce has a perfect on boarding programme and people are willing to help you, but you need to reach out to get that help. So you have to take initiative.",1 person found this review helpful
94,Best Place to work,,5.0,"Very good culture, hikes, and benefits",None as such best place to work i feel,Be the first to find this review helpful
95,Very professional organization,,5.0,Lots of talented and really good people! Great employer treatment and benefits Very positive and winning spirit Great reference customers Good and sexy products and services Very consistent message to the market Focus on Customer Success,High-Speed operations Sales driven Sometimes perceived as aggressive Demandin a lot from their employees,1 person found this review helpful
96,Overall,,5.0,Really good employee benefits and wellbeing care package,Politics everywhere within the company and depending how you see it. Managers are supportive,Be the first to find this review helpful
97,"Amazing Culture & Leadership, Takes Care of Its People",,5.0,Benefits Flexible work from home policy Amazing Leadership Amazing Sales training It's like getting your Master's in Sales,"Fast-Paced Limited work/life balance Completly Metrics Driven Culture, Everything is driven by a dashboard",Be the first to find this review helpful
98,Great company,,5.0,"Everything, great culture, opportunities, benefits and work life balance.","There are zero cons, this is one of the best companies you could work for.",Be the first to find this review helpful
99,Intense but very happy with the outcone,,5.0,Company with lots of data online for you to study and prepare,None that comes to my mind,Be the first to find this review helpful
100,Salesforce Acount Executive SMB,"Jul 15, 2020 - Account Executive in Dublin, Dublin",4.0,If you are hitting you target you get a nice bonuses and multipliers,reaching the target it's not easy and everything is based on that,Be the first to find this review helpful
101,"Amazing company, glad to be part of the Ohana","Jun 28, 2020 - Project Manager in Munich, Bavaria",5.0,A family friendly company that gives endless opportunities for personal development! Amazing managers that gives you the flexibility and the support you need in order to make a big impact!!,Salesforce is a big company and often we have challenges regarding quick inspection and adaption. Sometimes changes take time.,Be the first to find this review helpful
102,Fantastic Place,"Jun 29, 2020 - Account Executive in Stockholm, Stockholm",5.0,"Benefits, Freedom of Work, World Class solutions, Great Management, Amazing colleagues",None. Best place to work at,Be the first to find this review helpful
103,My first 6 months,"Jun 29, 2020 - Lead Solution Engineer (EBU) in Milan",5.0,"Great Company, Great Values, Customer Obsessed, Best of bread solutions","My experience was very good. As other tech company, in Salesforce time goes at light of speed, so take in consideration if it is aligned with your expectations",Be the first to find this review helpful
104,Mixed Review,"Jun 29, 2020 - SMB Account Executive in Dublin, Dublin",4.0,It goes without saying that the benefits and salary are without question a fantastic pro for working for Salesforce. Majority of the people and culture is also brilliant.,"Unfortunately the on-boarding process, in my experience has been terrible. It is very much a sink or swim and sadly I had very little guidance on getting upto speed in my first 6 months which I feel has hindered my development. There is an opportunity to enable and engage new employees in a much better way. I didn't get to shoadow anyone for a week or two and 90% of things I have had to figure out on my own.",5 people found this review helpful
105,Great place to work with great people,"Jul 6, 2020 - Account Executive",4.0,Salesforce is a great company to work for & you can make a lot of money there. This is all dependant on what patch you have. Some have great geo's & some have underperforming ones. - Some of the best training - Great Benefits - Great People - Great Product,"- Favorites will get the better patches and therefore make more money - The same target for every patch in a team regardless on whether the patch is performing or not. - Promotion is dependant on you being in the team for 18 months & whether you achieve quota, which ties back into the patch you have. Bad patch = no progression.",2 people found this review helpful
106,Great place to work,"Jul 12, 2020 - Account Executive",3.0,"Generally care about the employees, equality, human rights and the planetary enviornment.",Deviate from the core pillar of customer success,Be the first to find this review helpful
107,One of the best experiences of my career,"Jun 28, 2020 - Support Engineer in Dublin, Dublin",5.0,"Amazing culture, focus on mental wellbeing, good perks, unlimited potential for growth",Workload and KPIs can be a bit challenging at times,Be the first to find this review helpful
108,"Great people, great leaders",,5.0,Interesting work experiences Great and skilled colleagues Supportive leadership Clear vision and values,I have had a positive experience so far,Be the first to find this review helpful
109,Salesforce developer with 8+ Years of Development Experience,,5.0,Salesforce is an excellent Product based company where in an individual can learn and explore on multiple technologies,No Cons as of date,Be the first to find this review helpful
110,Great Team and Work Environment,,5.0,Seamless and Excellent hiring process. Regular 1:1 discussion between you and your manager which keeps work environment transparent and builds trust between employee and manager. Manager encourages for profession and personal developments goals. Flexible work environment. Trust and respect for each other. Fun and volunteer activities in between work to avoid monotony. Happy to be part of #SalesforceOhana!,I have not seen anything wrong so far. It's all good.,1 person found this review helpful
111,Amazing place to grow your Sales career,,5.0,I started working from home and the support i've received has been phenomenal,Not being in the office because I've heard how nice it is,Be the first to find this review helpful
112,Great Place to work,,5.0,"Caring Company, that care about your development","Nothing really, Its a great place to be",Be the first to find this review helpful
113,Good company with flexibility,,4.0,Great people and enviroment to work,"You can not grow up in very different languages, too focus in SF software",Be the first to find this review helpful
114,Healthy Work Environment,,5.0,It has health work environment to contribute and to come up with your own ideas to implement.,Nothing much to express a cons.,1 person found this review helpful
115,Good interview,,4.0,"Interviewer knowledge, company salary, co-ordination from HR",Nothing as of now for me,Be the first to find this review helpful
116,Great Company,,5.0,Dynamic industry Wellness advantages Competitive salary,High American Culture Sales pressure,Be the first to find this review helpful
117,Great Experience,,5.0,Was always a pleasure to work with Team,No cons for me anyway.,Be the first to find this review helpful
118,Great,"Jun 22, 2020 - Account Executive in Toronto, ON",5.0,Amazing. So good. Splendid. Great training and employee support.,Work-life balance. High pressure to hit quotas.,Be the first to find this review helpful
119,Great place to work,"Jun 22, 2020 - Business Development Associate in Donegal",5.0,Very accommodating for virtual onboarding,None yet that I can gather,Be the first to find this review helpful
120,Great,"Jun 20, 2020 - Director in Sydney",5.0,Great company Culture Leadership and people,Nothing is bad. Hard working,Be the first to find this review helpful
121,Politicking and backstabbing,"Jun 19, 2020 - Director in Singapore",3.0,Organization is great but leadership in certain departments is poor great benefits such as education and wellness reimbursement,Too many politics Blame game Leadership is too far removed from issues Finger pointing,8 people found this review helpful
122,great place to work,"Jun 17, 2020 - Strategic Account Executive in Toronto, ON",5.0,great company culture that fosters inclusivity,base salaries are low for salespeople,Be the first to find this review helpful
123,Good perks and culture,"Jun 16, 2020 - Technical Architect in London, England",5.0,- Taken care of - Short working hours - Fitness and Wellness Benefits,- Boring work - Not much in way of skill improvement,Be the first to find this review helpful
124,Great,"Jun 17, 2020 - Sales Development Representative in Bangalore",5.0,"Frankly, a Great place to Work",None that I can think of,Be the first to find this review helpful
125,Doing well while doing good,"Jun 12, 2020 - Vice President",5.0,"- Strong focus on performance and employee wellbeing - Very positive, inclusive and open culture - Has taken a leadership position, both with employees and the broader community, in the aftermath of the coronavirus pandemic, and racial injustice",- Better balance between the US and non-US teams,1 person found this review helpful
126,One of the best firm to work with,"Jun 14, 2020 - AMTS in Hyderābād",5.0,"The Ohana culture can be seen in each and every employee in the firm, the way the connect, they help, they support.",Till now I've not seen anything like that,Be the first to find this review helpful
127,Great company culture,"Jun 24, 2020 - Regional VP in São Paulo, São Paulo",4.0,"Great company culture, employees highly skilled, competitive environment",Not always the corporate culture is well implemented locally. Excessive politics,1 person found this review helpful
128,Too good,,5.0,"All flexibilities, benifits are top class","None as of now, it is hard to say cons as all is good.",Be the first to find this review helpful
129,Great Culture,,4.0,Great Culture and collaboration across the organisation,workload can sometimes be challenging to balance,Be the first to find this review helpful
130,Hiring process,,5.0,"Strong culture, high growth company with excellent strategy","Don't know, have not found one yet",Be the first to find this review helpful
131,Life of a Security Analyst @ Salesforce,,4.0,"1. Great work culture. 2. Employees are the first priority of the company. 3. Great Benefits include Health, Wellness, Mindfulness, Leaves etc. 4. No stress","1. Shift Based Job, which sometimes ruins your life balance.",Be the first to find this review helpful
132,TRULY THE BEST PLACE TO WORK,,5.0,"How they put to heart and practice their core values, how they embrace their entire eco-system with pride, How they value giving back to the society, how they take care of their employees, good pay, month-end lunches, and quarter-end parties, good snacks, fun and family-like culture. Unbeatable work environment.","only 1 thing, infrastructure cannot accommodate the rapidly growing number of employees (hard to book meeting rooms, pantry area turned out to be a meeting area)",Be the first to find this review helpful
133,Great place to work,,5.0,Good salary You can plan to move to any team where you like to contribute Great wellness benefits Work life balance upto individual - You can decide how aggressively you want to grow and just be at the same place/position Free good food and barista,Career growth is proportional to how aggressive/ambitious you are. This results in sometimes putting work life balance in jeopardy.,1 person found this review helpful
134,5 Stars,,5.0,"Positivity, Worklife balance, No interference from the manager, Timely Salary, feeling family","Nothing to say, everything is good",1 person found this review helpful
135,Best onboarding and training experience ever!,,5.0,"The onbaording at Salesforce has been truly world-class. I've never had such a good experience when joining a company. It's not just the first week and then you're left by yourself to survive. I've felt supported throughout my first 6 months here at the company - both at a corporate level, as well as a closer, team level. The training with Trailhead has also been excellent. The gamified structure is compelling, well-executed and has genuinely broadened my own skill-set and continues to set me up for success.","I really haven't found any negatives from working at Salesforce yet. There's great leadership, support, training, compelling work and environment and most of all - the company values align to my own beliefs.",Be the first to find this review helpful
136,Great Work place to work,,5.0,Awesome workplace and great work life balance,None that I think of,Be the first to find this review helpful
137,Great company,,5.0,1. Great culture - very employee friendly 2. Awesome brand value 3. Got opportunity to launch a new product in the market,Can't think of any as of now,Be the first to find this review helpful
138,"Good benefits, modern slavery","Jun 17, 2020 - Senior Software Engineer in Buenos Aires",2.0,Great Engineering Team co-workers and friendly environment with them.,"Big company, no time to apply the values they sell",4 people found this review helpful
139,Good,"Jun 21, 2020 - Business Analyst in Hyderābād",4.0,Progressive work atmosphere at Salesforce,Management needs to come together,Be the first to find this review helpful
140,Great place to work,"Jun 4, 2020 - Regional Sales Manager",5.0,Great company that values its customers,Uncertainty in market due to pandemic,1 person found this review helpful
141,"Great onboarding, get teaming, great company","Jun 4, 2020 - Vice President, Regional Sales Management in Munich, Bavaria",5.0,"very professional and extensive onbnoarding including online course and a full week classroom training in San Francisco (pre-Covid-19 ) very good employee benefits programm Great teaming and spirit , real Ohana feeling great values that are really lived","A lot of internal stuff at the beginning, need self-discipline to focus on what is important for the customer and the business",1 person found this review helpful
142,Every man for himself culture,"May 14, 2020 - Business Development Representative in Dublin, Dublin",3.0,"- Good coaching culture - managers & other BDRs often deliver sessions to help develop others. - Lots of online training available via Trailhead - for SF products & industry/soft skills. - Benefits such as pension, discounted share prices, health insurance, and others. - Free snacks & coffees in the office. - Opportunity to make a lot of $ & career progression very quickly. - Lots of incentives & Presidents' Club.","- As a BDR you are competing against 2 other roles (AE & ECS) for the same target, which I found extremely difficult to work with. - Ego everywhere. - Hugely stressful job. My 3-star review is a mix of Salesforce as a company (5 stars) & the BDR role (1 star). Salesforce is a great company, with a great portfolio of solutions, & a great CEO. I believe had I a different role, I would be submitting a very different review. However, from my experience, I simply cannot openly recommend the BDR role. It's seen as a necessary stepping stone role towards AE, is an awful role in itself, and I found myself dreading going into work every day & always came home stressed.",19 people found this review helpful
143,Great Onboarding and Enablement,"Jun 19, 2020 - Account Executive in Vancouver, BC",4.0,"Great onboarding and enablement, very well organized with plenty of resources",Sometimes too many data points / resources for onboarding present too many options. May be better to try keeping it simpler and reducing the number of channels for info.,Be the first to find this review helpful
144,My 2nd family,"Jun 2, 2020 - Account Executive in Singapore",5.0,"Where I feel like me 2nd family, I didn't expect the I would have an amazing Day 1 like that. I already here more than 4 months and Salesforce is an actual Best Workplace.",I couldn't see any Cons here at the moment.,Be the first to find this review helpful
145,Work is good,"Jun 15, 2020 - SDET1 in Bangalore",4.0,Work life balance seems to be great.,Nothing so far. I haven't faced any issues.,Be the first to find this review helpful
146,Amazing Company,"May 28, 2020 - Account Executive in Wakefield, England",5.0,"This is a company at the top of its game, at the top of its industry and continuing to grow and become even better. Not only that they do things the right way and provide the absolute best possible environment and culture, inclusive of all, to allow you to become your best version fo you and make a difference to your own life and the world around you.",my only draw back is it is very London centric but I would also say that working from home or anywhere is not a problem and completely enabled as you would expect.,1 person found this review helpful
147,"I couldn't be more amazed, proud and happy to have made the decision to change.","May 28, 2020 - Account Executive in Madrid",5.0,"The Ohana spirit, that is breathed in each hour of work here, in each activity and in each colleague. The Salesforce concern about us, and their . The force and the energy that runs through each of our initiatives. The proud of be part of a company who wants change the world",I don't know any cons,Be the first to find this review helpful
148,"TOP - Best place to ""Work.com""","May 28, 2020 - Senior Functional Consultant in Milan",5.0,"Ohana, Personal Development, Innovation, Trust - The best #1 CRM system in the World (and not only).",Why cons are required? There are no cons!,Be the first to find this review helpful
149,Great Place To Work,"May 28, 2020 - Dirigente in Milan",5.0,"Innovation, Trust, Great Community, Strog Product, Great Marketing","Hard work, competitive, long hours, need to be always on",Be the first to find this review helpful
150,Solutions Engineer Belgium,"May 29, 2020 - Solutions Engineer in Brussels",5.0,"Amazing culture, values, people, benefits. Overall extremely rewarding to go to work everyday","Can have very long hours, you have to be very flexible which is a good and bad thing",Be the first to find this review helpful
151,Truly a unique company,"May 27, 2020 - Account Executive in Munich, Bavaria",5.0,"- industry leading technology - philanthropy is part of the DNA - great colleagues - you learn A LOT - not yet too corporate - benefits (education, wellness) - nice office (if you can go --- covid)",- no warm food by default :) - bit of a rolex mentality - disparity between internal promotions and external hires (industry standard but antiquated) - bit too much bashing of competitors sometimes (but it's fun too at times),Be the first to find this review helpful
152,"Strong values, real commitment with work-life balance, amazing people and superb package","May 28, 2020 - Commerce Cloud Functional Architect in London, England",5.0,"Package of benefits, talented people, time to learn (12 weeks of rump for architects), excellent environment and strong culture & leadership from the CEO.","Very volatile structure, which is due to the innovation aspect of the business but can be challenging to follow.",Be the first to find this review helpful
153,None,"Jun 10, 2020 - Account Executive in Singapore",4.0,Visionary Company which leads to 1 of the fastest growing company,Team is growing too fast and sustainability in times of Covid remains to be seen.,Be the first to find this review helpful
