,title,author_info,rating,pros,cons,helpful
127,Good company where you work a lot,,5.0,Growth company and constantly evolving . Opportunity everywhere.,"Spend, spend, spend but not on employees",1 person found this review helpful
128,Fun Place to Work,,3.0,"Amenities galore! Great benefits, flexible schedule, the place where everyone wants to be.","Too large for their own good. Too much focus on metrics and not enough focus on micro culture and fostering long term relationships. There's an inevitable aura of competition that is felt, yet not said.",4 people found this review helpful
129,Unusual development organization,,3.0,"Generally a pleasant work environment, but it's very fast-paced and demanding.","They don't have separate developers and SQA. They do ""Hybrid Engineering."" Which means everyone tests and everyone develops. So naturally testing often gets neglected. Their medical benefits were 2nd or 3rd rate. They were losing good people where I worked because of this.",3 people found this review helpful
130,"Once-Great, In Troubled Waters",,3.0,"Company culture, decent technology, growth.",Diminishing respect for Sales Engineering Profession. Less compelling career opportunities. Lagging customer success. Overly aggressive sales culture. Low-quality account executives.,11 people found this review helpful
131,Great Place to Be,,5.0,They care about their people,"There is a lot of movement, people do not stay in roles for a very long time",Be the first to find this review helpful
132,DO NOT JOIN SALESFORCE RESEARCH / EINSTEIN.AI if you want to get a second job,,1.0,"-You can be super lazy, not work at all and get paid at industry standard (that is what majority of people do here)",-Incompetent people with titles as 'research scientist' and 'research engineers' -You would instantly lose attraction to companies like Google/Facebook/Apple/Amazon if you go here. Common perception is that they hire lazy low-tier engineers/scientist -Many of the 'researchers/research scientists' do not even have a PhD. They are students/friends of the people in management who hire them without rigorous interviews - You won't learn anything since there is no innovation going on here. This will be problematic if you try to get a job at a real company and they ask you about your past experience.,18 people found this review helpful
133,Not Sure what to put,,4.0,You will definitely feel a people environment here,Career Advancement is hard as too much competition both inside out,Be the first to find this review helpful
134,Fantastic people culture,,5.0,"great work life balance, awesome people culture",engineering culture can be a bit lacking. Technology is not the best in the core teams,1 person found this review helpful
135,Terrible recruiters!!!,,3.0,"I think in my life dealing with 50+ more companies recruiters, Salesforce recruiters are the worst. They have reached out to me through linkedin asking for updated resume and once they get hold of it they disappear. I try reaching out to them asking for updates for never hear back from them. Mind you, I work in FANG and this has happened to me atleast 4 times now. The only reason I am interested in this company is because I happened to speak to few managers and looks like they really care about their employees. Sadly, the recruiters dont!","Recruiters, stay away from them!!",2 people found this review helpful
136,Great but changing company,,4.0,"-nice people -not a competitive environment -good benefits (high % 401k match, Progyny, ESPP) -positive work environment -impressive brand","-financially penalized for quick career advancement -no transparency of levels and corresponding pay -ES/HR is terribly unorganized and not helpful -company acts corporate or start up like dependent on whats in their best interest at the time -booking a client meeting at SF offices is embarrassingly difficult (rooms taken for internal meetings that people won’t give up space for) -egalitarian to a fault meaning if you work on a top account there is no additional support, you have to follow the same request protocol as small business accounts",4 people found this review helpful
137,Innovation Executive,,5.0,"Great benefits, visionary leader and amazing learning environment",Not always clear how we make an impact for the customer,Be the first to find this review helpful
138,I have never been so happy to work for a company like Salesforce!,,5.0,The work-life balance is amazing! I've never worked for a company like this before where they actually encourage you to take time away and re-charge. Managers are extremely supportive and want you to volunteer and give back to your community. I work with some pretty great people and there's endless opportunities for career growth!,I can't think of anything so far and I've been here for 6+ years,1 person found this review helpful
139,Great Company values,,4.0,"Flexible work schedule, Great benefits, Innovative and engaging work",Promotions are dependant on how fast your team/department grows.,Be the first to find this review helpful
140,Account Executive,,4.0,"Stock, Perks, Cool Office, Snacks","Long hours, Low base, No Path to move up",Be the first to find this review helpful
141,"Company that cares greatly about its customers, employees, & company improvement",,5.0,"* Cares about its company ethics and the example it sets, and listens to employees, though it may disagree; that's a lot better than most tech companies. Our CEO is an SF billionaire but you can tell he still cares * Great company perks and events * Overall, a friendly work environment * Flexibility with work hours and WFH * Public about its technology and encourages customers to develop on their own; this means we have pretty detailed public release docs to refer to * 7 days of Volunteer Time Off (VTO) and Unlimited PTO at the 3rd software engineering level (AMTS -> MTS -> SMTS has the unlimited PTO) * On a company level, employees are encouraged to try new teams and work; 3x a year, there is an opportunity for moving teams (though you'd probably only be able to after about a year on a team)","* Slow to match industry standards for technology frameworks and practices * Delayed longterm plans for the above, or rushed approaches that results in a company-wide approach with too many gaps to support many teams' needs * My specific cloud is typically under-resourced and people often move between teams to fulfill needs * My specific cloud also operates on a slower release schedule (3x a year) * Some management and employees can be quite immature/unprofessional",4 people found this review helpful
142,for 3 month,,3.0,the people were amazing there,the pay was relally bad,Be the first to find this review helpful
143,The best job I've ever had,,5.0,"This is the most flexible job that I've ever had. The people are great, the culture is amazing and the work spaces have everything you could ever need!",I truly don't have any cons at the moment. I'm 6 months in and everything has been spectacular.,Be the first to find this review helpful
144,Fantastic organization & inspiring colleagues,,5.0,"-Unbelievably great place to start your career in tech sales -Surrounded by smart, cool and inspiring people all day long","-BDR salary isn't great, but benefits are good",Be the first to find this review helpful
145,Terrific,,5.0,Pros: Too many to list. It’s great.,Cons: Internal politics prevent fast promotion. Promotes are based on tenure more than performance - mostly.,Be the first to find this review helpful
146,Would not recommend,,1.0,"Very flexible work culture, if that's your thing. High pay, though they don't have as frequent stock refreshes as other large tech companies.","Sort of bizarre workplace environment & culture. I didn't see much in the way of manager training or ensuring that the right ICs were promoted to people manager roles. Annual reviews are in no-way transparent. You are assessed on a set of criteria that is not shared with you (either the criteria or the assessment results). My review was five minutes: ""You're doing great!"" There was no actionable feedback, stretch goals or written documentation for me to learn and grow from. Leadership in my org very often resorted to bullying and openly shared negative feedback on their own peers with their reports. Several times while working there, I lost my engineering title due to re-orgs and was told that they ""didn't want to transfer headcount,"" so was left with only limited technical work to do for long stretches. And that's my biggest complaint - at least in my org, hard and innovative work was not championed but rather avoided in pursuit of very easy and short-term goals.",22 people found this review helpful
147,Great Culture and Company,,5.0,"Salesforce as a company, the employees and culture are great. Everyone is helpful and it feels like a family.",Your role and responsibilities might start to feel repetitive and mundane if you do not take initiative.,Be the first to find this review helpful
148,Director,,3.0,Ohana culture is very positive Above standard benefits Volunteer Time Off to impact community either with your team or on your own Decent physical working spaces,"Constant growth cuts in to resourcing to do the work already present, i.e. company wide travel bans. Some business functions are awash in money and people; others are thread-bare, with no discernable difference in impact or “importance to making money” Pay is below industry peers",8 people found this review helpful
149,Good Culture,,5.0,Good Culture Good Perks Work Life Balance,Slowness Politics and Middle Management Lack of stock refreshers.,Be the first to find this review helpful
150,"Trust, Customer Success, Innovation and Equality Personified",,5.0,"They are who they say they are, and that's a rare and amazing thing; Ohana (choosen family) really means something; Employee centric; Unreal growth opportunities; Exciting workplace; Executive Leadership you can buy into",With insane year over year growth inevitably comes growing pains.,2 people found this review helpful
151,A lot of fun at work,,5.0,"People are super nice and willing to help, no matter which team you or they are on. A lot of fun events at or outside work. Plenty opportunities of volunteering.",The company did a lot of acquisitions. All need time to be fully aligned.,Be the first to find this review helpful
152,Salesforce AE,,5.0,- Tight knit culture - Great perks - Accessible leadership - Beautiful office - Brand recognition,- High quotas to hit - Growing quickly,Be the first to find this review helpful
153,Hardest job you'll ever have (in a good way!),,4.0,"- Amazing culture and collaborative team-selling mode (never win alone, always lose together!) - Well-rounded corporate stance ranging from PTO, wellness, volunteering, philantrophy that stands out - Marketing is amazing, very well funded and really helps drives sales cycles - Constant innovation, R&D and acquisitions helps evolve the story and value proposition constantly for customers - Truly a business-impacting company (i.e. not just trying to sell software), transformational capabilities - Career Path is astounding, the ability to explore/try new roles as the company grows is a solid differentiator.","- Pace: simply put, the frenetic company growth is unsustainable. At its peak, think of back-to-back 80 hour weeks, juggling 6 tasks at once, back-to-back meetings & calls to get the job done properly. Annual quotas that continue to go up isn't something that go on forever, right? - Management: The company is growing so fast, first-line managers are going to be the weakness that cripples this company. Not saying there aren't good managers, but there are a lot of bad ones. To fill the void, Salesforce hires externally (i.e. Oracle) who brings their less-than-desirable practice into Salesforce. Lack of homegrown leadership is the company's biggest weakness, by far - Customers get tired: We all hear our customers are tired of getting ""nickled & dimed to death"" because we keep on coming out with new features, new acquisitions, new bundles that cost ""only $xx more per user/month"".",4 people found this review helpful
154,Good company to work for,,4.0,Leading vendor in industry. Aggressively adding new capabilities,Employees can get lost in rapid growth scenario,Be the first to find this review helpful
155,Great Company with good benefits,,5.0,Pay and benefits are top level,Structure of the company is confusing to understand or find out more about.,Be the first to find this review helpful
156,Good company has rotten apples too,,1.0,"Good Company Benefits. If the team you work for does not work out, there is an OOM policy for you to leave the team and join another one.","Middle management are in capable of leading the team. All they care about about is manage upward. My colleague was promoted to my manager and I found out that he listed down my work in his achievement list. What a joke. Besides that, he was trying to get a replacement for my pier and every candidate he shortlisted were Indian. Both external and internal OOM candidates. Downright racist.",21 people found this review helpful
157,Great Place to work,,5.0,"People are amazing-smart, dedicated and genuinely care about customers Salary and benefits are great Products are awesome Training superb",Accounts and territories not always evenly distributed Could match a higher rate for 401K and Dental insurance so-so,1 person found this review helpful
158,Best job I’ve ever had,,5.0,"Life / work balance, remote options, benefits.","Huge, sometimes opaque organization. Lots of mandatory training.",1 person found this review helpful
159,"Great company, awesome perks, amazing technology, incredible people.",,5.0,The company and the leaders really take care of the people. I enjoy my day at the office. My manager is incredible and she really looks for our improvement both professional and personal. Great work life balance.,"There are some due to so many recent acquisitions, but are expected.",Be the first to find this review helpful
160,Customer Success,,5.0,"Worklife balance, Equalit, Best company to work",None that I can think of,Be the first to find this review helpful
161,Great company that really cares,,5.0,"awesome place to work, develop and advance",hiring process was a bit lengthy,Be the first to find this review helpful
162,Great Place,,4.0,Lovely work environment. Great Place.,The snacks are amazing. Great place.,Be the first to find this review helpful
163,"Great Company Overall, Lack of Career & Growth Opportunities",,3.0,Compensation Benefits Intelligent co-workers Great Products and Clients,Promotion consistency Career opportunities Ability to take time off and disconnect (great PTO benefit though) General disconnect of senior management from overall department and day-to-day responsibilities,12 people found this review helpful
164,Some Teams treat employees like workers. Too much politics.,,4.0,Good Salary Good perks Work Life Balance OK.,"Too much politics in teams as they try to prove. They don't let people do their work. Instead put pressure on them for unnecessary reasons. If you can suck up to your manager you can get all your perks. Some teams to prove themselves, try to step in other teams projects and take over and send them out. Some managers think their reports should work like their servants and should not express their opinion, too much partiality. When teams move under different managers, this becomes rampant. Managers from certain ethnicity have very less opinion on women workers. Have seen several emotional incidents several times. I am sure this is going to become big in coming days as SFDC is becoming a giant. Not many women workers in management positions. Sr. Mgmt is worse as they don't know technical issues at all. Sincere people struggle at times trying to keep their positions.",2 people found this review helpful
165,Busy,,3.0,"Cool teammates, good benefits, challenging","Productivity over people, stressful sometimes",1 person found this review helpful
166,Amazing role with plenty of future opportunities!,,5.0,"Culture, challenging problems, teamwork mentality","None, Salesforce offers learning opportunities, community involvement, and career support from Day 1.",Be the first to find this review helpful
167,"Good company, some bad seeds",,3.0,A lot of different opportunities if you know the right people.,Some badly run departments ruin the culture for Salesforce's Ohana.,3 people found this review helpful
168,Ohana!,,5.0,The culture of Salesforce is built on trust and this radiates through every level.,Cant think of any cons of Salesforce,Be the first to find this review helpful
169,Excellent Career Move,,5.0,Salesforce has the best culture of any company I have worked for in my career. I am thoroughly challenged and motivated to succeed in my current role. I am also impressed with the opportunities available to me and excited to explore career opportunities beyond my current role.,IT could reduce the number of communication tools.,Be the first to find this review helpful
170,Good company,,4.0,Culture and work life balance is good.,Working at a satellite campus isn’t as great as working in headquarters.,Be the first to find this review helpful
171,Great culture,,5.0,"Ambitious, smart people who are fun to work with",Lot of strategic changes and shifts,Be the first to find this review helpful
172,Salesforce is truly a best place to work!,,5.0,"Innovative, fun, great team members and leadership, lots of opportunities for career advancement, flexible schedules, awesome locations and events, corporate values.","Very fast moving and need to keep a quick pace, which can be too much for some people, where others thrive in that type of environment. Employees seem to want to impress leadership rather than challenge or manage up. Leadership are like celebrities and are treated as such.",Be the first to find this review helpful
173,Salesforce is as good as it gets in Enterprise Software,,4.0,(1) Fantastic brand (my employability has gone up) (2) Compensation (3) Great benefits (4) Salesforce basically invented SaaS (at least perfected it) so you learn the state of the art in terms of what is required to do SaaS successfully *all in the context of working in the enterprise software segment,"(1) Frequent Re-orgs: Salesforce's ""secret"" to success is to be ruthlessly customer-focused ... as it should be. This means that everything is done to make sure we continue to grow ... again as it should be. This means however that re-orgs are quite frequent and also the employee-turnover. (2) Title inflation: When I accepted the job offer, I thought I would make a career progression, which it was title wise, but after I joined I realized that I had in fact less responsibility than before. This wasn't obvious to me because the compensation was considerably higher than at my previous company. I wished I had asked more questions and had asked for a higher title. (3) No cafeteria at HQ: you need to leave the building to grab food. This by itself is not a big issue. In fact, it means you have so many different lunch options ... every day. Yet, the ability to socialize with co-workers within your team and more importantly outside your team is not as easy as at companies where there is a common lunch area. At my previous company, lunch break was an opportunity to run into people and have a quick chat, which was helpful for maintaining relationships.",1 person found this review helpful
174,Can't Imagine Working Anywhere Else,,5.0,"As a long-time employee at Salesforce, I can't imagine working anywhere else. Salesforce is the best of the best from the people you get to work with, the projects, the opportunities for career advancement/movement and the corporate culture -- it's unparalleled. The biggest plus it the culture that Salesforce has and has managed to keep throughout the years. With a focus on philanthropy, teamwork and excellence in execution, Salesforce is the best place to work.","The pressure to deliver can be very intense and certain times of the year can be exhausting -- fiscal year end is non-stop working, weekends, late nights, etc.",3 people found this review helpful
175,Great Place to work,,5.0,Great work culture and perks,Nothing I can tell you,Be the first to find this review helpful
176,Great Place to Work,,4.0,"Honest leadership, flexible growth for employees, collaboration culture, open communication and feedback.",Fast-paced for new hires from non-technology background,Be the first to find this review helpful
177,Ohana!!,,4.0,Good work life balance Good environment Good benefits,Can't think of any cons,Be the first to find this review helpful
178,So proud to be a part of the Salesforce family,,5.0,I was working as a contractor at Salesforce for several years and was very impressed with the company culture. They have an incredible sense of inclusion and really value their employees. The work/ life balance is incredible and there is a lot of management encouragement to spend time with the family.,I can't think of any cons... it's likely the most rewarding company that I've worked with.,1 person found this review helpful
179,Great company/environment/life balance,,4.0,"The best work/life balance cultures among the big hi-tech companies in the world. Company culture is very respectful(mostly), more so than other highly competitive(cut throat) company cultures.","As the company has gotten larger, more politics and expanding into realms outside its legacy technologies, is on a learning curve/culture change...",Be the first to find this review helpful
180,Some Teams treat employees like workers. Too much politics.,"Aug 9, 2019 - Data Engineer",4.0,Good Salary Good perks Work Life Balance OK.,"Too much politics in teams as they try to prove. They don't let people do their work. Instead put pressure on them for unnecessary reasons. If you can suck up to your manager you can get all your perks. Some teams to prove themselves, try to step in other teams projects and take over and send them out. Some managers think their reports should work like their servants and should not express their opinion, too much partiality. When teams move under different managers, this becomes rampant. Managers from certain ethnicity have very less opinion on women workers. Have seen several emotional incidents several times. I am sure this is going to become big in coming days as SFDC is becoming a giant. Not many women workers in management positions. Sr. Mgmt is worse as they don't know technical issues at all. Sincere people struggle at times trying to keep their positions.",2 people found this review helpful
181,Highlight of my career to date,"Jan 12, 2018 - Senior Manager in San Francisco, CA",5.0,"- Forward thinking company - leagues ahead of others I have worked in - True focus on achieving and living by all corporate values - from senior most leadership down (e.g. focus on equality and well being of employee (family and health first mentality), volunteering etc - Empowered to make decisions and lead in senior manager role - Exciting to be part of a company that is on the leading edge of EVERYTHING, whether that is our products, our policies, our technologies etc - Management are empowered to make decisions and move ahead with projects which creates a sense of momentum and achievement for everyone - Smart, motivated and driven colleagues - Great brand and sense of pride to say I work for Salesforce",- I am not sure what promotion opportunities/career path looks like for me at this time but with the speed and scale of growth I am hopeful for more opportunities for me in the future,Be the first to find this review helpful
182,"Smoke & Mirrors and breeding Entitled, Arrogant People","Oct 22, 2018 - Anonymous Employee",1.0,"Original CEO, doing more for the community and social change, but isn't involved in how the company is run and the ""Ohana"" culture is not working, look inside.. you can create ""Ohana"" but if people are stabbing eachother in the back and arrogant, there is no Ohana.","Salesforce produces Entitled and quite frankly, arrogant people. They tell you to pat yourself on the back because ""its harder to get into Salesforce than Harvard""... people repeat this at bootcamp, when they didn't even attend Harvard. Training is all online Trailhead badges, and not personal training with objection handling, interaction and just a bunch of ""Salesforce is the best and the competitor sucks"", their management and team breeds arrogance, ignorance and lack of humanity. Salesforce is all smoke and mirrors, great place to work, but their sales teams all stab eachother in the back. Try asking people about the relationships between EMEA and NorthAmerica on accounts. They claim #1 place to work but ask around, people get sick of being a cog in the corporate system. Salesforce is great marketers but peel back the onion, on integrating the clouds.",26 people found this review helpful
