,title,author_info,rating,pros,cons,helpful
154,Great workplace,"May 26, 2020 - Senior Program Architect in Singapore",5.0,"Great talent, good pay, good benefits, great growth opportunities, good education allowance, leave for volunteering",Not really any cons to be honest,Be the first to find this review helpful
155,Great place to work,"Jun 9, 2020 - LMTS in Hyderābād",4.0,"Great work culture, practical focus on ethics",Crazy work hours at times,Be the first to find this review helpful
156,One of the Best Work Places to work,"May 19, 2020 - Senior Solutions Architect in Gurgaon, Haryana",5.0,"All kinds of opportunities. awesome benefits, great salaries, bonus stock options and name what you can.. things move really quicker than any other company i have worked with like IBM, Infy, TCS etc.","Dirty politics with 2-3 people on the top making moves as they want. There are scams going in for hiring processes, promotions without eligibility criterias as I heard recently. Big World. Not aware of what is available. easy to get lost while finding information.",2 people found this review helpful
157,"Great place to work, but unfortunately not a great place for learnings.","Jun 5, 2020 - Member Of Technical Staff",4.0,"Great company culture, great benefits. Pretty good compensation.","Might have a tough time if your team’s based out of a different time zone. Also, the kind of work/problems is not much exciting most of the time.",Be the first to find this review helpful
158,Accepted Offer,"Jun 4, 2020 - Success Agent in Hyderābād",4.0,"Positive experience, Employee Benefits Salary Benefits Work Culture Upcoming Technology",Improper Communication from HR team No follow-up Consulting team with candidates,Be the first to find this review helpful
159,Awesome company,"Jun 3, 2020 - Sales Manager in London, England",4.0,- Pay - Benefits - Comp - Growth - Vision,- Red Tape - Typical big company issues,Be the first to find this review helpful
160,There is no better place than Salesforce,"May 13, 2020 - Senior Program Architect in London, England",5.0,Huge advocate of employee well being constant learning- you just learn challenges - serious real-world problems to solve with world-class solutions great leadership during the COVID 19,"big company, lots of people, hard to navigate sometimes",2 people found this review helpful
161,Ohana Banana Skin,"May 24, 2020 - Customer Success Manager",2.0,"Company values permeates every communication and you are strongly encouraged to ‘give back’ to society. It not only makes you feel that you are making a difference, it also makes you more credible in the eyes of the customer. You can have the joy of working with some great people with sharp minds that embodies the Ohana mindset.","This was once a company I genuinely felt pride in working for. Now the narrative has slipped into a sense of window dressing for the media and the market which shines through in several ways: Time tracking and process adherence seems to have taken over every corner of the company. A few years ago you felt that you were encourage to be innovative and to spend time on deep level analysis. Now you have to justify every hour of your day and not necessarily to to the benefit of the customer. Turning more Oracle than Google. Work load pressure is immense and there is an increasing number of people on long term sick leave due to stress. Managers are very often in a different location to you and there is very little awareness of the difficulty this can pose around communication, a sense of overwhelm and time available. HR does not have a presence in the smaller countries. This affects the health of both staff and relations as employees do not know who to turn to for a ‘sanity check’ conversation if a situations arise. HR processes are clearly there to support management and protect the company. There is a lot of talk about the feedback culture but the reality is that constructive criticism only works with few of the managers. Overall the sense is that the many hires from Microsoft, Oracle and similar has begun to take over the company mindset. It is much more ‘Me First’ than what is to the benefit of us all - and the customers.",8 people found this review helpful
162,Marketing Machine,"May 21, 2020 - Sales in London, England",4.0,"Great benefits, maybe one of the best companies in the world. Fantastic products and a lot of innovation. Stock is a rocket ship. With the right accounts and a good manager it’s potentially a great place to work.","Support teams are tiny in comparison to the sales team size, absolutely mad. If you’re new you’re 90% certain to get a terrible patch. Middle management is weak - usually people that have survived long enough. Senior management is a revolving door like football managers. Quality of SE varies wildly. Sales training is poor to non existent. Go there with a well developed sales tool kit from a BMC style company. Salesforce employees can be cultish, and it’s infuriating. Have increasingly lowered the barriers for hiring.",4 people found this review helpful
163,Best company in the world!,"May 14, 2020 - Account Executive - Ecs in London, England",5.0,"'Do a job you enjoy doing and you'll never work a day in your life' - This statement couldn't be more true for my time at Salesforce so far. I am 5 years into my career and I can honestly say that I couldn't see myself working anywhere else. I have just transitioned into a different role (due to a promotion). The past 3 years in the ECS team has been incredible, both on a personal and professional level. I have made friends for life because the culture within this team is without a doubt a family unit. On a professional level, I have had my ups and downs for sure (I'm in sales, it wouldn't be natural if I didn't), but under the fantastic leadership, I have been educated, trained & coached into the salesperson I am today. I have learned so much over the past 3 years and will be forever grateful for the opportunity. I wanted to highlight my incredible experience so if anyone is considering a move to Salesforce, absolutely go for it, you will not regret it.",I do not have any negatives - I couldn't see myself working anywhere else.,1 person found this review helpful
164,Great Place to Work,,5.0,Truely thinking for the customer and keep producing innovative products. I always inspired by the company's value.,"There is a huge difference between HQ and other regions office. Even doing the similar job, their is a huge gap for salary.",Be the first to find this review helpful
165,First 6-months as an AE @Dublin,,5.0,"Sticking to the company values globally, always learning, giving back (philanthropy), open communication, great leadership and transparency including Covid-19, being #1 product in the market, international culture","Complex sales cycle, too many approvals, quotas not reflecting the geographic realities, territory split among other AEs not always consistent",1 person found this review helpful
166,The company really treats you like Ohana (Family),,5.0,"*Work culture of fast growing product based company *You get all kind of resources to grow in the company and in your career *Top pay in the market *The benefits are world class, from Wellbeing reimbursement to Health coverage. They've got you all covered. *A truly Equal opportunity company",*Your voice might not be heard if your manager is not good *No other cons,3 people found this review helpful
167,Amazing experience and company!,,5.0,"Great work environment, learning opportunities, flexible working hours","It'd be great to have more perks at the office (more networking areas, gym, lunch...)",Be the first to find this review helpful
168,Great experience!,,5.0,"fast growth, great learning, international environment",alignment between sales and biz dev not always perfect,Be the first to find this review helpful
169,Wonderful Company to work with,,5.0,"Culture, Ethics, Trust, Transparency, Compensation",There is too many levels in decision making,Be the first to find this review helpful
170,System specialist,,5.0,"Joined newly, so it's new",Nothing till now as New joinee,Be the first to find this review helpful
171,Great place to work - Fast paced and high pressure but worth it.,,5.0,Salary - great commission and earning potential if you get a decent territory. Great people Benefits Mostly good management,Very high monthly targets High pressure and can be stressful,Be the first to find this review helpful
172,Best workplace,,5.0,"Great culture, great benefits, great work/life balance",Could not see until now,Be the first to find this review helpful
173,Easy,,4.0,Salesman is type of friendly job,Job promotion is late here,Be the first to find this review helpful
174,Great Company but becoming more like Oracle,"Sep 6, 2020 - Account Manager in Sydney",4.0,"Package & benefits, inclusive environment, chance to volunteer, always busy","Need to look after your ""brand"", internal use of gamification and characters was cheesy",Be the first to find this review helpful
175,Truly one of the best companies to work for ever!,"Mar 31, 2020 - Account Executive in Vancouver, BC",5.0,"Innovative, diverse culture, very meaningful work, brilliant coworkers, very lucrative","Too large of a company now that your sense of contribution is small, very demanding, limited growth path in smaller offices",Be the first to find this review helpful
176,Very great place to work,"Sep 14, 2020 - Software Developer in Halifax, NS",4.0,Lot of opportunities to grow,Game changes very quickly and doesn't allow us to be in a project for a long time.,Be the first to find this review helpful
177,Good place to work,"Sep 30, 2020 - Customer Service Representative in Fredericton, NB",4.0,Flexible Customer Oriented Goal Driven Good Benefits Good Rewards,1) Large Corporation 2) Distance Employee Relations 3) Communication 4) Organization 5) Meetings 6) Deadlines,Be the first to find this review helpful
178,Best company ever - high performers execute,"Apr 4, 2020 - Senior Manager in Frankfurt am Main",5.0,- culture - leadership - people —> you will work with the brightest people in the industry,- you have to manage your work-life balance. Nobody will ask you to stop working,Be the first to find this review helpful
179,Great place to work,"Oct 3, 2020 - Anonymous Employee",4.0,"Employee friendly company, lots of learning, good benefits",No major concerns in general,Be the first to find this review helpful
180,First impressions - 6months fbk,"Aug 13, 2020 - Cloud Architect in Paris",4.0,"Management, Employees, Organization, Processes Rigor and Customers care are among the main pillars of the SF culture I've observed so far. So exciting!",Covid spoiled my 1st months.. And yet teammates and managers are always mindful.,Be the first to find this review helpful
181,Great Place to Work,"Jan 27, 2020 - Senior Solutions Engineer",5.0,"The company cares about their employees! You'll get an incredible well organized onboarding and after that you are able to work in your own style. What I appreciate the most, everyone is open for feedback and discussions.","As any big company, there is a lot of information around and it is sometimes difficult to find the right information for your need.",Be the first to find this review helpful
182,"Trust, Customer Success, Innovation and Equality!","Apr 11, 2020 - Senior Marketing Manager",5.0,- One of the most innovative companies in the world - One of the most admired companies in the world - Open communication,Have not come across any yet,Be the first to find this review helpful
183,Great place to work especially in these rocky times,"Apr 27, 2020 - Senior Solutions Engineer in London, England",5.0,"Incredible support network, benefits and on-boarding process",Ramp-up period could be longer to match the on-boarding time,Be the first to find this review helpful
184,Wonderful Company to work with,"May 14, 2020 - Director of Software Development in Hyderābād",5.0,"Culture, Ethics, Trust, Transparency, Compensation",There is too many levels in decision making,Be the first to find this review helpful
185,Best Company I have ever worked for,"Jan 11, 2020 - Critical Incident Manager in Sandyford",5.0,The job is amazing and interesting and you don't ever get bored. Salary and Benefits are the best I have ever had. The work/life balance is a real thing from day 1. The values of the comapny are really respected by the majority of the employees.,Location is not handy but I gladly do up to 3hrs hours of commute per day just to work there.,Be the first to find this review helpful
186,Great company to work for,"May 5, 2020 - RVP Sales in Sydney",5.0,"Great culture, pay, team mates and environment",Fast paced which some can't handle,Be the first to find this review helpful
187,Great experience!,"May 13, 2020 - Senior Account Executive in Dublin, Dublin",5.0,"fast growth, great learning, international environment",alignment between sales and biz dev not always perfect,Be the first to find this review helpful
188,"Flexible Working Environment, Unrealistic OTE","Sep 10, 2020 - Account Executive in Sydney",4.0,"Flexible working environment, great culture",OTE Sales targets are unrealistic,2 people found this review helpful
189,Salesforce review,"Sep 28, 2020 - Solution Engineer",4.0,The people and the culture are great,sometimes you work long hours,Be the first to find this review helpful
190,.,"Sep 17, 2020 - Account Director in Singapore",2.0,"Good product, fast paced business","Too much sales oriented, no company culture, frequent internal org change",2 people found this review helpful
191,SDR,"Sep 18, 2020 - Sales Development Representative (SDR) in Toronto, ON",4.0,Good pay and a great opportunity,Competitive atmosphere and little advice from above,1 person found this review helpful
192,Good,"Sep 23, 2020 - Techinacl Consultant in Hyderābād",3.0,GREAT WORK ENVIRONMENT and awesome infrastructure,You can expect help only when you ask :),Be the first to find this review helpful
193,Ohana: The Great Coverup,"Mar 31, 2017 - Anonymous Employee in London, England",3.0,- Great Benefits - Good salary - Time off to volunteer (7 days per year) - Good philanthropic model - Nice offices (for the most part),"Marketing marketing marketing. The company endlessly trumpets its supposed wonderfulness to the point where it feels like working in an endless commercial. There seems to be a huge push to constantly market the company both externally *and* internally; having the 'culture' shoved down our throats constantly. The company seems to spend an awful lot of money on fluffy extras (like pillows for all employees to put their mobile phones on at their desks, and professionally produced promotional videos for internal-only items) whilst asking employees not to use Roaming Data whilst abroad on business, and only allowing VPs to fly comfortably (some are more equal than others in this Ohana). PR touts Salesforce as a cutting edge company, but back-office systems are ancient and technology stacks are not integrated after years - there is a big disconnect between PR and reality, but the 'Ohana' papers over the cracks. Every All Hands address starts with 10 minutes of pom-pom waving cheerleading about how amazing we are. It gets tiresome.",29 people found this review helpful
194,What a powerful experience,"Dec 7, 2019 - Senior Product Manager in Tel Aviv-Yafo",5.0,"Great culture! Even though it’s a huge company, all the information is easily accessible via Trailhead and other collaborative sharing platform. You can always find someone to assist globally. The opportunities to make a real impact for customers are just endless.",There’s a lot of formalities like in any corporate. Make sure you’re comfortable presenting your case in many different forums to justify new features.,Be the first to find this review helpful
195,Sales field is my dream,"Apr 20, 2020 - Sales Executive in Chennai",5.0,Sales and export the brand,I dedicated to work the job,Be the first to find this review helpful
196,Friendly environment with great staff benefits. Lots of opportunities to progress,"Mar 30, 2020 - Technical Support Agent in Dublin, Dublin",5.0,"Good work culture, lot of opportunities to grow your career",Nothing at moment I hope they will be always good,Be the first to find this review helpful
197,good company to work with,"Sep 16, 2020 - Anonymous Employee",4.0,good culture and good env,None that i can say,Be the first to find this review helpful
198,Best Company I have ever worked for,"Jan 27, 2020 - Tier II Engineer in Hyderābād",5.0,"you feel valued, and the culture is the best you will see in India, even though there are enough challenges it make any one feel worth working here!",There are ideally no much Cons. However we need to consider bring Equality one of SF's core values to the next level,Be the first to find this review helpful
199,Positive Experience,"May 4, 2020 - Business Development Associate",5.0,"Great experience being recruited, even in corona times",The whole process was lengthy,Be the first to find this review helpful
200,Great Company but Regional Management is ruining the culture.,"Feb 2, 2020 - Aid in Hyderābād",5.0,Salary Benefits Work life balance Perks on office Internal career opportunities,"In IT department(operations) the management is ruining the culture and values,Salesforce is a great company hope they hire good management people",3 people found this review helpful
201,Great place to work with,"Apr 26, 2020 - Human Resources Manager in Hyderābād",5.0,"Great culture, values, team, benefits and learnings",Nothing specific to highlight here,Be the first to find this review helpful
202,Great place to work!!,"May 1, 2020 - Anonymous Employee",4.0,"Good pay, work life Balance",Technically not that great with Infra..,Be the first to find this review helpful
203,Good company,"Apr 29, 2020 - Associate Technical Consultant in London, England",4.0,Lots of learning Mentoring,Salary is too low Projects depends on availability due to consultancy,Be the first to find this review helpful
204,Bullying amongst female employees a HUGE problem,"Apr 2, 2020 - Director in Toronto, ON",2.0,Competitive salaries Ability to progress within company Volunteering opportunities,"I had a wonderful experience working with Salesforce for the first 3 years of my employment there. However, for the 18 months that followed, my life was made hell. I am so disappointed to say that this was a result of constant bullying from female employees. I had been cursed at and shouted at by a senior female leader repeatedly and in front of other employees, and when reported this to my director was told that there was nothing he could do as she was a VP. This went on for a year. There was extreme and constant bullying, negativity and back-stabbing from females in the US Marketing department, so much so that when a colleague went to interview for that department, the Head of Marketing told her they were having lots of problems on the team with bullying and back-stabbing etc, and was it something she would be able to deal with (the answer to which was obviously no). This type of bullying just became the norm, and was totally accepted. My own first line manager, who was also female, was incapable of giving any type of constructive or positive feedback, particularly to female members of the team, would openly speak negatively about senior leaders in a team meeting setting and was regularly described as being extremely de-motivating by all team members. Again when reported to more senior leadership nothing at all was done about this. I would regularly end my day in tears, spending more time trying to ward off this bullying than being able to focus on my actual work. All of this was documented to my director, and to Employee Services however nothing was done about it. My director would speak with me maybe once every 3-4 months, so I was subjected to bullying by my manager and made to cope with this by myself. My mental health, sleep, appetite and general well-being suffered dramatically and when I mentioned this to my director he told me that I should just go to Employee Services, he also asked if maybe I was having personal issues. Again, my first few years with Salesforce were great, I had amazing team members, male and (amazing) female leaders in Ireland and Canada. However working with management and marketing dept in the US was an entirely different experience and in the end proved to be unbearable. I was stuck in a horrible situation for far too long, with no support or outlet, totally isolated and unable to seek guidance from management. I do hope something is done about the widespread and consistent bullying that is carried out by female employees in the US offices, particularly with regard to the infamously volatile and toxic Marketing Department.",21 people found this review helpful
205,good,"Apr 14, 2020 - Systems Security Engineer in Hyderābād",5.0,Good place to learn and grow-up your skills and friendly culture,"no, nothing as of now.",Be the first to find this review helpful
206,Company developing and servicing amazing tech solutions while following an unparalleled philanthropic strategy,"Apr 14, 2020 - Senior Customer Success Manager in London, England",5.0,"- Salesforce develops, sells and services cutting edge technology solutions that customers love - Friendly culture that prioritises employees' wellbeing and development, not just revenue generation - Fast growing company obsessed with innovation and following an aggressive acquisition strategy - Salesforce gives back to the community, following the 1/1/1 model where the company gives 1% of employees time, 1% of products and 1% of equity to philanthropic causes.",- Size of the business: it can be challenging to keep track of what is going on outside of someone's day-to-day scope because of the number of clouds and products that are part of the ecosystem,Be the first to find this review helpful
207,Great Place to work,"Apr 27, 2020 - Success Graduate in Munich, Bavaria",4.0,Great company culture and interesting work,No clear career progression for younger employees,Be the first to find this review helpful
208,Best Company to work,"Apr 27, 2020 - Member Of Technical Staff in Hyderābād",4.0,"Great Work Culture in technical as well as non-technical section. Growth Opportunities to learn product with respect to Technology and Marketing. Superb projects and work culture. Very inspirational company and leaders to work for Benefits are best in the market (Free Food, Wellness allowance, Good Medical Insurance with OPD cover, Vison & Dental Insuarnce and many more)","no, nothing as of now.",Be the first to find this review helpful
209,Everyday learning in this incredible culture and business environment,"Apr 13, 2020 - Business Development Representative in Dublin, Dublin",5.0,"If you value ongoing learning and professional progression, this is your place. Salesforce is always providing you with resources that keep us motivates, healthy, and feeling that you belong to this family-Ohana since the first day!","In the Dublin offices, there is no free lunch service included.",Be the first to find this review helpful
210,Excellent hiring process,"Apr 10, 2020 - Account Executive in Dublin, Dublin",5.0,"I'm writing this review only for the hiring process, not the work itself since I still haven't begun. The hiring process was professional and I always felt very respected and motivated by my interviewers.","As mentioned, I still haven't started to work there",Be the first to find this review helpful
211,Security Analyst Engineer.,,5.0,"Trust, Equality, Great management, #1 Best work place #1 CRM Product Based.","I Don't think, We have something to discusses here.",Be the first to find this review helpful
212,Accelerate your Career,,5.0,Fast-paced environment - a great opportunity to learn and grow sales skills with an industry-leading company.,Things can change rather quickly - sometimes can be difficult to keep up.,Be the first to find this review helpful
213,Salesforce Ohana,,5.0,Working life more than matches the interview description of life at Salesforce Culture is open and trusted Work ethic is brilliant with a great work-life balance Benefits package is fantastic,There are no cons that I have seen so far,Be the first to find this review helpful
214,Friendly environment with great staff benefits. Lots of opportunities to progress,,5.0,"Good work culture, lot of opportunities to grow your career",Nothing at moment I hope they will be always good,Be the first to find this review helpful
215,Fantastic company to be a part of!,,5.0,"Really one of the best companies I've ever worked for. From the outside, the whole 'Ohana' concept may seem a bit cheesy, but it really is lived & breathed throughout the business & is infectious. I've yet to meet anyone who isn't willing to help or offer up their time.","Honestly, nothing that comes to mind",Be the first to find this review helpful
216,"Fantastic people, culture and product.",,5.0,"Upcapped commission, great perks, career progression, some excellent leaders, genuinely great culture.",Sheer number of products can be difficult to get your head around but there is excellent support. Base salaries not on par with some other large tech companies.,Be the first to find this review helpful
217,BDR,,5.0,There is a Great culture in place,"however somtimes it feels very American, there is no lunch or dinner",Be the first to find this review helpful
218,Great company to work for,,4.0,"Great Leadership team, culture, rapid growth, Customer focus and Employee focus",Resource challenge in the regions compared to HQ,Be the first to find this review helpful
