,title,author_info,rating,pros,cons,helpful
91,A company with values,,4.0,"-amazing energy : you are encourage to take risk, to innovate in everything you do -sincere values : everything you hear about ""volunteer time"" is true and strong at Salesforce","-(Paris office) very ""political"" environment -big company, you are just ""someone"", your manager changes every year -HR : does not really exist, you will never have a real discussion with an HR employee, strong weakness of Paris office (France)",1 person found this review helpful
92,Very good company to work for,,5.0,Multiple benefits and attention to employee's wellness,Perhaps too structured at times,Be the first to find this review helpful
93,Good company,,5.0,"Flexibility, pay, culture and diversity",Complex org structure can be hard to navigate,Be the first to find this review helpful
94,N/a,,5.0,"Great place to work, would recommend",Nothing at this time currently,Be the first to find this review helpful
95,Greatest company,,5.0,Culture culture culture. And it’s where I can be my best and get recognition for it,None that I’ve seen so far,Be the first to find this review helpful
96,"Not really Ohana, but rather a culture of bullying and backstabbing",,2.0,Great employee benefits and very good salary. Great technology,"A culture of bullying and backstabbing from the top... Micromanaging and lack of trust. Success is not determined by your ability and/or hardworking, but rather by sales pacth/territory you are assigned to.",7 people found this review helpful
97,Only 3 people in my entire org have reached their quota in 5 years,,2.0,"Okay base salary, good benefits, potential to make money if you suck up to the right people for long enough time.","Unreachable quota, low morale as 1,000 laid off during height of covid - (""Ohana/Salesforce family"" stuff is all talk), current employees are gatekeepers who make it tough to learn the process. Your success is all based on luck. Management seems uninterested. Super high turnover. You're expected to work 12 hours a day plus weekends on training and forecasting. Oh and the product itself is very expensive and there are better options.",1 person found this review helpful
98,Decent,,4.0,Good benefits and pay is competitive,Political and need to know the right people,Be the first to find this review helpful
99,Good place to work,,4.0,Good structure. Expectations clearly defined. Good opportunities for promotion,Very complex product sell. Requires a lot of cross functional partners,Be the first to find this review helpful
100,Very bad attitude towards employees.,"Mar 25, 2021 - Senior Member Technical Staff in Fredericton, NB",1.0,Free snack and drinks and good trainings.,Management not transparent with their decisions. Comparitively way less pay with US counterparts.,1 person found this review helpful
101,Account Executive,"Mar 2, 2021 - Account Executive in Melbourne",3.0,Meet good people who are smart and fun to work with.,Micro Management and pressure around deal cycles,1 person found this review helpful
102,It’s okay,"Mar 4, 2021 - Director",3.0,"Lots of change, stimulating environment","Can be challenging for non HQ employees to be seen, even during COVID.",Be the first to find this review helpful
103,Good organization,"Mar 5, 2021 - Market Research Analyst in Lahore",3.0,Leaverage progress and timely payments,"Politics, low salary, no benefits and beaureacracy",Be the first to find this review helpful
104,great,"Feb 17, 2021 - Anonymous Employee in Bangalore",5.0,great company to work for,no problems till now i see,Be the first to find this review helpful
105,Amazing place to work for,"Feb 17, 2021 - Technical Recruiter in London, England",5.0,Great culture and the best team to work with.,Can't find any wrongs here.,Be the first to find this review helpful
106,"Great company, growing too fast","Mar 1, 2021 - Solution Engineer in Brussels",4.0,Best CRM in the world Great vision Salary & benefits,No work/life balance Targets are set too high Quantity is more important than Quality when hiring,1 person found this review helpful
107,Decent company,"Mar 4, 2021 - Anonymous Employee",3.0,Good benefits Good people and very friendly Cool company,Slow promotion Not valuing the single worker A machine Hard to reach target,Be the first to find this review helpful
108,Great company to work for,"Feb 16, 2021 - Programs Manager in London, England",5.0,- wellbeing benefits and focus - innovation - Ohana culture - you feel like you're part of a family,"The company moves at lightning speed - which is not necessarily a con, but change is constant which is something you need to be prepared for joining the company.",Be the first to find this review helpful
109,"""Excellent Company to Work at""","Feb 16, 2021 - Information Technology Manager in Calcutta",5.0,Great working environment. Extremely supportive senior management. Great blend of discipline with leisure. Opportunity to learn so much. Cooperative approach and member focused.,Not as such i can think of.,Be the first to find this review helpful
110,"Apply for Salesforce, wonderful place to work for",,5.0,"Looking after their employees, great communication with their employees",Biorocracy. Some times it's hard to move things,Be the first to find this review helpful
111,Good stuff,,5.0,Very good good good good,Idk idk dikd idididk dk,Be the first to find this review helpful
112,Great Place to work,,5.0,"Great team, great management, great training, 1:1:1 model, great product, career progression opportunities, competitive salary and benefits.","Lot's of information when first joining, many people to network and align with to do your role.",Be the first to find this review helpful
113,Smoke and Mirrors,,2.0,"Culture, corporate benefits, nice people","Numbers are all inflated and unless your AEs ""help you out"" youll probably miss your goals.",1 person found this review helpful
114,Mostly good,,4.0,Skill development and professional network building,Unfair territories/quotas and unequal pay,Be the first to find this review helpful
115,Good to explore,,4.0,Good environment to grow in,none as such if you here to gain experience.,1 person found this review helpful
116,Best place to work,,5.0,Work life balance is absolute best & employee are free to work from anywhere,None that I can think of,Be the first to find this review helpful
117,Need to improve,,1.0,Perks and compensations is good as compare to market,Non technical manager make things worst.,3 people found this review helpful
118,Oodles of opportunities for bright talents!,,5.0,"1. Employee focused and nurturing better work life balance 2. Freedom to express your views, opinions, thoughts 3. Fastest growing company through M&As but still managing to stay atop!","1. While it is still a good thing, an overwhelming loads of training / training modules one has to go through as part of onboarding - maybe this is the essence of Salesforce's thriving culture !",2 people found this review helpful
119,Change Management Challenges,,3.0,- Great thought leadership vision from Marc Benioff to focus on the concept of stakeholder capitalism. - Huge focus of social give back and volunteering effort. - Good employee benefits. - Constantly shifting the organization forward by acquisition. - Many self learning material available if you're a leaner. - Used to have lot of great team players.,"- Change management challenges everywhere in the organisation. - Leadership issue with clear accountability and ownership, often too many layers created in the middle management and lack of understand of vision and direction. - Very tactically operate just to meet quarterly result. - Change management happen every fiscal year in my region, the goal and direction from a regional aspect is very fuzzy and keep changing. - Feedback given did not translate properly in the Great leadership methods. - Lack of fun, like it used to be.",3 people found this review helpful
120,Account Executive,"Jan 20, 2021 - Account Executive in Paris",5.0,"great team spirit, fit to work remotely, family/ job balance, great products, agile company",hard to get bonuses regularly - quotas are hard to get,Be the first to find this review helpful
121,Good company,"Feb 20, 2021 - Associate Success Guide in Dublin, Dublin",5.0,"Flexibility, pay, culture and diversity",Complex org structure can be hard to navigate,Be the first to find this review helpful
122,Macro aggression,"May 21, 2021 - Solutions Engineer in London, England",1.0,"Great products , Confucius growth , lovely buildings",There have consistent instances of macro aggression across the board where some of the top talents in the organisation have been run to the ground and got seriously ill and others have had to leave.,9 people found this review helpful
123,SDR,"Jan 16, 2021 - Sales Development Representative in Dublin, Dublin",5.0,- Social atmosphere - Stocks - Wellness Reimbursement - Work from home allowance,"Location of the office it outside of the city centre, but hoping to relocate in the future",1 person found this review helpful
124,Excellent place to work,"Feb 14, 2021 - Anonymous Employee",5.0,Excellent place to work with good benefits,Not as of now all good,Be the first to find this review helpful
125,Calling response 1 no.,"Feb 9, 2021 - Telicaller in Udaipurwati",5.0,Sales employee calling response Sales service good,Ok sales service good 1 year Bajaj assc experience rcd,Be the first to find this review helpful
126,Account Executive,"Feb 4, 2021 - Account Executive in Dublin, Dublin",5.0,Great growth opportunity and great pay,"I really love working here, the pressure can be high from time to time",Be the first to find this review helpful
127,Truly value based organisation !,"Nov 9, 2020 - Data Modeler/Architect in Hyderābād",4.0,"- Strong foundation values laid down by senior leadership team which they always lead by examples and that is why it is being followed at all employee tier/hierarchy level. - Innovative products and you'll able to work along with brightest minds/people. - Great employee benefits/perks insurance, wellness, stock purchase etc. - Speak up culture which helps to drives innovation and psychological safe work environment. - Giving back to society, is one of big motto of this organisation and I've seen it is passionately followed with 1:1:1 model via lots of volunteering & giving back opportunities. - Challenging yet interesting work and culture which is open for trying out new things i.e. innovation is really good.",- Not yet come across any rather it'll be too early to say.,Be the first to find this review helpful
128,Great community,"Jan 30, 2021 - Software Engineer in London, England",5.0,- A lot of benefits - Get opportunity to learn in big tech company,"- Conflict in office politic, but able to manage it",Be the first to find this review helpful
129,Software Engineer,"Feb 14, 2021 - Anonymous Employee in Hyderābād",5.0,Employee first company and great work life balance,There are no cons working for salesforce,Be the first to find this review helpful
130,Ohana,"Feb 12, 2021 - Software Engineer PMTS in Hyderābād",5.0,The best place on earth to work,no cons for an employment in salesforce,Be the first to find this review helpful
131,Worst Recruiting,"Feb 22, 2021 - Anonymous Employee in Hyderābād",2.0,Benefits Facilities Payscale Equality of pay etc you will get these in outside market.,"Recruiting team doesn't understand your profile. A simple example if you apply for a position you will be rejected without contacting the hiring manager, Once you contact the hiring manager he was astonished to hear that your profile is rejected and then once again the interview is scheduled. Recruiting team doesnt understand the pain or the agony that the candidate will be going through till the time these guys say or comeback about anything. Waste of time. Company is good but lot of local politics which makes the company not worthy. Forget about promotions. If you refer anybody they'll be rejected even if they have the skill set, only if you have a strong connection with the hiring manager then you need to share the referral bonus and only then the candidate will be hired,",4 people found this review helpful
132,Good company to work for,"Feb 26, 2021 - Product Manager in Hyderābād",4.0,"Great compensation and perks, good work environment.",Quality of technical work still needs to improve,Be the first to find this review helpful
133,"Politics, hierarchies, and a blatant disregard for our 'North Star' values","Mar 18, 2021 - Marketing Specialist in Dublin, Dublin",1.0,Great office culture in Dublin - because of the people I work with (independent from Salesforce).,Salesforce does not invest in young talent,3 people found this review helpful
134,Great,"Feb 11, 2021 - Business Development Associate in Dublin, Dublin",5.0,"Salary, Benefits, Culture, People, Opportunities",No Cons in my experience,Be the first to find this review helpful
135,Salesforce Pardot Consultant,"Feb 11, 2021 - Senior Consultant in London, England",5.0,"Friendly and fun, good benefits","Fast paced, very commercial focused",Be the first to find this review helpful
136,great experience,"Feb 11, 2021 - Sales Development Representative (SDR) in Dublin, Dublin",5.0,"a lot of benefits, great company to work for","nothing to say, very good company",Be the first to find this review helpful
137,Very professional,"Feb 12, 2021 - CRM Manager in Copenhagen, Capital Region",5.0,"Motivation, employee, management and professional",At the moment not aware of any.,Be the first to find this review helpful
138,great company,"Feb 12, 2021 - BDR in Dublin, Dublin",5.0,great perks and amazing culture,long hours and high pressure,Be the first to find this review helpful
139,My experience is phenomenal,,5.0,"I can easily say, Salesforce Equality value is absolutely true! not just a line in the values. I am a middle eastern muslim girl, I applied through LinkedIn I knew no one, I completely got the job based on a fair qualification. The professionality in the 4 interviews I went through made me really happy to move to Dublin and start my career with Salesforce",There was some misunderstanding on my accounts and which level I will be managing - Compensation as well was not really clear,Be the first to find this review helpful
140,Great place to work,,5.0,* hands-on mentoring * great virtual onboarding * career vision * great career progression * good work-life balance * international teams and career opportunities * business achieving huge growths despite pandemic which reflects in your own results * flexible home-working abilities,"* if I really have to say one thing, continuous organisational changes / optimizations which can become distracting at times. Upside is that your career can move quickly as well thanks to this flexibility.",Be the first to find this review helpful
141,Great place to work,,4.0,Great pay in a fast pace and modern work environment,Corporate decisions sometime blow the mind.,Be the first to find this review helpful
142,Great company,,4.0,Great culture and forward thinking + innovative. Growing fast with a great product suite.,Becoming increasingly more corporate due to size and growth.,Be the first to find this review helpful
143,good place to work,,3.0,"benefits are awesome, good work culture",no control on choice of work,Be the first to find this review helpful
144,Amazing,,5.0,Love it. The learning process is amazing,None. The management is just beautiful,Be the first to find this review helpful
145,Fantastic Company,,5.0,"Amazing culture, amazing people, great development, continuous career progresssion",Sales targets can be difficult to reach,Be the first to find this review helpful
146,Good and Bad,,5.0,"Salary and benefits, work-life balance","Boring work, certifications required are hard",Be the first to find this review helpful
147,Amazing!,,5.0,"Training, Quality of Staff, Culture, Benefits & Reputation",Honestly can't fault the company.,Be the first to find this review helpful
148,Nice Place to Work,,5.0,"Work life balance, Nice to people to work with",No cons to be specially mentioned,Be the first to find this review helpful
149,Core Sales,"May 27, 2021 - Account Executive in London, England",4.0,"Community, support, benefits, offices, teams","Sales driven, political, entrepreneurship, creative, focus",1 person found this review helpful
150,Mixed Review,"Jun 29, 2020 - SMB Account Executive in Dublin, Dublin",4.0,It goes without saying that the benefits and salary are without question a fantastic pro for working for Salesforce. Majority of the people and culture is also brilliant.,"Unfortunately the on-boarding process, in my experience has been terrible. It is very much a sink or swim and sadly I had very little guidance on getting upto speed in my first 6 months which I feel has hindered my development. There is an opportunity to enable and engage new employees in a much better way. I didn't get to shoadow anyone for a week or two and 90% of things I have had to figure out on my own.",5 people found this review helpful
151,Proactive Monitoring Engineer Salary,"Jan 29, 2021 - Proactive Monitoring Engineer in Hyderābād",5.0,"Great culture, Great people, great exposure to the overall personality development, appropriate salary.",No Cons for now :),Be the first to find this review helpful
152,Great place to work,"May 14, 2021 - Senior Manager Corporate Marketing in Amsterdam",4.0,Strong culture and values Growing environment Great benefits and perks Open communication with leadership,Work-life balance can be challenging to maintain at times,Be the first to find this review helpful
153,Engineer,"May 28, 2021 - Senior Software Engineer in Dublin, Dublin",4.0,benefits are good and flexibility for work,too many calls which are not needed,Be the first to find this review helpful
154,Best place to work,"Feb 6, 2021 - Anonymous Employee in London, England",5.0,You have everything you need at your disposal,Slow progression within the business,Be the first to find this review helpful
155,Best place to work at,"Feb 2, 2021 - Salesforce Developer in Hyderābād",5.0,Good salary Good perks Good folks to work around,Little hard to move up the ranks,Be the first to find this review helpful
156,Senior Solutions Architect,"Feb 10, 2021 - Senior Solutions Architect",5.0,"Ohana, People, Culture, Vibe, Skill Set","Nothing, Nothing, Nothing, Nothing, Nothing",Be the first to find this review helpful
157,Great place to work,"Feb 4, 2021 - Account Partner Director in London, England",5.0,Great leadership & company culture; high quality employees,- - - - -,Be the first to find this review helpful
158,Good company,,5.0,Good manager Salary is good with incentives,Not proper communication through management,Be the first to find this review helpful
159,Good company,,4.0,Good quality of work and benefits,"Due to the fast-growing nature of the company, work-life balance takes a hit.",Be the first to find this review helpful
160,Continues to be a great place to work but..,,5.0,"- Working with some of the most talented people in the profession - Cutting edge developments - Management structure in Technology that genuinely listens and acts on feedback - Good benefits package (health, dental, wellness/fitness reclaim, education grant) - Depending on direct managers a lot of freedom to take calculated risks - Internal network very willing to help out and share knowledge and success - If you are dedicated and willing to put in the effort required you will move up the ranks but don't view this as just a 9-5 alone. You are encouraged to keep a balance but that's not always possible.","- Sometimes unrealistic sales / business management expectations from product resulting in oversells, it's a solid product but there's a lot of work needed to get to a setup that will do well on the enterprise scale. Smaller setups can work but if you are looking for the big benefits it requires time investment. - The 'family feel' push internally. This is really nice when you are newly immersed in it but you also need to be wary of assuming it's like a perfect family. Families have fights, internal squabbles and sometimes break apart so always look after your own future don't expect that completely from the company. - Steep learning curve if you've never worked on Salesforce product(s) before but there is lots of help there. Still a great place to work and earn professional experience or build your career. Genuinely love the company and everything they've done for me to date.",2 people found this review helpful
161,"Not a good idea to join Heroku Hyderabad team, Lot's of political drama being played.",,1.0,"Salesforce is the best company to work for but due to some people, the standard is going below. Good work culture, good benefits. You can grow well if supported by your manager.","It's not for Salesforce as a company but for some specific teams like Heroku where politics is at, it's best. People who work will get nothing and those who don't will get promotions. Even if you do your best you will not be appreciated and some who are close to the manager will be appreciated for no reason. Had a good experience till 2persons joined the team and spoiled it fully. Never supported by manager to grow in career.",4 people found this review helpful
162,"Honestly, great place to work at",,5.0,"I joined Salesforce Singapore as my first job fresh out of university, and truthfully, it's really the people that make this place an amazing place to work at. Different teams will have different ways of working for sure (dependent on the manager), but overall I find colleagues here willing to share their time and expertise. Even as a junior member of the company, I was never made to feel afraid or hesitant in approaching a more senior colleague for advice. There is a lot of trust in my team, which has been especially invaluable in this whole work-from-home situation. The autonomy and flexibility granted in my role is also surprising, but practical I suppose – considering how large the company is growing, it's difficult for a manager to micro-manage the activities of every single team member. The remuneration package is fair (not top-of-market however) and comes with lots of benefits. Most importantly, managers in Salesforce are super supportive about lateral movements within the organization, and outside of it. Telling your manager 'I would like to seek a new challenge this year' is not taboo here. I've lost count of the number of colleagues who have changed roles over the past 2 years I've been here.","Change happens constantly, and sometimes it's uncomfortable, or jarring, even. You're not suited for Salesforce if you're looking for a cushy role where you can just 'settle in' and relax. The company is always evolving, and you have to be adaptable to go along with it. A large company also means that increasingly, more operational processes have been installed. Is it a pain? Yes, sometimes. But is it bearable in the grand scheme of things? Also yes.",1 person found this review helpful
163,NA,,3.0,Excellent healthcare benefits offered to staff,There is no work life balance at this company,Be the first to find this review helpful
164,Excellent place,,5.0,"Great people, perks and prospects","Pressure, and can’t think of anything else",Be the first to find this review helpful
165,Good company,,4.0,Good pay. Good allowance No formals,Shifts Nothing much Carrer growth Unrealistic targets No regular working hours,Be the first to find this review helpful
166,The ohana culture is nothing more than an act.,,1.0,- Good salary - Good benefits,No yearly performance reviews. No yearly salary increase. Change management every year. Toxic environment. Self-centred people. Back-stabbing culture. People higher up take credit for work others have done. Everyone is there for the money and pretend to make the world a better place. If management doesn't like you they'll make sure you won't progress in your career.,6 people found this review helpful
167,Fabulous company to work for,,5.0,"Culture, openness, trust, it’s up to you to make your own career with their full support",There are no cons to speak of,Be the first to find this review helpful
168,Great company,,5.0,Good product great service success,No cons that I can think of,Be the first to find this review helpful
169,Best place to work,,5.0,You have everything you need at your disposal,Slow progression within the business,Be the first to find this review helpful
170,"Remote onboarding is going smoothly. They are massive on culture, they take it so seriously, I love it.",,5.0,"Benefits, salary, interesting work, pioneering & innovative company.","Lots of info to take in, but that’s only because I’ve just joined.",Be the first to find this review helpful
171,Great company to learn from,,4.0,"Great business processes, progression and education",Progression is everything and there is a slight fake it til you make it culture. I would prefer if humility was rewarded more.,1 person found this review helpful
172,Fantastic company to work for,,5.0,"People, product, perks, compensation, career growth",Don’t have anything bad to say,1 person found this review helpful
173,Hiring Process and HR Coordinator,,5.0,Understanding and giving thoughts to the candidate's expectations.,I could not find any cons.,1 person found this review helpful
174,Great place to work,,5.0,Great leadership & company culture; high quality employees,- - - - -,Be the first to find this review helpful
175,Account Executive,,5.0,Great growth opportunity and great pay,"I really love working here, the pressure can be high from time to time",Be the first to find this review helpful
176,Great place to work,,5.0,"Loads of benefits, good working environment",Very busy and long hours if you throw yourself into it.,Be the first to find this review helpful
