,title,author_info,rating,pros,cons,helpful
0,Unbelievable opportunity and Culture,"Jan 28, 2020 - Director in San Francisco, CA",5.0,"- Employee work life balance is actually working - Commitment to Society and Community are not just marketing slogans but are deeply embedded in culture - Management listens, respects opinions and takes actions - Unbelievable opportunity in terms of what you can work on and what you can create - Safe environment you can spend a life time here and not worry","- Lack of full stack experience for developers, you do more configuration than building - Speed can slow down due to excessive stress on collaboration and alignment - Some legacy elements, that need cleanup, but nothing that one cannot handle given everything else in place",Be the first to find this review helpful
1,Great company,"Jan 12, 2021 - Vice President",5.0,Team oriented culture. Performance driven.,Nothing significant that I can think of.,Be the first to find this review helpful
2,Great company and culture,"Dec 21, 2020 - Strategic Account Manager in Reston, VA",5.0,"Work environment, products and culture","Lot's of product updates, changes so there is a ton of training which can be overwhelming.",Be the first to find this review helpful
3,N/A,"Jan 13, 2021 - Account Executive in Austin, TX",5.0,Good company to work for,Nothing bad to say about the company,Be the first to find this review helpful
4,"Great Role, Expected Responsibilities, Good Management, Comforting Covid Response.","Nov 23, 2020 - Sales Strategy Analyst in San Francisco, CA",4.0,"The role is as expected. It allows for experimentation in process and areas for improvement, while considering the historical context of why something is the way it is. Being entirely remote (because of COVID) since beginning, there is good work/life balance. The company has given WFH Stipends for employees and has excellent communication in the form of All Hands meetings (very frequent) and email communications. I feel respected for my experience, and not pressured on my performance. We are all in the same boat, so we all have essentially similar expectations. The pay is good, as are the benefits (I expect would be better if work was in person). From what I understand, the promotion and salary reconsideration processes are fair and equitable.","There are a lot of processes in these roles that could be consolidated company-wide (or at least department-wide), that are not, which often times results in duplicate work or straying from the norm. Those processes need to be standardized. Sometimes it is hard to feel like a dialogue flows between colleagues, which is expected in an all remote environment, but a challenge nonetheless. The same goes for culture building, but efforts are being made, and I expect this to be more of a result of Remote work, and not the team/department. Processes often are overly complicated and should be assessed to whether or not they add value or could be simplified.",Be the first to find this review helpful
5,Company for retirement,"Apr 13, 2021 - LMTS, Software Engineering",1.0,"Good WLB, good parental leave","Oh where do I start, horrible politics and measly pay. They do not do stock refreshers so employees who have been there for long time get penalized. You have been warned, don't stay here for more than three years.",11 people found this review helpful
6,Sales,"May 9, 2021 - Sales",3.0,one hour for lunch break,long hours standing on feet,Be the first to find this review helpful
7,"Incredible employer, amazing business","Dec 6, 2020 - Senior Director in San Francisco, CA",5.0,"Employee friendly everything- comp, benefits, freedom, inclusion","Centralized, hard to change from the bottom",Be the first to find this review helpful
8,Junior Partner manager,"Jan 12, 2021 - ISV Partner Manager in South San Francisco, CA",5.0,Great benefits Great people Best management,Honestly can’t think of any,Be the first to find this review helpful
9,Salary,"May 3, 2021 - Senior Account Executive in Tampa, FL",4.0,Benefits are great for ee and family,Expectations change daily and yearly,Be the first to find this review helpful
10,Best Job and Best Company Ever,"Jul 10, 2020 - Senior Solution Engineer in Nashville, TN",5.0,"The culture is legitimate not just lip service. I feel valued and supported. If I had been working at any of my previous companies during the pandemic, I am 100% certain that I would either be unemployed or forced to take a pay cut/furlough. Salesforce has lived up to its promise in every single aspect.",Things move quickly around here. Get comfortable being uncomfortable isn't just a phrase. It's real. I've been here 6 months and I am still learning. People who have been here for 6 years say the same thing.,Be the first to find this review helpful
11,I liked the company,"May 4, 2021 - Manager",2.0,good environment to work for,management is poor to work,Be the first to find this review helpful
12,Salesforce one year review,"Nov 17, 2020 - Global Support Agent - Datorama in Indianapolis, IN",5.0,Benefits are great and people are great!,Limited employee stock options and no personal offices.,Be the first to find this review helpful
13,Nonoe,"Jan 9, 2021 - Sales in Jacksonville, FL",5.0,Good job to have and keep,"nothing in partiicular, to report on this",Be the first to find this review helpful
14,Highly Recommend,"Oct 19, 2020 - Account Executive in Irvine, CA",5.0,- Amazing company culture - Robust and ongoing training - Unlimited resources - Supportive and helpful team environment - Fantastic benefits - Great incentives and bonuses,- Time to feel confident in role - Understanding all available resources,Be the first to find this review helpful
15,Good company with a lot of misc work,"Mar 31, 2021 - Security Architect in San Francisco, CA",3.0,Good working environment and benefits,There are so many goals to achieve at the same time,Be the first to find this review helpful
16,Great place to work,"Apr 7, 2021 - Account Executive in Indianapolis, IN",4.0,"The company is an institution. Great culture, pay, and colleagues.","Pretty large, so individual efforts can get lost without playing the political game.",Be the first to find this review helpful
17,"Fast-paced, collaborative and goal-oriented workplace","Apr 28, 2021 - Account Partner in West Chester, PA",4.0,"Positive culture, awesome benefits, philanthropic","Always changing, employee burn out",Be the first to find this review helpful
18,The Real Deal,"Nov 30, 2020 - Account Executive in San Francisco, CA",5.0,"Inspired leadership, great team, all-in culture. Embarrassment of riches.","Growing pains, reorganizations, lots of internal meetings.",Be the first to find this review helpful
19,Special company,"Dec 17, 2020 - Anonymous Employee",5.0,Great recruiting and Onboarding process Many opportunities for giving back and volunteering They really invest in their employees Continuous learning,Haven’t experienced any negatives thus far,Be the first to find this review helpful
20,Ok place,,3.0,"it was an ok place to be, good work/life",none that come to mind,Be the first to find this review helpful
21,good experience at a nice company,,5.0,flexible working schedule nice mentors a lot of opportunities good compensation & benefits great company culture,high frequency team adjustment recently,Be the first to find this review helpful
22,Great company!,,5.0,"Responsible, transparent and progressive comapany.",Long hours at times and a pressure for sales success.,Be the first to find this review helpful
23,Solid Big Enterprise Tech Company,,5.0,"Salesforce does right by its employees. The pay and benefits are good. You can do pretty much anything at Salesforce: coast and hide or dig in and contribute. People are smart, helpful, and genuine.","It's a very big company. At times things are slow, bureaucratic, and inefficient, but that comes with the territory. Internal mobility is possible, but not as easy as it should.",Be the first to find this review helpful
24,Don't Get Lost in The Positive Headlines,,3.0,"Stock purchase plan, 401k match and health benefits are all great!","Besides the corporate politics you'll have to deal with and that you'll be paid significantly less than the market rate. The company has become the very thing they said they wouldn't become, they're a huge corporation now and the people outside of the top 10% of officers are only numbers to management. Don't believe in the headlines or your recruiter, at Salesforce you're nothing more than a number.",6 people found this review helpful
25,Amazing place to work with a great culture!,,5.0,"Competitive Salary, Amazing Benefits, Tons of Support Salesforce was an incredible place to work!","My team was relatively small, so work-life balance became challenging to manage at times.",Be the first to find this review helpful
26,Nonoe,,5.0,Good job to have and keep,"nothing in partiicular, to report on this",Be the first to find this review helpful
27,Company cares about its employees,,5.0,Great pay and work life balance.,Some processes have red tape,Be the first to find this review helpful
28,Mixed Bag,,2.0,"Corporate Culture, Benefits, Snacks, Name recognition","Sales culture, quota, commissions, Layoffs",Be the first to find this review helpful
29,Great Company,,5.0,"Salesforce offers their sales teams everything they need to succeed including training, coaching, etc. The opportunities are plentiful and benefits are awesome.","The one constant at Salesforce is change. It can be good, but you shouldn't get too comfortable in a role.",1 person found this review helpful
30,Good,"Jan 4, 2021 - Software Developer in San Francisco, CA",5.0,benefits are good. work life balance,tech stack. the core app is big,Be the first to find this review helpful
31,ok,"Apr 29, 2021 - Vice President of Sales in Walnut Creek, CA",3.0,good people who work hard,"disorganized, poor integration of technology and systems",Be the first to find this review helpful
32,"Great company, caring culture, customer centric, however micro-mgmt of F2F teams","Feb 5, 2021 - Strategic Account Manager",4.0,Marc Benioff - Excellent CEO and Person Caring Culture - Ohana Customer-Centric focus Excellent training,"-Communications across sales teams....chatter can be a blackhole, Slack may help -Growth targets not realistic in some market segments & enterprise accounts, Customer-Centric focus giving way to close business at all cost",Be the first to find this review helpful
33,Transparent and speedy conversion from contract recruiter to full time recruiter,"Nov 3, 2020 - Anonymous Employee",5.0,They were honest throughout the whole process. I’ve had nothing but an amazing experience with Salesforce the last year!,Only con I’d say is that everyone starts as a contractor but I understand why.,Be the first to find this review helpful
34,Best company I've worked for to date. Highly recommend joining the Salesforce team,"Jul 25, 2015 - Anonymous Employee in San Francisco, CA",5.0,"-Huge emphasis on the importance of charitable giving and being environmentally sustainable (backed by 6 paid volunteer days per employee annually, $5000 annual employee match for charitable giving, frequent internal charitable events) -Prioritizes engaging employees by aligning personal career goals with each employee's duties and encouraging movement between functions and departments throughout the company -Incredibly intelligent workforce: Salesforce is able to use its strong brandname to hire only the top talent and as a result has an environment where you are constantly challenged and learning, which continuously develops your own skill set. (Less than 1% of applicants receive employment offers) -Strong community environment: Salesforce has been able to build a corporate family unlike any company I've been a part of before. People honestly care for each other and will go out of their way to look out for past and present employees. Salesforce focuses on working as a team rather than separate individuals which develops a sense of inclusion. -Incredible parties: Salesforce certainly caters to a more extroverted, lively and connected personality by having frequent social and networking events throughout the year -$100/mth employee fitness benefit and health benefits that are largely absorbed by the company. Free yoga classes and espresso bars are also offered in some offices -Offices are generally situated in the heart of cities rather than in suburbs",-Headcount growing perhaps too quickly which could transform the community feel to a more corporate environment -Does not offer full meals (light snacks and beverages are provided) -Signals of a more corporate future ahead evidenced by a shift away from local vendors to their global competitors,62 people found this review helpful
35,Great if WLB is all you care about,"Oct 9, 2020 - Lead Member of Technical Staff",2.0,Work life balance Benefits are comparable to most big tech companies Pay is above average when you join Large market share and consistent financial performance will ensure the company stays stable a long time.,Technical culture is struggling to stay current. Change comes slow at most big companies but this is the slowest I've seen. Technical culture is very conservative. Fear of making a mistake paralyzes teams from taking action.,1 person found this review helpful
36,"Good Company, but getting too big and disorganized","Feb 24, 2021 - Lead Solution Consultant in San Francisco, CA",3.0,"Great Teammates, Fast-Paced, Good Culture, Good Customers","Disorganized, Marketing Heavy Approach to Everything, Middle Management, Lack of Promotional Track",2 people found this review helpful
37,Amazing employer,"Jan 4, 2021 - Account Executive",5.0,"Work hard, play hard culture",strong focus on targets & quota,Be the first to find this review helpful
38,good,"Apr 29, 2021 - Good Company",4.0,Overall good company with benefits,I don't have any cons,Be the first to find this review helpful
39,Great experience 1st 6 months,"Oct 26, 2020 - Customer Success Manager in Boston, MA",5.0,"Benefits, pay, volunteer opportunities, sense of community, constant learning and growing opportunities","In a virtual world now, hard to really get to know co-workers, I suspect that will change in the future though.",Be the first to find this review helpful
40,Great company!,,5.0,"Nice people, lots of work to do, grey environment","None to share, work environment was pretty pleasant",Be the first to find this review helpful
41,A sales culture with good benefits,,4.0,"Competitive salary, bonus structure, retirement, PTO, etc.",An extremely sales oriented organization,Be the first to find this review helpful
42,All hat and no cowboy,,2.0,Salesforce is Oracle with cartoons.,The company lacks integrity. Trust is a marketing term.,9 people found this review helpful
43,The hype is real,,5.0,- Rockstar teams. I've never worked with more talented colleagues. - Value driven instead of Profit driven - Benefits that truly allow you to have a work-life balance - Incredibly competitive compensation - Tons of opportunities to advance your career and develop new skills,- We rename our products a lot and innovate at warp speed. This can be difficult for staff & customers alike to keep up with. - High-power work environment that might not be right for everyone. We work very hard to consistently surpass our customer's expectations.,Be the first to find this review helpful
44,Good,,5.0,benefits are good. work life balance,tech stack. the core app is big,Be the first to find this review helpful
45,Amazing employer,,5.0,"Work hard, play hard culture",strong focus on targets & quota,Be the first to find this review helpful
46,It's Great,,5.0,Onboarding during pandemic has been outstanding. People are amazing,Pace of work can be challenging,Be the first to find this review helpful
47,A great place to work,,4.0,"Amazing talented people, a great product, and a powerhouse of a company.","Endless lower-level management churn, lots of non-standard tooling (non-transferable skills)",Be the first to find this review helpful
48,Great Company and Benefits,,4.0,"Benefits, diversity, volunteer opportunities, office space","Opportunity for advancement, management is not open to new ideas, and micromanagement",Be the first to find this review helpful
49,"Great for family benefits and Sales training, education",,4.0,"Amazing benefits, Lots of resources for training or enablement, great tech for employees, healthy work life balance","Micro management, highly challenging quota, strict diligence to Salesforce utilization, double standard of performance vs vacation time",Be the first to find this review helpful
50,Great place to work!,"Dec 22, 2020 - Manager",5.0,great work life balance at salesforce,not as competitive as other high tech companies,Be the first to find this review helpful
51,Good,"Apr 21, 2021 - Senior General Manager in Marlborough, MA",4.0,Pay is very good all around,Balance and work life is very hard,Be the first to find this review helpful
52,Outstanding Company to Work For!,"Oct 2, 2020 - Strategic Account Executive in Dallas, TX",5.0,"Great environment, for a large company, amazingly nimble to react and innovate. Smart, assertive people everywhere with a great culture. Great balance in focusing on meeting performance objectives and making the world a better place...",Some amount of bureaucracy which is to be expected in a company this large.,Be the first to find this review helpful
53,Great so far,"Dec 27, 2020 - Analytics Manager in San Francisco, CA",5.0,Good salary and a good culture,"Non-mission driven product, lots of bureaucracy",Be the first to find this review helpful
54,N/A,"Apr 22, 2021 - Security Manager in New York, NY",4.0,"Best work place, family friendly, ohana, competitive","Not applicable, Not applicable,Not applicable,",Be the first to find this review helpful
55,Solution Architect,"Apr 15, 2021 - Solution Architect in Miami, FL",4.0,"Progressive culture, ESPP, 401k, RSU",Less opportunity to move laterally to different parts of company,Be the first to find this review helpful
56,Salesforce is a great place to learn and perform,"Jun 15, 2020 - Mid Market Account Executive in San Francisco, CA",5.0,"resources, leadership, culture, perks, benefits, compensation, enablement, great offices, social organization, volunteer time off, donation match, flexible work options, structure, transparency, employee resource groups, diversity, continuing education.","Sometimes you're thrown to the wolves, you have a huge toolset but you need to take ownership of learning how to use what's given and navigate your resources.",Be the first to find this review helpful
57,Holds onto its culture,"Sep 20, 2020 - Senior Director in San Francisco, CA",5.0,"Collaborative culture, doing good in the world, continual innovation (no resting on its laurels), working very hard on keeping the culture that has made it such a great place to work, even as company grows. Never boring, always interesting. Good career growth. Competitive compensation.",Relentless pace. You really need to be OK with this.,1 person found this review helpful
58,Company who lives their values,"Oct 19, 2020 - Employee Success in San Francisco, CA",5.0,Very strong and positive culture; very smart and hardworking teams; excellent pay and benefits; places a lot of value on diversity and giving back to our communities; values well-being of employees,Heavy workload and working across global time zones can be challenging at times,Be the first to find this review helpful
59,BDR,"Apr 16, 2021 - BDR Representative",4.0,a lot of benefits and a solid starting salary,can be a very stressful environment,Be the first to find this review helpful
60,Salesforce Account Management,,4.0,"Great enablement, marketing, and technical support",Positions change often - not a great deal of stability,Be the first to find this review helpful
61,Great values and culture but bureaucratic,,4.0,"Values, balance, culture, inclusivity, challenge",It’s become a massive companie with red tape and bureaucracy,Be the first to find this review helpful
62,Good for early on in your career,,3.0,Good Benefits and helpful coworkers,Limited opportunity and too politically correct,Be the first to find this review helpful
63,Solid Company,,5.0,"Many - culture, leadership, product, customer base",None that I can think of.,Be the first to find this review helpful
64,Sales,,5.0,"Sales, Sales, Sales, Sales, Sales","None, None, None, None, None",Be the first to find this review helpful
65,Great company,,5.0,Everything about the company is great!,It's huge! - not really a con,Be the first to find this review helpful
66,Solid place to work,,5.0,"Competitive salaries, flexible work life balance, company takes care of employees","Large company, changes often, can have beurocracy",Be the first to find this review helpful
67,Takes care of employees,,5.0,Good employee support during COVID times,Things move slow. Very corporate feeling,Be the first to find this review helpful
68,Great so far,,5.0,Good salary and a good culture,"Non-mission driven product, lots of bureaucracy",Be the first to find this review helpful
69,"Great company, good management",,4.0,"Good benefits, great company culture Role is a grind at times, like any sales role but they do a good job of creating a good work life balance",If you are interested in pursuing a career path other than sales it is difficult to make a lateral change from SDR Very compet,Be the first to find this review helpful
70,Great teammates,"Jan 10, 2021 - Lead Quality Assurance Engineer in Indianapolis, IN",4.0,Best benefits in town Highest pay in town,Hybrid engineering shift was a waste,Be the first to find this review helpful
71,So fortunate to be a part of this company's mission,"Dec 26, 2020 - Strategic Account Manager in Arlington, VA",5.0,"Strong culture, tightly aligned to values Transparent leadership Products work as advertised Company cares greatly about customer-derived value Fun, inspiring place to work",Got big real fast... still fighting to maintain start-up/growth mentality,Be the first to find this review helpful
72,Great company,"Jan 9, 2021 - Senior Database Engineer in San Francisco, CA",4.0,"flexible, open, learn new skills","too big, internal politics, slow growth",Be the first to find this review helpful
73,"Market-driven company, lots of change","Jan 6, 2021 - Principal Researcher in San Francisco, CA",4.0,Good work-life balance; growth opportunities for those willing to do the work,"Many are coasting, lots of ""established"" egos to deal with, easy to get stuck",1 person found this review helpful
74,Loving Salesforce Ohana,"Dec 24, 2020 - SRE/Systems Engineer in San Francisco, CA",5.0,"Wonderful Culture and great products Very smart and driven people at Mulesoft Managers/Leadership are acceptive and inclusive to diversity in ideas and people Strong Team spirit, helping each other to succeed and win as a team Flexible remote work option",Will update when I know,Be the first to find this review helpful
75,Solid Company,"Jan 7, 2021 - Manager in Chicago, IL",4.0,"Great benefits, progressive culture, leader in the industry","Too large, lots of red tape",Be the first to find this review helpful
76,"Solid Company, growing fast despite large size","Jan 7, 2021 - Senior Analyst, Compensation in San Francisco, CA",4.0,"great benefits, great individuals, lots of team activities",internal upward mobility is increasingly difficult as the company is growing,Be the first to find this review helpful
77,"Amazing, challenging and rewarding","Dec 23, 2020 - Associate Solution Engineer in Chicago, IL",5.0,"Great teams and management, office culture, developmental programs","Very demanding work, need more exposure to other teams",Be the first to find this review helpful
78,Fantastic place to work!,"Dec 23, 2020 - Director in Chicago, IL",5.0,Proud of the values and the product. Feel very supported through career growth.,"Salesforce has grown considerably and this can change a culture, but it's adapted successfully to it's size.",Be the first to find this review helpful
79,There's not a better company to work for,"Dec 23, 2020 - Business Development Associate in Denver, CO",5.0,"- Great management: extremely supportive, invest time and effort into your growth - Great coworkers: everyone's fun, young, competitive, eager-to-learn, overall great work environment - Great career trajectory - if you perform well, there's endless opportunity to grow and network within the company",- I can't think of any,Be the first to find this review helpful
80,Field Service,"Dec 22, 2020 - Field Service Account Executive in Boise, ID",5.0,Field Service Account Executive Salesforce,ERP finance back office software,Be the first to find this review helpful
81,Awesome,"Dec 22, 2020 - Software Engineer in San Francisco, CA",5.0,Culture and benefits and work,"Pay raise, stock, promotion at work",Be the first to find this review helpful
82,Solid,"Apr 15, 2021 - Anonymous Employee",4.0,"Stable, growing, dow Jones, competitive","Large, slow, traditional, typical, predictable",Be the first to find this review helpful
83,Best company in Indy,"Nov 11, 2020 - Sales Operations Contract Specialist in Indianapolis, IN",5.0,"Whatever great stuff you’ve heard about it, it’s really that great to work here.","Fast paced, can be high pressure, hard to “unplug” even though it’s highly encouraged.",Be the first to find this review helpful
84,You create your own path,"Mar 19, 2021 - Senior Director in San Francisco, CA",4.0,"Opportunity exists, you might need to be persistent","Some issues seem to persist unnecessarily, intent is there, execution sometimes will miss",Be the first to find this review helpful
