,title,author_info,rating,pros,cons,helpful
85,Great place to work,"Nov 4, 2020 - Director of Engineering in Naperville, IL",5.0,- Interesting and challenging work. - Gives back to community and gives time off to do this work. - Matching donation for employee donations to qualified 5013c.,None that I can think of.,Be the first to find this review helpful
86,Innovative,"Dec 2, 2020 - Account Executive in Seattle, WA",5.0,Thought leaders. Account focused and product specific sales.,Large company does not always have the employees' best interest in mind.,Be the first to find this review helpful
87,"As advertised, a great place to work","Sep 21, 2020 - Senior Solutions Engineer/Consultant in New York, NY",5.0,"Consistent vision that resonates, and is well articulated","As with any large organizations, a lot of meetings but with COVID and lack of on-site gathering, it is the best any group can do",Be the first to find this review helpful
88,Amazing place to work!,"Nov 23, 2020 - Senior Account Executive",5.0,The people are truly amazing,performance based culture so if thats not your thing for sales this is not your place!,Be the first to find this review helpful
89,"Great for family benefits and Sales training, education","Jan 18, 2021 - Account Executive",4.0,"Amazing benefits, Lots of resources for training or enablement, great tech for employees, healthy work life balance","Micro management, highly challenging quota, strict diligence to Salesforce utilization, double standard of performance vs vacation time",Be the first to find this review helpful
90,"Values employees, giving back, customer success","Mar 4, 2020 - Enterprise Account Executive in Indianapolis, IN",5.0,"A real culture here. While I don't go along with everything, I appreciate that Salesforce is really concerned about the welfare of its employees. Good pay. Lots of benefits. A real commitment to promoting volunteerism. There are a lot of smart, dedicated people working to help the customers succeed.","Pressure of getting up to speed and performing starts as a soft buzz in the background that gets louder as you go. There is A LOT to learn - it's a big organization with particular ways of doing things. Also, there are almost too many channels of communication. So, all of this combined can be somewhat overwhelming at times.",2 people found this review helpful
91,Fantastic Company Focused on Doing Good,"Jul 28, 2020 - Lead Solution Engineer in Nashville, TN",5.0,"They care about their employees, the communities they live and work, and overall making a positive impact in our world. Their innovation and the desire to work together to meet customer's needs is very exciting.","Started during 1 month prior to Covid, which has impacted my ability to get face to face with customers and colleagues. Makes it more challenging to connect on a personal level.",Be the first to find this review helpful
92,Great place to work!,"Oct 24, 2020 - Associate Manager in San Francisco, CA",5.0,"Great work-life balance. Great benefits, competitive compensation.",Company is so large that it is easy to get lost in the shuffle and to get meaningful work across the finish line.,1 person found this review helpful
93,Working conditions,"Mar 21, 2021 - Vice President",3.0,"Fast paced, growing company. Clear set goals.","struggle to make decisions, change directions too frequently, do not take care of basic issues.",Be the first to find this review helpful
94,Very good company,"Apr 4, 2021 - Systems Engineer in San Francisco, CA",4.0,Employees are treated very well.,"Very large corporation, with all that implies",Be the first to find this review helpful
95,Great white it lasted,"Feb 28, 2021 - Principal Architect in San Francisco, CA",4.0,Good colleagues. Convenient location. Challenging problems.,Decided they could hire two productive engineers for the price of one senior systems researcher,Be the first to find this review helpful
96,Best Place to Work,"Mar 25, 2021 - Senior Analyst, Learning Design in Atlanta, GA",4.0,"Work life balance, equality, opportunity for growth",Constant change - which could be a good thing,Be the first to find this review helpful
97,Still a great company,"Mar 5, 2021 - Account Executive",4.0,"Best in class product, they hire great people, good benefits, customer-centric.",Still figuring out how to deliver a bottom-up sales motion along-side the top down sales motion.,Be the first to find this review helpful
98,Great Place to Work - Questionable Layoff Period,"Oct 30, 2020 - Technical Product Marketing Manager in San Francisco, CA",3.0,"Giving back culture, volunteering, matching, team was fun","Layoffs were done terribly. Terrible communication and rationale, seemed very much rushed for no reason whatsoever. Executive rationale was abysmal and affected employees were shown the door and not treated with dignity or respect",6 people found this review helpful
99,Best Company,"Dec 9, 2020 - Technical Engineer in San Francisco, CA",5.0,Best Benefits like health care and Bonus,There are no cons for salesforce,Be the first to find this review helpful
100,Fantastic Place To Work,"Dec 10, 2020 - Anonymous Employee",5.0,"This is a great place to work if you are interested in growing your career in a high growth, sales driven organization, that strives to put their customers and employees first.",None that I can think of,Be the first to find this review helpful
101,Work at Salesforce,"Dec 24, 2020 - Senior Success Engineer in Atlanta, GA",4.0,"Good work life balance , good hike , good benefits","Promotions only by pleasing manager, change of teams are lateral moves so no pay change or grade change",Be the first to find this review helpful
102,10 years+ and loving it!,"Dec 9, 2020 - Director in Atlanta, GA",5.0,"The people are sharp, intelligent and care for one another. The product helps businesses of all shapes and sizes. The company takes care of its people and the career opportunities have been excellent.",The business is demanding and moves quickly.,Be the first to find this review helpful
103,Great place to work,"Dec 9, 2020 - Customer Success Manager",5.0,Support through covid has been great,none to share right now,Be the first to find this review helpful
104,Good company,"Dec 9, 2020 - Senior Success Specialist",5.0,"Benefits, Work/ life balance, pay",Constant changes in processes and management,Be the first to find this review helpful
105,Great company,"Dec 20, 2020 - Account Executive in New York, NY",4.0,Great products and clear company vision,Poor middle management and too much favoritism,1 person found this review helpful
106,Living the life of Ohana,"Dec 8, 2020 - Senior Account Executive in Reston, VA",5.0,Great environment to work in and truly interested in our customer's success!,I should have come to work here 5-10 years ago,Be the first to find this review helpful
107,Great company,"Dec 7, 2020 - Corporate Development",5.0,"Amazing culture and benefits, management",Nothing to comment here for this section,Be the first to find this review helpful
108,Great Company,"Dec 1, 2020 - Senior Customer Success Manager in Chicago, IL",5.0,Smart People Interesting Work Always something new,Sometimes too much change to be able to fully absorb,Be the first to find this review helpful
109,Great place to work,"Nov 25, 2020 - Senior Director in San Francisco, CA",5.0,"Great remote work culture, work hard play hard",Have to keep up with changes and pace.,Be the first to find this review helpful
110,BDR review,"Oct 9, 2020 - Business Development Representative in San Francisco, CA",5.0,-access to talented and experienced high level AE's and RVP's -helpful team environment -fun incorporated as much as possible,"-very intense sales work environment -quotas very challenging to reach for certain sales territories, also greatly depends on AE alignment",Be the first to find this review helpful
111,Intense sales culture,"Apr 2, 2021 - Account Development Executive in New York, NY",3.0,"benefits are great, many perks","Intense sales culture, must work hard",Be the first to find this review helpful
112,"Great pay, Koolaid culture","Feb 17, 2021 - Accounts Payable Manager in Seattle, WA",4.0,"Great pay, benefits, and unlimited PTO","Work culture is siloed, although senior leadership is great the CEO leaves a lot to be desired, at times it feels like a ""drink the Koolaid"" culture",Be the first to find this review helpful
113,NA,"Dec 4, 2020 - Account Executive",5.0,Great company to work for.,None that I have come across at this time.,Be the first to find this review helpful
114,"Great Company, People, and Perks","Dec 2, 2020 - Analyst in San Francisco, CA",5.0,"culture, people, work, direction, customers",very fast pace not for everyone,Be the first to find this review helpful
115,Salesforce makes me a better person,"Nov 16, 2020 - Business Operations Manager",5.0,They lead by example and inspire me to always do my best,Very demanding role but worth it,Be the first to find this review helpful
116,"Great company, better culture","Dec 3, 2020 - Associate Analyst in Indianapolis, IN",5.0,"work life balance, culture, innovation","growing super fast, lower industry pay",Be the first to find this review helpful
117,Phenomenal company,"Dec 2, 2020 - Sales in Birmingham, AL",5.0,"Best products, best support and constantly evolving portfolio.","Salesforce is a high pressure work environment. If you can handle the pace and stress, you’ll thrive",Be the first to find this review helpful
118,Benioff is one heck of a guy,"Dec 1, 2020 - Program Manager",5.0,Understand why it's considered a top place to work,Constantly changing priorities means a lot of unfinished business,Be the first to find this review helpful
119,Great,"Dec 1, 2020 - Account Executive in Austin, TX",5.0,Great professional leadership integrated well paying,Rigid rigor app for it,Be the first to find this review helpful
120,Great Place to Work,"Dec 1, 2020 - Account Executive in San Francisco, CA",5.0,Great sales training for Account Executives,long hours for sales reps,Be the first to find this review helpful
121,Great Culture,"Dec 1, 2020 - Senior Engineering Manager",5.0,Salesforce values work life balance and as long as your role is useful to the good of the company then it will take care of you.,Stock refreshes aren't as significant as others,Be the first to find this review helpful
122,"In the end this place isn't different, it sucks","Dec 7, 2020 - Senior Manager, Revenue Operations",2.0,"friendly, helpful, try to be nice and treat you well",11hr days are the norm. Unlimited PTO equals your boss's boss being mad people are on PTO because we are so busy. I miss earning PTO so that I could at least take a vacation. If you aren't part of the Headquarters crew in SF then you are an other and they will make you feel that every day as your lunch is forgotten and you have to take a break from work to help put your kids to sleep.,7 people found this review helpful
123,Good Benefits but a lot of politics,"Dec 13, 2020 - Project Manager",3.0,Great benefits - 6 month maternity leave,"Politics, hard to get promoted",1 person found this review helpful
124,this is a great company to work for,"Nov 18, 2020 - Engineering Program Manager in San Francisco, CA",5.0,good work culture and work ethics,elevated job titles but not the salaries,Be the first to find this review helpful
125,Best Company to Work For,"May 15, 2020 - Senior Executive Assistant in New York, NY",5.0,"Salesforce is a genuinely value-driven company that operates with transparency, a heart of innovation and humanity. Someone with a growth mindset and excitement to learn will do well here. Believe the hype!","There is an awful lot to learn when you start, and the organization can seem a bit duplicative and takes a bit of time to sort out, but by six months in, it starts to make sense. (This isn't a con, really, just advice for newbies.)",5 people found this review helpful
126,Good company to work for,"Mar 25, 2021 - Software Engineer",3.0,Has work from home flexibility,Not good in giving stock options,Be the first to find this review helpful
127,Culture & People,"Nov 23, 2020 - Senior Recruiter",5.0,Great culture. Talented people. Wonderful technology!,"Has become a large company. More rigor, more process.",Be the first to find this review helpful
128,Fantastic Culture,"May 9, 2021 - Core Account Leader in Seattle, WA",1.0,Great benefits. The company “walks the walk” regarding core values. Employees feel valued.,Not many. Most would be nit-picking.,1 person found this review helpful
129,Great place to work!,"Mar 2, 2021 - Sales Development Representative (SDR) in New York, NY",4.0,"Great benefits, welcoming work environment, snacks, and food always available in the office","tough and aggressive quotas, a lot of politics in management",Be the first to find this review helpful
130,Great marketing leading cloud solution provider,"Nov 24, 2020 - Account Executive in Minneapolis, MN",5.0,Market leader CRM with expansive platform,Competitive with other major vendors,Be the first to find this review helpful
131,"Great company, good management","Jan 10, 2021 - Sales Development Representative in Chicago, IL",4.0,"Good benefits, great company culture Role is a grind at times, like any sales role but they do a good job of creating a good work life balance",If you are interested in pursuing a career path other than sales it is difficult to make a lateral change from SDR Very compet,Be the first to find this review helpful
132,Amazing company just find the right team!,"Feb 13, 2021 - Senior Product Designer in New York, NY",4.0,Salesforce puts its people first and really prioritizes the needs of its employees.,It was incredibly difficult to understand expectations for promotion and went through several reorganizations and managers.,Be the first to find this review helpful
133,Fine,"Mar 21, 2021 - Technical Support in Redmond, WA",4.0,"Pay, pay, stocks, pay, pay for work",Work. It’s meaningless and a waste of time.,Be the first to find this review helpful
134,Not Real Ohana,"Dec 6, 2020 - Customer Success Manager in New York, NY",2.0,"Fairly transparent for an increasingly more corporate company. Good perks like wellness reimbursement, sabbatical and VTO hours","Many leaders have limited experience in enterprise technology and don’t understand its nuances, creating difficulty for employees. Individual contributors often end up managing up and receiving little support. Leadership consistently meets minorities with skepticism, doubt and microagressions. They severely lack empathy and have one vision of success. It’s a very homogeneous culture. If an employee is different, they are gaslit and “othered.” It’s been consistent that BIPOC employees experience mental distress at hands of peers and leadership. The Ohana has a serious culture problem and only making superficial strides to correct. It is the modern good ole boy.",4 people found this review helpful
135,Nice place to work,"Dec 10, 2020 - Program Manager in San Francisco, CA",4.0,Great group of people to work with and the benefits are pretty amazing.,"We talk like we are in a start-up environment, but really, we are a high company.",Be the first to find this review helpful
136,Decent place to work,"Dec 8, 2020 - Product Manager in San Francisco, CA",2.0,"Good work life balance, some great managers.",Highly discriminatory towards individuals with chronic illnesses and disabilities.,2 people found this review helpful
137,Great Place To Work,"Dec 8, 2020 - Analyst",4.0,Great work life balance and pay,Inconsistent talent across different teams,Be the first to find this review helpful
138,Great,"Dec 8, 2020 - BDR Representative",4.0,"Fast Paced, Great Team, Inclusive Environment","San Francisco, Large Company, That's it",Be the first to find this review helpful
139,Security & Compliance,"Nov 23, 2020 - Product Manager in Seattle, WA",5.0,Great place to work. Nice work environment.,Everything is great here and nice people,Be the first to find this review helpful
140,amazing company,,5.0,All good with the company and growth,i have found none so far,Be the first to find this review helpful
141,Good company,,4.0,Executive leadership caring about its employees and their well being,New leaders how should have gone through thorough training,Be the first to find this review helpful
142,Incredible Company,,5.0,"Innovation, values, pace, opportunity, leadership","It's a sales driven organization so unless you are driving revenue in some capacity, it's not for you",1 person found this review helpful
143,great company,,3.0,great pay benefits family oriented,slave work never and off days you live their,Be the first to find this review helpful
144,Great Place to Work !,,5.0,- Had a smooth onboarding experience despite joining in the pandemic time. - Great benefits offering. - Also loving the #Ohana culture of salesforce which reflects great sense of care and inclusiveness. - Finding it as place for learning and career growth opportunities.,- Nothing so far to comment.,Be the first to find this review helpful
145,MTS Review,,4.0,Great WLB and people are nice,Pay does not match market standard,Be the first to find this review helpful
146,Great place to work a bit big for my tastes,,4.0,"Great benefits, super talented people, a company doing big things.",Too many people and when there are that many people there are bound to be some jerks.,Be the first to find this review helpful
147,Pretty good work life balance,,4.0,Work life balance is great,Lack of holistic vision across different orgs,Be the first to find this review helpful
148,Losing its focus,,3.0,Have had a long career. Moving around has been traditionally encouraged. Met many wonderful people.,Many leaders in their positions simply because of tenure. Very unclear what actually matters to company any more. Extremely political. So many cooks in the kitchen on everything that things get sloppy and it's incredibly hard to move fast.,2 people found this review helpful
149,#SalesforceOhana,,5.0,"Compensation & Benefits, Many opportunities for advancement, lots of cross-team collaboration, weekly introduction to new services and products, countless employee resource groups",There are none at the moment,Be the first to find this review helpful
150,Walking the walk,"Dec 1, 2020 - Senior Technical Account Manager in Austin, TX",4.0,Many benefits Lots of growth opportunities and encouraged to explore new venues to help personally and professionally A large focus on D&I,Lots of tools to use and it is difficult to know what to use and when to use them,Be the first to find this review helpful
151,Great Company,"Dec 1, 2020 - Business Development Associate (BDA) in Indianapolis, IN",4.0,Company Culture & Benefits. Opportunities inside company,Very demanding environment for compensation,Be the first to find this review helpful
152,"Good culture, difficult to innovate","Dec 1, 2020 - Director of Product Management in San Francisco, CA",3.0,It is aways good working for a well respected responsible company.,"Typical big company bureaucracy and politics. Motivation is to monetize what already exists, and this comes at the cost of innovation.",Be the first to find this review helpful
153,great place to work,"Nov 16, 2020 - Maniger At Own Business in New York, NY",5.0,It was a great place to work,I do not have a problem with this company,Be the first to find this review helpful
154,Truly is a great place to be,"Nov 16, 2020 - Account Director in Chicago, IL",5.0,"lots of variety, same sales demands but with room to grow, move",same sales demands not adjusted per pandemic,Be the first to find this review helpful
155,Sales at Salesforce,"Nov 30, 2020 - Account Executive in Atlanta, GA",4.0,"Culture, compensation, reputation, product, customers","Onboarding, support, communication, leads, pipeline",Be the first to find this review helpful
156,Salesforce,"Nov 30, 2020 - Vice President Sales in Philadelphia, PA",4.0,"Great culture, people, benefits and opportunity.",Large company that has too many products,Be the first to find this review helpful
157,Don't believe the hype,"Dec 10, 2020 - Vice President of Sales in Dallas, TX",1.0,"You are lucky enough to sell a really great product - unfortunately, the company doesn't live up to their own public values to make it worthwhile to stay.",Management bullies women - good ole boys network The commission system & calculation is broken - you're consistently having to fight for what is owed to you The territory system is broken - the San Francisco team consistently steals accounts from non-SFO territories (and gets away with it),18 people found this review helpful
158,Salesforce forces employees to fake positive glassdoor reviews,"Dec 3, 2020 - Tech Lead in South San Francisco, CA",1.0,"Money was ok, everything else was a nightmare.",All the positive Glassdoor reviews for Salesforce are the same. That's because they make new employees lie and fill out five star reviews saying they've been there a year during new employee orientation. Ohana is just propaganda. This company is incredibly irresponsible with their customers and you will feel bad every day working here. Read the one star reviews and ignore the identical fake five star reviews.,28 people found this review helpful
159,It was cool,,3.0,Very cool office and people,Some not very cool people.,Be the first to find this review helpful
160,Cook,,1.0,"Good food, good location, I cook all the food","Pay, management, cost of living",4 people found this review helpful
161,Lives up to All The Best Place to Work Hype,,5.0,"The company is in growth mode which means they are always looking for new talent and new ideas. There's always something new happening to change the game whether it's from an acquisition, a new product, an updated product, or just a new way of thinking. It's truly an exciting time to be apart of Salesforce. - Company culture - Smart & talented people - Promotion transparency - Wellness opportunities - Volunteer focused",- Big company which means big changes - You have to know the right people,1 person found this review helpful
162,Job,,5.0,Ohana Training Opportunities Teamwork Technology Community,Process Enablement Hours Rigor Learning,Be the first to find this review helpful
163,Salesforce Review,,5.0,Career Development Growth Culture People Management Work and Life Balance,I can't think of any cons for Salesforce,Be the first to find this review helpful
164,Best company in Indy,,5.0,"Whatever great stuff you’ve heard about it, it’s really that great to work here.","Fast paced, can be high pressure, hard to “unplug” even though it’s highly encouraged.",Be the first to find this review helpful
165,Good work life balance,,4.0,Good Work life balance for folks looking to take it easy in tech,tech stack is pretty outdated,Be the first to find this review helpful
166,Exceeded Expectations!,,5.0,"I applied/accepted Salesforce because of the reputation they have created for being a great place to work. I had very high expectations for the company, and after working here 6 months I can honestly say that Salesforce exceeded my (very high) expectations. (And I started during the pandemic work from home era) I have never had such kind and compassionate coworkers. The culture is not just talked about, it is lived and emulated throughout the company. The compensation and benefits are at the top of the industry standards. The leaders here truly care for those that work under them, and wellbeing is something that is emphasized and preached. Honestly, I have never been happier at a job before. I love working at Salesforce and don't see myself leaving anytime soon (or ever!)","Because Salesforce is in such an innovative industry, change is a constant. Most people go along with it fairly well, but if you resist change this would not be a good place for you. Expectations are high, but leaders are compassionate and help you achieve those high expectations.",2 people found this review helpful
167,"Crappiest company to work , especially 1P SRE",,1.0,"Good benefits, Stay away from salesforce.","Lot of politics, crappy tool and management.",10 people found this review helpful
168,Great company,,5.0,It is a great company,It is a brilliant company,Be the first to find this review helpful
169,"Great Company, Fun","Nov 24, 2020 - Vice President technical program management in San Francisco, CA",4.0,"Great work life balance, they’ve figured out the secret sauce on some different fronts",More and more political the higher up you go,Be the first to find this review helpful
170,Senior Solution Engineer,"Nov 9, 2020 - Senior Solution Engineer in Orlando, FL",5.0,1. Great company culture 2. Really focus on work life balance 3. Amazing support from peers and internal teams 4. Best in Class products,Sometimes the company can feel like is moving very fast and it is imperative for you to do the same to stay up to date with new products/ strategies. Not necessarily a con but it is important to have an agile mindset to be successful at Salesforce.,Be the first to find this review helpful
171,10/10 place to work,"Nov 8, 2020 - Senior Consultant in New York, NY",5.0,Amazing Company. Amazing CEO. Amazing People.,Can be tough to move up in such a large company.,Be the first to find this review helpful
172,Nice Place to work,"Nov 8, 2020 - Software Engineer (LMTS) in San Francisco, CA",5.0,Great Office Space to work,Too much process in work,Be the first to find this review helpful
173,Great place to work,"Nov 8, 2020 - Business Operations Analyst",5.0,"Flexibility, company culture, community engagement","Size, lower compensation, push towards moving employees to Indiana, overstaffed, no other cons",Be the first to find this review helpful
