,title,author_info,rating,pros,cons,helpful
54,Enterprise Account Executive,"Mar 29, 2017 - Enterprise Account Executive in Espoo",5.0,A spectacular place to be right at this moment. Salesforce is leading the transformation to the fourth industrial revolution. A lot of exciting opportunities with a great team.,Work life balance is a challenge but it is supported by management.,Be the first to find this review helpful
55,"Great way to expand sales skills, just don't","Aug 4, 2017 - Anonymous Employee",4.0,- Forefront of the industry - Innovative company - Vibrant sales force,- Burning too many bridges with customers will come back to bite them - Success can vary wildly year to year - Territories are getting too thin to be successful on a regular basis - Short term customer relationships don't do customers any favours,1 person found this review helpful
56,Senior Account Executive,"Oct 24, 2017 - Senior Account Executive in Paris",5.0,Company DNA is based on 1-1-1 model and giving back to community (7 days of Volunteering Time Off each year) Awesome benefits Employee experience is as important as customer experience,You need to set your Work/Life balance,1 person found this review helpful
57,Sales Development Representative,"Jul 20, 2018 - Sales Development Representative in Sydney",5.0,- Direct career path opportunities - great support and benefits - The culture of the company is strong and upbeat - Great learning opportunities.,- Can sometimes feel like a bit of a corporate giant,1 person found this review helpful
58,#1 best company to work for,,5.0,"Amazing benefits Really hard-working and friendly, helpful employees - they hire on personality and ethics. Fantastic values, we really make a difference here and you have very happy clients. New business comes easily as the brand is so well revered. Product caters for all types of business from one man bands to google, amazon and Governments",Nothing is perfect but the tiny tweeks required are happening in real time to try and make the life here as enjoyable and productive as possible. Salesforce don't actually have the cleanest use of the Salesforce app! More app rigour could help with account team changeovers as there is a loss of info when teams swap. The sales commission on very big deals is heavily reduced,1 person found this review helpful
59,"Growth, Growth, Politics",,2.0,Great environment to work. You are able to feel the growth and why this company is “innovative” when you work for. People are awesome to work with.,"Too many politics in the local region and revenue-only focus. And HQ is not interested in a non-US region. A power harassment by a local none-sales executive(such as VP level of Mktg, HR, Finance, Strategy)occurs and lies neglected.",3 people found this review helpful
60,Great Place to work,,3.0,Engaging work for the teams Pay and benefits,Hybrid development goals and training were not well thought out.,Be the first to find this review helpful
61,Get on board the rocket ship,,5.0,"Employee benefits are like nothing I’ve ever seen and everyone is so on board with the company culture and vision. You also get access to an almost infinite amount of resources/support to succeed - from management teams and specialists, to an open calendar of enablement sessions to sharpen the saw.","With great benefit, comes great expectation. The targets are always increasing, while territory sizes are decreasing - although with the growing arsenal of products to sell (through innovation and acquisition) there is always plenty of opportunity.",3 people found this review helpful
62,Great forward looking company,,5.0,"Innovation, values, compensation, working from home, customer focussed","Very US centric, expected to be Salesforce to the core",Be the first to find this review helpful
63,Is it,,5.0,Good for my work is your company,My good lock in your,Be the first to find this review helpful
64,Finance - FP&A,,5.0,- Benefits - Competitive Salary - Work with VP level execs from junior positions - Commercially focused role - Great team thanks to important focus of cultural fit - Challenging but great for development - Fantastic development and guidance by management - Outlined career development path - Great chances for volunteering,"- Hours are long, especially at the end of quarters, occasional weekend required - Occasionally too politically correct - Very sales team focused, all other areas can be made to feel like you are 2nd best to them - Split offices mean that most events and senior management locate themselves in one. As based in the other it can lead to a distant feeling. - My team don't do many events or socialising outside the office, but many others do",3 people found this review helpful
65,Perfect Place to be,,5.0,Best in class colleagues & best class products makes Salesforce the perfect place to be,There are now cons working at Salesforce,Be the first to find this review helpful
66,Business Development Associate,,5.0,"Best working atmosphere I have ever seen, working together with enthusiastic colleagues and managers. No hierarchy - everyone is available if you have questions and helps you with a smile. Time for self-development and volunteering activities. Nice office with free snacks, pool table and open spaces instead of small rooms.","The job is not very challenging, but is temporary however - you get the chance to get to know your network and company better in the meantime. The salary is quite low. Office situated in Sandyford instead of city center.",Be the first to find this review helpful
67,Ohana,,5.0,"Employees are spoiled by the best conditions to work in Australia. Offices, food, volunteering time off, top health insurance, wellness benefits",high pressure results driven environment. Salesforce isnt the fastest growing software company by accident,1 person found this review helpful
68,Amazing 6 months,,5.0,Amazing smart and motivated people. Awesome culture. Can do attitude. Team orientated.,None.. but the initial technical certification process was initially a shock to the system.,Be the first to find this review helpful
69,Not for everyone,,3.0,"Flexible hours, health insurance and general perks","If you're looking to work in a 'start up' environment then this isn't for you. Very corporate, similar to a bank.",2 people found this review helpful
70,One of the best place's to work,,5.0,Great to work in an exciting and fast paced environment. Teams are full of talented individuals and the company supports your career aspirations and development. Alot of authomy given over role and decisions.,"As the company continues to grow, it runs the risk of becoming too operationally matrixed and too corporate in culture.",Be the first to find this review helpful
71,Almost 3 years in,,5.0,Great place to work. Love the culture. Trust & Equality demonstrated clearly.,None at the moment - great place to work.,Be the first to find this review helpful
72,"Great, big company",,4.0,"Good perks, solid process, nice brand recognition...","Bureaucracy, very political",Be the first to find this review helpful
73,"Classic American Corporation, good perks",,2.0,Good perks Location Ideal place to try what it like to work in a mega corporation Some positions include stock grants,"Salesforce is huge. Where one department flourish, other can be in despair. Your manager can travel to other offices and spend 15k per trip, where you would find it difficult to get £400 conference ticket approved. Promotions are highly political and not clear. They rarely promote from within and happy to place a friend on a top position. Standard salary early rise is 3%. Bonus 10%, (not sales). Every year they overspend general expenses budget and enforce a lockdown. That affects ability to visit head office and communicate with key colleagues.",8 people found this review helpful
74,Great Company,,5.0,Culture of the company ; Solution ; Equality,Work life balance and benefits could be more agressive,Be the first to find this review helpful
75,"Amazing technology, amazing culture, lots of opportunity for growth",,5.0,Great salary and benefits package Great company culture The pioneer of Cloud computing - and the products live up to the reputation - best technology I have worked with after spending 20+ yrs in software sales,Pace of change is fast and relentless. Sometimes too much info and initiatives to keep up with.,Be the first to find this review helpful
76,Brilliant place to work and help change face of IT,,5.0,Product portfolio is always being developing and covers a wide span of business need,Pressure for growth if anything is immense,Be the first to find this review helpful
77,Sn Account Executive,,3.0,"Very interesting, successful, fast paced, growth company, The sky is the limit feeling. Interesting solutions portfolio, expanding every year. Still a lots of room for growth. Well paid (if you achieve targets).","Work life balance is a real challenge, it's a high pressure environment, very demanding, always-on, real-time reactions expected on everything. Failure is not an option. Salary is good, but the rest of the benefits are weak versus other big software companies. On-boarding for new hires (if no direct experience in selling CRM/Salesforce) is very challenging, steep learning curve.",1 person found this review helpful
78,Great,,4.0,"Great Products, Great Sales and Great People",None what so ever in mind,Be the first to find this review helpful
79,This is a Wonderful Place to work,,4.0,This place has some great talent to work with and learning opportunities are tremendous. You will love going to work everyday because the culture so wonderful. Good benefits and employees are well taken care. The vision of the company is great and inspiring and in all means will achieve the vision. Giving back is a core value and teaches you to be a good human being and I knew the value of giving back after working here.,AS the company is growing in Hyderabad it would be good to groom leaders internally. Career growth seems to be limited.,2 people found this review helpful
80,Amazing Company To Work For,,5.0,Working in a fast moving cutting edge SAAS company was exhilarating.,None Really #Dreamjob Other than Some Late Night Calls with US,Be the first to find this review helpful
81,Business Development Rep,,4.0,"People, Salary, Working Hours, Training","Location, Food, Frequent wrong payment",Be the first to find this review helpful
82,Renewals Manager,,4.0,Good Working environment and very knowledgeable process,No Cons very satisfied with the company,1 person found this review helpful
83,Technical Support Engineer,,5.0,Life balance and great values,none since I started 6 months ago,1 person found this review helpful
84,Great company to work with,,5.0,Client Handling Exposure to Multiple Domains Decent Salary You will get good laptop and latest iPhone Transport and meal are free Awesome Reimbursement of Optical/Dental/Gym etc. Great learning opportunities. Salesforce certification discount vouchers Work from home option available. Stay up to dated about Salesforce latest releases and events.,Avoid being part of Internal politics,2 people found this review helpful
85,Salesforce Consultant,,4.0,"Great place to work for. It’s like working at home. Good environment, ambience and additional perks apart from salary. We are known for leaves offcourse.",Do not work in premier support team(t-2) . You will die with politics and mental pressure and no chance for growth,Be the first to find this review helpful
86,marketing director,,2.0,"Exposure, salary, benefits, budget, salesforce brand and awareness, market positioning and ecosystem, trailhead, strong growth, strategic events, office locations, volunteering","Fatigue, silos, politics, too many cooks in the kitchen, lack of trust, not so ohana, over processed, values not really true day to day - good on paper.",9 people found this review helpful
87,Manager,,5.0,Good company. Good brand. Fastest growing large enterprise software company. Solid presence in San Francisco.,Politics. Lack of team play. Originality and innovation not encouraged. Very hierarchical structure.,Be the first to find this review helpful
88,Great culture and values,,5.0,Doing the right thing for customers and value employees,Rate of change is very high,Be the first to find this review helpful
89,Great company to work for,,5.0,"Flextime, nice community and a great work climate",there are no real cons I've mentioned yet,Be the first to find this review helpful
90,Literally the worst way of hiring process set in place !!!!!!!!!!!!!!!!!,,1.0,Good work life balance facilities are excellent definitely the best brand to start of career with.,"Disgusting management with cheap political views. Can clearly see how the verification and background process works, anyone with Even fake experience and Fake degrees can obtain a job in support, Can clearly see them getting promoted and management applauds them for holding fake certificates. There is a Term Ohana seems like HYD management cannot even adapt to it, and its a SHAME they they lie saying we follow OHANA. Being a parent company management is absolutely scared of Management from centers outside of india. Its not the HYD management who controls the center, but rather other geographical centers. Favoritism by managers to promote and grow a person, who does not even fit the role and infact an unworthy candidate for the position.",11 people found this review helpful
91,Great company values and smart people,,5.0,"Great salary, yearly salary reviews, opportunities to advance, education assistance. Can work from home.",So much to learn but it's worth the effort.,Be the first to find this review helpful
92,Business Development Associate,,4.0,The company is rated top in best places to work in a row (7-8) years on global level. Good work culture.,Fresher don't have a proper knowledge of what the company is expecting from them unless clarified.,Be the first to find this review helpful
93,Best Place to work for,,5.0,Everything is Great in this company.,"No cons found, all good.",Be the first to find this review helpful
94,EBR,,4.0,"learn a lot ,learn to cold call","it's a grind, not a typical 9-5 job",Be the first to find this review helpful
95,Great company to work with,,5.0,Wanna learn rapid growing CRM n SAAS platform?? This is the place to be. Great work environment. Good salary n insensitives. Great place to learn.,Work pressure to an extent. Career opportunities are limited.,1 person found this review helpful
96,Account Executive,,5.0,"Wonderful working environment, teamwork is an attitude both among colleagues and management. Fast and very stimulating job. Really fantastic!","If you are confident in your confort zone only, SF is not for you",Be the first to find this review helpful
97,Not for everyone,,3.0,* Company has a fantastic vision. * Undeniably the leader in B2B CRM. * A wonderful marketing engine * Hitting incredible heights in cloud revenue. * Very good benefits,"* Unless a VP you are a very small fish in a very large ocean * Unless you embrace all facets and say the right things to the right people, you are a number. * Making change is extremely hard. * Sales is the only focus. Dont be fooled otherwise. * If you are male and middle aged you wont progress. (I fully believe in gender equality)",11 people found this review helpful
98,Loving it!,"Mar 18, 2018 - Senior Solutions Architect in Singapore",5.0,Employees are trusted and empowered. Amazing culture. Really believe in the philosophy of work hard and play harder. Open environment.,"Need to be a self starter and be able to navigate your way, with minimum oversight. No one will come and tell you do these set of things in this way. You need to figure out yourself",1 person found this review helpful
99,Amazing Company!,"Mar 14, 2018 - Employee Success in Dublin, Dublin",5.0,"There are too many positives of this company to mention! The culture, the atmosphere and environment are second to none. I enjoy coming into work which has such a huge positive impact in my life!",In my six months I do not have any cons to the company.,2 people found this review helpful
100,World's number one best company to work for.,"Mar 13, 2018 - Senior Consultant in Bangalore",5.0,"Best in class employee benefits, Ohana culture which is really working here, Free food, amazing office space.",No Cons as of now. Salesforce is a very aggressive company when it comes to promoting their brand value and there might be high pressure on employees to deliver their best.,1 person found this review helpful
101,Best company to work with,"Feb 24, 2018 - Customer Success Engineer in Hyderābād",5.0,"1. Best infrastructure 2. Best Ohana culture 3. Best package offered 4. Best facilities like free transport, free food, gym reimbursement and many more 5. Employee centric 6. Many more",Does not have their office in Pune 😔,6 people found this review helpful
102,Join the Ohana!,"Mar 13, 2018 - Anonymous Employee",5.0,"Great culture, benefits and offers 50+ days paid to volunteer","if you don't like change it is the wrong company, Salesforce is a fast moving business and you need to be able to keep up!",Be the first to find this review helpful
103,Great company,"Mar 14, 2018 - Anonymous Employee",5.0,"Awesome company, fun great place to work",none none none none none none,Be the first to find this review helpful
104,Customer Success Director,"Mar 12, 2018 - Portfolio Success Management Director in São Paulo, São Paulo",5.0,The company has an outstanding working atmosphere.,"Due to the fact it is a fast-growth company, the communication process is rather confusing.",Be the first to find this review helpful
105,Account Executive,"Mar 9, 2018 - Account Executive in Dublin, Dublin",5.0,- innovative product - competitive salary - driven people,- competitive landscape - location of Dublin office is in the souther area of Dublin,1 person found this review helpful
106,Great place to work,"Mar 11, 2018 - Senior Account Executive in Melbourne",5.0,- Purpose driven business driven to make the world a better place - High growth and opportunity business,- High pressure environment. Can be very demanding at times,Be the first to find this review helpful
107,A lot of brainwashing...,"Apr 5, 2018 - Anonymous Employee",1.0,- 100 euros for wellness - Unlimited snacks,"- A lot of brainwashing. All you hear and see in the office is them being the #1 at everything they do. At some point, I am wondering if employees really feel happy or if it is just because the rankings are saying so. Please note that you also have to learn by heart a presentation in order to be able to anyone how great SF is. - HR is not mature in Europe. It is quite concerning to not have direct HR support for each country and that you need to log a ticket on their intranet platform. A real person would be nice to have to discuss real/ important life matter - If you don't work in Sales you might not really feel considered by the company. - Getting very corporate and political.. A sad feeling",13 people found this review helpful
108,company environment is good,,4.0,good experiance for working in salesforce,Make to do day and night even stay at office sometimes.,1 person found this review helpful
109,Working at Salesforce,,5.0,"Company's philosophy, growth and development, offices, team.",Having to physically go to the office every day.,Be the first to find this review helpful
110,sales force advice on company,,4.0,Correct pay and colegial atmosphere.,"The infrastructure is not great, but decent.",Be the first to find this review helpful
111,Great Place to Work,,5.0,great compensation package if hitting your number,work life balance isn't the best,Be the first to find this review helpful
112,Making it difficult at work...,,4.0,"Great company, great culture with incredible opportunities to grow personally and professionally. A place people can spend time working on amazing projects, making friends for life however...","People promoted into positions of leadership who shouldn't be in those roles, have no ethical boundaries, no human skills, that can make it working at Salesforce frustrating and difficult mentally. People in VP of EMEA Engineering positions who are self-promoting bully's, taking credit for other peoples work to promote their own brand, using derogatory language to describe colleagues in passing conversations. If those people were few and further",6 people found this review helpful
113,"Looking for a real challenge? Join Salesforce but be prepared, it won't be easy in the beginning (really).",,5.0,"Benefits, environment, transparant, workplace, products, culture, speed of change, market momentum, great customers, great on your resume.","Political, onboarding(first 12 months) are hard, more corporate than they say, not for everyone (you really need to be able and willing to keep changing in your role, in teams and opportunities are fast paced)",2 people found this review helpful
114,great place to work,,4.0,great culture great employee benefits good salary,Very limited progression in UK office Most sales jobs that Business development would have progressed to have moved to dublin,1 person found this review helpful
115,Great and Innovative Company,,5.0,"Great benefits, 1/1/1 model with time off for volunteering, infinite chances to learn. My Senior Management was open minded, confident, and would always listen!","Easy to get lost in such a fast moving company, have to pick your area and dive in!",Be the first to find this review helpful
116,Nice experience,,4.0,Good people working there in the place,Work load is to intensive for time given,Be the first to find this review helpful
117,Wonderful Company!,,5.0,Great benefits and wonderful co-workers,Remote employees have to work harder to stay engaged,Be the first to find this review helpful
118,Fantastic company continuously growing.,,5.0,- Management structure - Potential to grow - Best industry experience available - Excellent Pay - Great benefits - Volunteer time off - Great work environment - Focus on personal growth - Clear career path and progression to name a few...,- Very numbers focused and striving to hit and increase targets which is common in fast-growing companies (not necessarily a bad thing),Be the first to find this review helpful
119,Six months into Salesforce,,5.0,"High growth company with great products, based on strong core values Trust, Growth, Innovation and Equality, carried forward to by strong individuals and a very loyal customer and partner community. Strong sense of giving back, every employee receives 7 days of Volunteer Time per year and the expectation is to use them. Growth of the company gives a lot of perspective for personal career ambition. Employee Stock Purchase Program in place.",Lots of pressure in sales (which is normal) but sometimes the pressure is unreasonable (which should not be the case). Perks and amount of paid leave are under industry standard.,Be the first to find this review helpful
120,salesforce Japan Marketing team,,3.0,Visionary founder. Can gain a great experience in Marketing for a growing company. Good pay and really flexible work style.,"A specific leader, Mari Sagiya, CMO is toxic. Many are voicing their concerns to HR.",5 people found this review helpful
121,Enterprise Architect,,5.0,Amazing company to work for .It's a fast paced organization with chance to grow within organization. Always supporting charities and volunteering,Management and people who were assigned to be managers but have no business to manage people.,Be the first to find this review helpful
122,good company to learn lot of things and learn new skills,,4.0,"Salesforce gives a lot to their employees - good salary, benefits, free snack & drinks, volunteer days and lots of interesting events.",Team Manager are sometimes not a fit for the role - don't understand the market they're managing or speak the language of the country they're managing. On the outside they are living the Ohana culture but on the inside there is not always Ohana. When working in sales for example there is a lo of pressure and too many changes for different processes. Not everybody get's a chance to work here. For example if you have 7 years of working experience in sales but no university degree then you don't get a chance for an interview. This is not right!,1 person found this review helpful
123,Business Partner,,5.0,"Good team spirit, work flexibility, good management.",Having to regurgitate the company values on a regular basis,Be the first to find this review helpful
124,Developer support role Tier-2,,3.0,"Employee Benefits--- Free breakfast,lunch,dinner,snacks,drinks Vision,dental,gym reimbursement Good salaries. Shift allowance up to 1000 per day","Very less learning. Shift's.Managers not Good. Work pressure.If you like coding or you want to learn coding,it's not the place to show case or enhance your skill.",8 people found this review helpful
125,Lots of positives but go in with eyes open,,3.0,"Very appealing culture, good people & great products.",It's a feast or famine sales environment. A few high value transactions are hiding the reality. There are a large proportion of the Sales team unable to deliver again their target.,15 people found this review helpful
126,Account Executive,,3.0,culture amazing people salary great place to learn,"targets it is impossible to have good work/life balance overwhelming office - open desk policy is nice, but there is lack of desks",3 people found this review helpful
