,title,author_info,rating,pros,cons,helpful
0,Great place to work,"Aug 11, 2020 - Finance Manager in Gurgaon, Haryana",5.0,"Amazing work-life balance, great pay, great benefits",hardly any. You can easily work here for life,Be the first to find this review helpful
1,Worst Company to work for,"Sep 3, 2020 - Software Engineer in Hyderābād",1.0,"Good benefits like meal, cab and events","1) No transparency in performance management and probation confirmation 2) Manager behaves like fief and can do whatever he wants so you are screwed if you don't get a new manager 3) Most employees are hired from Oracle and are creating same toxic environment that exits there filled with insecurities, jealousy and mismanagement 4) HR is a handicapped mute spectator and works for the sake of keeping their jobs 5) Shifts hardship allowances were recently restructured to cut cost",2 people found this review helpful
2,The place to work for,"Jul 29, 2020 - Member Of Technical Staff in Hyderābād",5.0,Work-life balance is at the heart of Salesforce. Each employee is respected and treated well.,Nothing that I could think of.,Be the first to find this review helpful
3,I don't think I've seen any other company who cares more about it's employees than Salesforce,"Jun 30, 2020 - Business Development Associate in Singapore",5.0,-Great structure and processes -Lots of resources -High psychological safety -Great diversity -Cares about your personal development and success,-None that I know of so far,Be the first to find this review helpful
4,Amazing company!! When it is as good as it seems,"Jun 2, 2020 - Anonymous Employee in Sydney",5.0,Really invest in their graduates Senior management really is interested in your opinions as a graduate Great working life balance A socially conscious organisation,It is a large organisation so as a Graduate it can be hard navigating,Be the first to find this review helpful
5,NOT the best place to work,"Mar 9, 2020 - Enterprise Account Executive in Singapore",1.0,"Great benefits such as wellness, VTO and lotsa free food and snacks. The solution is good.","They promote equality but the reality is the environment is toxic. Filled with 'preference' and bias, if your boss like you then you can get the good set of accounts to work on, otherwise sorry you are on your own. To protect their image of best place to work, they 'create' lame reasons to make you leave on your own or terminate you, instead of being seen as firing / layoff people. Lots of politicking between management, the Ohana is a marketing gimmick, the reality is the management are mostly ex-oracle bringing along their old habits and culture and practicing them in here. Most of the great talent had left the company and the original good culture is dying. This will be the last place I recommend anyone to join.",24 people found this review helpful
6,It used to be a great company in Switzerland,"Nov 7, 2020 - Finance Manager in Lausanne",4.0,Competitive salaries and benefits Nice working culture Fair/Equality is a focus,Little growth in the finance organisation as activities being moved elsewhere to COEs Lots of politics and departments working in silos,Be the first to find this review helpful
7,6 month evaluation period in Salesforce,"Jun 29, 2020 - Strategic Account Manager in Amsterdam",5.0,"Top of industry company, best place to work for,","high expectations, monthly and quaterly driven, senior mentality,",Be the first to find this review helpful
8,Good company to work for!,"Aug 5, 2020 - Tech Recruiter in Buenos Aires",5.0,Several good perks. For long time experienced workers or new ones.,Nothing to add at the moment.,Be the first to find this review helpful
9,Great Place to work. True Story,"Jul 23, 2020 - Sales Development Representative in Dublin, Dublin",5.0,Amazing team and management. Great salary and a bunch of benefits,Still not well known in Europe compared to the US,Be the first to find this review helpful
10,Do not fall for Pro rated hikes,"Aug 19, 2020 - Member Of Technical Staff in Hyderābād",4.0,Good scope to learn new technologies and improve your personal skills,With large hierarchy structure Managers cannot support employees to their 100%,1 person found this review helpful
11,Don't be afraid to go for SDR or BDR first,"Aug 19, 2020 - Account Executive in Dublin, Dublin",4.0,Unlimited commission structure can be lucrative,Certain industries way outperform others [relevant to UK business unit],1 person found this review helpful
12,Nice workplace,"Aug 18, 2020 - Sales Associate in Duba",3.0,Good Workplace and good for new people,Bad Management could improve a little more up,2 people found this review helpful
13,"Not so ""Ohana"" after all !!!","Sep 4, 2020 - Customer Success Manager in Hyderābād",1.0,Free food( loads of it) Lots of sugar to keep you excited about your company ( at the same time they want you to be healthy) Great office ( even though the decision of if you will get a seat depends on which team you work for),"Equality (Pun intended): IN spite of one of the core values of the company being Equality, the organization is RIFE with inequality. It first starts with who gets a seat at work. A company that boasts of technology and how they help businesses, they have no idea of what their growth is or will be. The tech teams grow inorganically leaving all the other teams to cram into rooms. There is clear discrimination right from senior leadership on who gets a seat and who does not. Tech teams are treated like kings and no one ( including the CTO)has the power to change their minds. There is a very heavy tone of ""ENTITLEMENT"" when any one approaches these tech teams or in discussions with them , something the company is very proud of. Even the facility team listens to what the leaders have to say and implement them. The Internal communication board even has a forum for people to vent, that is a great place for humor, with people complaining about the flavor of yogurt served in the fridge and many more trivial things.This (in)equality is not just limited to seating options but to pay, travel benefits and how they are treated by the infamous HRBP's ( or the human resources) They too clearly are unequal to teams, paying full attention to Tech teams and quite clearly ignoring smaller teams. I have met my ESBP twice till now ( official meetings) in my entire tenure as they are too busy taking care of the bigger teams. And who is there to ask them or question them, no one!! They seem to be the busiest team in the office while none of them are visible in the office post 4PM, imagine now when it is virtual. Talk about an easy job in Salesforce. Then there is a great term that they keep using ""OHANA"" like from an episode of Black Mirror they want to make sure you get sucked in to the idea of ,while the company really does not care. BTW that means' Family"" in Hawaiian, while no one is treated like one. Just giving people a lot of cupcakes and goodies( SWAG as they call it) is only marketing their company and the employees lap it up like puppies with a new chew toy. This is what the company's idea of a family is, give them stuff that is absolutely unnecessary and make them feel like they get ""SO MUCH"". Employees need to be bribed to fill up surveys, because well they don't do anything without a ""gift"". Any one who is planning to work for this organization should be particular about their ethics policies, which is an absolute joke.I am aware of some employees who were victims of this team, they either did not get justice for their complaint or were terminated for wrong decisions. I wish I had that kind of job where I can decide peoples' fates based on whims and fancies and no one to answer to. I strongly believe they have monthly targets to get people off the rolls! I know the HR team will scramble and get this review off this platform in an instant ( BTW one of the other values of the company is transparency). India offices are filled with wrong leaders and sadly nothing from the above will change.",11 people found this review helpful
14,Great Place to Work,"Aug 6, 2020 - Senior Database Engineer in Singapore",5.0,"Salesforce is World #1 Cloud CRM. Salesforce CRM solution that brings companies and customers together. Success is built on trust. Trust starts with transparency. It's one integrated CRM platform that gives all your departments — including marketing, sales, commerce, and service — a single, shared view of every customer. Salesforce is proud to be named one of the World’s Best Workplaces by Great Place to Work for the third year in a row. Salesforce Singapore named a best workplace for the fifth year in a row. Salesforce for overall workplace culture, contributions to the community, and equality. I have been working at Salesforce full-time for less than a year. Management is good and takes care of employees very well. Very Good benefits, your values are aligned. Trust not only is important as an organization for our customers but also very trusting of their employees. Very good company culture, open to new thoughts, new way to do things.",Nothing that I can think of now. Salesforce has built a great culture which indeed helps to achieve Team and Company Goals.,Be the first to find this review helpful
15,Best big company experience - but expect big company clumsiness,"Aug 20, 2020 - Sales Manager in Sydney",4.0,"All the amenities -tools, training, operations support are all best in class as you would expect. Great leaders and managers to learn from. Great place to develop your career and learn best practices.","Out of necessity of scale and quickly assimilating acquired Companies, Salesforce applies a standardized performance measurement for it's sales teams across all lines of business. Unfortunately, this approach doesn't always accurately reflect acquired offerings success. In our case as an acquired Company, the bookings nuance negatively skewed performance reviews, merit increase, equity refresh etc. for our acquired staff post integration which reduced motivation & caused unnecessary attrition. General under investment in post sales/Customer success.",Be the first to find this review helpful
16,real good,"Aug 21, 2020 - Anonymous Employee",2.0,Best in the world and really good with employees,has bad airconditioning and hierarchy,Be the first to find this review helpful
17,Great Company but career progression impossible if you are not based in HQ or work in Sales,"Aug 19, 2020 - Anonymous Employee",2.0,It is the best company I worked for as it really lives its values. They take amazing care of their employees.,Career progression is nearly impossible if you don't work in Sales or are not based in HQ in SF. It's really sad as many non-sales colleagues would love to stay with the comoany but they dont see a future as most non sales and non technical roles are based in the HQ.,2 people found this review helpful
18,#1 Company,"Aug 6, 2020 - Senior Account Executive",5.0,Ethical and social responsibility Competence Learning every day Innovation #together,Not seeing at the moment,Be the first to find this review helpful
19,Horrible Management,"Aug 31, 2020 - Regional Vice President in Toronto, ON",1.0,Great people. Great technology and innovation.,Canadian Leadership is horrible. Pervasive culture of distrust. Toxic environment. No longer a rewarding place to work.,15 people found this review helpful
20,Gret company,"Aug 4, 2020 - Anonymous Employee in Frankfurt am Main",5.0,"Living truly their company values, flexible workplace, international teams",There is nothing I can share as a contra,Be the first to find this review helpful
21,Salary,"Aug 20, 2020 - Principal Success Specialist in Dublin, Dublin",5.0,"Salary, Benefits, Work Life Balance, Colleagues","None, Zero, nonexistent, nothing, null",Be the first to find this review helpful
22,Lol,"Dec 19, 2020 - Administrative Assistant",4.0,It’s good and well paid so yeah,It’s ite nothing really wrong lol,Be the first to find this review helpful
23,Amazing company to work for!,"Jul 27, 2020 - Account Executive",5.0,"Benefits, Giving back, Career progression, Culture, Values, People, Impact",Finding a great work/life balance can be challenging sometimes.,Be the first to find this review helpful
24,An amazing company,"Jul 28, 2020 - Senior Solution Engineer in Paris",5.0,Great products - Management - Collaboration - Ohana family,Sometimes a lot of subject to handle at the same time,Be the first to find this review helpful
25,Job Security,"Oct 12, 2020 - SMTS - Senior Member of Technical Staff in Hyderābād",3.0,Handsome perks and salary. SF gives handsome annual hikes.,Job Security is a big concern,1 person found this review helpful
26,Great company,"Dec 20, 2020 - Enterprise Account Executive in Dublin, Dublin",4.0,"Uncapped commission, WLB, good benefits, culture","high targets, smaller patches, t",Be the first to find this review helpful
27,Best company ever!,"Jul 28, 2020 - Account Executive in Montreal, QC",5.0,"Great management, people always eager to help, solidarity and big reward!",Monthly quotas can be a source of stress,Be the first to find this review helpful
28,Partnerships,"Aug 10, 2020 - Director in Bangalore",5.0,"Excellent culture, innovation, customer obsession",Personal work life balance could get messier with work load,Be the first to find this review helpful
29,Best company to work for!,"Apr 6, 2020 - Senior Analyst",5.0,1. Interesting and challenging work with great support from the larger team 2. The company is a customer-centric. 3. Fantastic work culture with an emphasis on personal mental well-being and encouraging you to make an impact in your community. 4. Good remuneration and benefits schemes 5. Very inspirational company to work for.,I do not see any cons.,1 person found this review helpful
30,ok so far,,4.0,People are nice and smart,Some tries to hand over their tasks,Be the first to find this review helpful
31,Comp,,5.0,Good to work in this brand,Unfortunatelly there is no bad thing for work as I know,Be the first to find this review helpful
32,Obsolete Management and Working Style.,,1.0,"Benefits such as wellness allowance, great office location (centre of Tokyo).","JP office is extremely domestic, and does not have the drive, momentum or speed which other international tech firms or a typical foreign sub company has as a working culture. Since the majority of the people in the back office has been working here for a very long time (which is a good thing in one way), many of them are not use to changes - rather prefer to stick to the norm. Ohana is one of the key culture (which is a great conceptually) in Salesforce. But in JP back office, this is recognized in a different/miss leading manner. More specifically, it's been recognized as ""protection"", rather than supporting and challenging each other for growth. This shows up as lack of ownership, professionalism and extremely conservative working style/attitude. If you try to challenge someone, you're taken in a different way. Since there's really no culture of challenging each other, it's taken very offensively --- that's still fine but the most shocking part is, senior management doesn't notice or understand anymore of the benefits of growth via challenges and constructive communication. This is one of the most disappointing aspects of this office where it doesn't show to the outer world --- I have seen another review saying ""a master of disguise"" and completely understand what it means. When joining, do not expect a high paced, competitive working style lead by professionals with strong ownership --- but rather expect a conservative environment, hence for those who are looking for growth via challenges, constructive communication and data driven decision makings, this may not be the best place for you. Money is good, but growth wise, not able to recommend.",5 people found this review helpful
33,Best decision I ever made,,5.0,"- Incredible team and wider Ohana - Opportunities to really make a difference in the world - Chance to become an expert in incredible, world leading products - Get to work with leading brands and be an advisor to them I work in a small team and each person made an effort to include me and make me feel welcome from day one. I've had a change in manager in the six months I've been at the company and the whole process was managed really smoothly. I have huge respect for the management and the way that the department functions with AE's and SE's. Support through COVID and having to work from home 5 weeks after starting was amazing. There was financial supporting in getting home office equipment and there were plenty of resources made available to ensure mental and physical health through lockdown. These resources are still in place now (daily wellbeing sessions, email updates and weekly leadership sessions to name but a few).",- There is never enough time in the week to learn everything and it can sometimes be overwhelming to try and get up to speed on the products (particularly when the company is buying new companies all the time and creating products for the market to deal with COVID workplace issues in addition).,1 person found this review helpful
34,Worst Company to work for,,1.0,"Good benefits like meal, cab and events","1) No transparency in performance management and probation confirmation 2) Manager behaves like fief and can do whatever he wants so you are screwed if you don't get a new manager 3) Most employees are hired from Oracle and are creating same toxic environment that exits there filled with insecurities, jealousy and mismanagement 4) HR is a handicapped mute spectator and works for the sake of keeping their jobs 5) Shifts hardship allowances were recently restructured to cut cost",2 people found this review helpful
35,SDR,,5.0,Amazing place to work - great culture,None that I can think of,Be the first to find this review helpful
36,First impressions - 6months fbk,,4.0,"Management, Employees, Organization, Processes Rigor and Customers care are among the main pillars of the SF culture I've observed so far. So exciting!",Covid spoiled my 1st months.. And yet teammates and managers are always mindful.,Be the first to find this review helpful
37,AE at Salesforce,,5.0,"Exciting products, internal collaboration, culture",There is a lot to learn in terms of product,Be the first to find this review helpful
38,Best company ever!,,5.0,"Great management, people always eager to help, solidarity and big reward!",Monthly quotas can be a source of stress,Be the first to find this review helpful
39,The place to work for,,5.0,Work-life balance is at the heart of Salesforce. Each employee is respected and treated well.,Nothing that I could think of.,Be the first to find this review helpful
40,Good place to work,"Dec 8, 2020 - Sales Development Representative (SDR) in Dublin, Dublin",4.0,"Multi-cultural, good benefits, competitive salary.","Cog in a wheel, not always 100% transparent",Be the first to find this review helpful
41,So far So Great!!,"May 31, 2020 - Member Of Technical Staff in Hyderābād",5.0,"Awesome workplace, Awesome facilities, Food is 5 Star, Barista free inside office, Game-room on each floor, Super cool management always open to new ideas and innovation, Employee's wellness is priority",No cons as of now,Be the first to find this review helpful
42,APAC Employee Program Coordinator,"Jul 19, 2020 - Associate Specialist in Hyderābād",5.0,"Best Working Environment. Everyone is quite approachable, there is a sense of family.",There are none to point,Be the first to find this review helpful
43,Great place to work,"May 29, 2020 - Core AE in Paris",5.0,"An innovative company that lives and breaths by its strong values. Staff is very well taken care of, which has been particularly well demonstrated under COVID-19. Beyond any doubt: the best place I have ever worked.","Honestly, I do not see any points.",Be the first to find this review helpful
44,Great place to work,"Jul 27, 2020 - Anonymous Employee",5.0,supportive colleague and work flexibility,none that i can think off,Be the first to find this review helpful
45,Great company. Fast growing. Lots of benefits.,"Nov 30, 2020 - Account Director in Amsterdam",4.0,Market leader. Company benefits. Career opportunities. Great customer base. Company values.,"Quarterly driven. Spreadsheet management, US marketing machine. Complex licensing model. Large.",Be the first to find this review helpful
46,Awesome Place,"Jul 21, 2020 - Account Manager in London, England",5.0,"Great culture, great people, a great place to be",Cannot think of any that would put me off.,Be the first to find this review helpful
47,Great place to grow,"Jul 24, 2020 - Senior Manager in London, England",5.0,"People, work and opportunity for growth",None that spring to mind,Be the first to find this review helpful
48,A great extension of your skills and expertise!,"Jul 27, 2020 - Proactive Monitoring Engineer in Hyderābād",5.0,"Great place to work, good career opportunities.",No cons as of now,Be the first to find this review helpful
49,It's a good company to work for.,"Aug 17, 2020 - SMTS - Senior Member of Technical Staff in Hyderābād",4.0,Work is good. Salary is satisfactory. Work-life balance is good.,"A little biased towards promotion of south folks, as many local people are there in the company.",1 person found this review helpful
50,APAC SFDC,"Jul 12, 2020 - Regional Sales Director in Singapore",5.0,"Great Culture, people and benefits",Can't keep the culture for the Hyper-Growth,Be the first to find this review helpful
51,#2 Great Place to Work in Singapore,"Dec 11, 2019 - Program Architect in Singapore",5.0,"We won the #2 slot (down from #1 the previous 4 years) Great Place to Work in Singapore - only a month ago. Fantastic management style. Very big on listening to the voice of the employees, and acting on recommendations.","Growth is enormous (because we've been very successful for many years) so the office space is quite squeezed. As with all successful corporations, meeting rooms are at a premium and difficult to get.",5 people found this review helpful
52,Average,"Dec 13, 2020 - English Teacher in Bareilly",3.0,Helpful for freshers and gradutes,Slow growth and less income,Be the first to find this review helpful
53,Forward-thinking,"Dec 8, 2020 - Sales Associate",4.0,Growth and personal investment opportunities,"Long, high energy days and nights",Be the first to find this review helpful
54,Good work life balance,"Jul 6, 2020 - Agile Coach in Hyderābād",5.0,Good benefits and work life balance,Lot of politics and women not allowed to reach leadership grade,Be the first to find this review helpful
55,Working there for last 2 years,"Nov 16, 2020 - Sales Associate in Mumbai",3.0,good for starters as you will get direct opportunities.,a lot of work pressure,1 person found this review helpful
56,The best company to work,"Jul 13, 2020 - Success Agent (Tier II) in Hyderābād",5.0,Awesome Infrastructure Amazing Team Employee centric You will have everything you need to grow,Nothing I have found till now,Be the first to find this review helpful
57,The best employer I've worked for so far,"May 19, 2020 - Success Architect",5.0,"Great leadership on all levels, transparent roadmap and awesome team spirit across different teams & regions. On top, Salesforce offers great benefits and cares a lot for its employee's wellbeing.",There's nothing I could complain about so far.,Be the first to find this review helpful
58,"Fast pace, high energy, full of resources","Jul 6, 2020 - Innovation Consulting Director in Singapore",5.0,"Easy to connect, a lot of holistic support and positive encouragement.","Fast pace, high growth. Things move quickly.",Be the first to find this review helpful
59,Review,"Dec 9, 2020 - BDE - Business Development Executive in Noida",3.0,Good incentive in the company,no cons as such. All good,Be the first to find this review helpful
60,Very goof team spirit and exciting product,,5.0,Good product Interesting Customer engagements SF support,None that I am aware of.,Be the first to find this review helpful
61,review,,5.0,management training challenging trusted innovated,none none none none none,Be the first to find this review helpful
62,Best company to work for,,5.0,Benefits Learnings Leaves Internal opportunities Platform learnings and brand name,Nothing much to talk about it,Be the first to find this review helpful
63,Wonderful Company and Great Place to Work!,,5.0,"An amazing opportunity to learn and grow both personally professionally, and forge a career","It is the right place for fast learners and people who are constantly open to change and improvement, it might not be for everybody.",Be the first to find this review helpful
64,Great place to work!,,5.0,"Great place to work, awesome culture, co workers, managers and customers",Slow promotions process in my role,Be the first to find this review helpful
65,Wonderful place to work,,5.0,"It is a culture that values speaking up and striving to do what's right for customers above anything else, which makes the work fun and rewarding.",As a large company it has a lot of processes to learn.,Be the first to find this review helpful
66,APAC SFDC,,5.0,"Great Culture, people and benefits",Can't keep the culture for the Hyper-Growth,Be the first to find this review helpful
67,Great company to work at.,,5.0,1. Great people to work with. 2. Ohana culture. 3. Challenging work.,Could not think of any.,Be the first to find this review helpful
68,The best company to work,,5.0,Awesome Infrastructure Amazing Team Employee centric You will have everything you need to grow,Nothing I have found till now,Be the first to find this review helpful
69,Good place to work,,3.0,"Salary, flexibility, culture, compensation, infrastructure","Non technical jobs, no future, can be stuck, not good for technical persons",1 person found this review helpful
