,title,author_info,rating,pros,cons,helpful
0,Best Place to Work,,5.0,Good culture Employee centric company Good perks,Less work Not much learnings currently,Be the first to find this review helpful
1,"Innovative, young fun company with great career potential.",,5.0,"Great management, with young, fun teams who work hard to get good results.",Large company so can't facilitate certain things if you need something niche to be done quickly.,Be the first to find this review helpful
2,Maybe not good for the youth,,4.0,Great workplace and teammates always helpful,Sometimes it is difficult to grow as company is having big changes. Young people is having its difficulties.,Be the first to find this review helpful
3,Great Ohana culture,,5.0,The Ohana culture is great. Team members treat each other as family members.,There are many acquisitions in recently years. The Ohana culture may not be well propagated.,Be the first to find this review helpful
4,Great place to work,,5.0,"Good benefits from company, good increment, friendly environment",Working in shifts makes it worse.,Be the first to find this review helpful
5,Best Place to work,,5.0,"Salary, Benefits, Life work balance ,Trust",none it is a great place to work,1 person found this review helpful
6,Working in Salesforce,,5.0,"Working in Salesforce is great. We are all part of the Ohana(family). Lots of self development opportunities, good salary and great teamwork",As every big company there are times that you can feel the stress,1 person found this review helpful
7,Wonderful Company to Work In,,5.0,Feeling of Ohana (family) propagated right from the top Colleagues help each other,"Very fast paced organisation, we need to find our own rhythm to survive.",Be the first to find this review helpful
8,Great Company,,5.0,Good working environment High income and good benefits. The company cares about its employees. They value their employees ・They value social contribution as a company,High growth rate is always required.,Be the first to find this review helpful
9,Awesome place,,5.0,Culture innovation team growth opportunities,Getting bigger so maintaining entrepreneurial feel,Be the first to find this review helpful
10,Ju,,4.0,"Innovation, focus on customiser successivement, benefits, DNA,","Workload, life balance, pressure, internal work, bureaucratie",Be the first to find this review helpful
11,No longer employed,,3.0,They paid well for our Area,They seem to be Moving jobs offshore,Be the first to find this review helpful
12,Great Place to Work,,5.0,"Benefits, culture, office locations, best in class solution, autonomy and trust from management","Complex systems to learn, competitive market selling premium product",Be the first to find this review helpful
13,BDR,,4.0,"Sales methods, Life Balance; Good people","targets; values, ethics; this is a Big company",Be the first to find this review helpful
14,good WLB,,4.0,"tech stack is old, wlb is excellent","old stack, core is boring",Be the first to find this review helpful
15,Working at Salesforce,,4.0,"Good environment to work, good benefits",Need to have more presales support,Be the first to find this review helpful
16,Software Engineer Intern experience,,5.0,Team was always willing to help and making me confortable. Is a big company and has lots of experienced professionals. Salary is good and also gives you a lot of benefits.,At first it was overwhelming.,Be the first to find this review helpful
17,Top,,5.0,Positive minds are everywhere in that company,Notthing to declare in this point,Be the first to find this review helpful
18,Great place to work!,,4.0,"Amazing benefits, good training, colleagues are great!",Culture + Values clash and are not aligned.,Be the first to find this review helpful
19,What to expect,,3.0,Possibility to learn if you don't mind tirelessly looking for resources by yourself and using your personal time,"The so acclaimed company culture does not extend to Technical teams, it appears to be great for sales teams, but all other employees I've spoken to in my segment are unanimous on this perception",4 people found this review helpful
20,Amazing place to work,,5.0,SF has great people and culture,In danger of losing it's culture,Be the first to find this review helpful
21,Overall positive,,5.0,- Great place to improve outside of just your job,- A lot of process and admin work - Not quick to move into new sectors,Be the first to find this review helpful
22,Good,,5.0,Very good culture slurs in the company,Support has lots of pressure,Be the first to find this review helpful
23,Extraordinary,,5.0,All are good to work on this company,No cons at the moment,Be the first to find this review helpful
24,Developer Success Engineer,,5.0,Good work environment. There are many employee benefits,The work in support is not meant for everyone.,Be the first to find this review helpful
25,"Great Company - Great pay, smart people, great opportunities",,4.0,"pay, benefits, innovative, training, leadership","process, quota, territory, vision, pressure",Be the first to find this review helpful
26,Good company,,4.0,"Great benefits, good colleagues and rewards",Pressure sales environment like all big tech,Be the first to find this review helpful
27,Salesforce,,4.0,great company to work for,some processes are too laborious,Be the first to find this review helpful
28,"Great place for growth, could have a more flexible WFH policy",,5.0,"Good teamspirit, enourmous focus on personal growth and promotion opportunities","WFH policy is very non-flexible, despite the ""work from anywhere"" messaging from HQ. All Dublin employees were required to fly back and work from home in Dublin in the middle of the pandemic, despite the fact that most of us are from continental Europe and do not have any family and friends here.",1 person found this review helpful
29,Great culture moving to working from anywhere,,5.0,Listens to employees and empathetic,None at this moment now,Be the first to find this review helpful
30,Best company in the world,,5.0,awesome culture throughout entire org,nothing to report on at this stage,Be the first to find this review helpful
31,Amazing!!,,5.0,Excellent Work Place 10/10 Great Atmosphere to work in Good Pay,"Its been an year for me, I Cannot find any cons so far",Be the first to find this review helpful
32,The best graduate program you can find in Sales,,4.0,"Nice work environment, very interesting, learn a lot, a lot of stakeholders, visibility on promotion, amazing products","Sometimes redudant when you are an SDR, but very interesting",Be the first to find this review helpful
33,Feel like a brick in the wall,,3.0,Great culture and benefits. Company has been growing forever.,"Between my offer and day of joining I get a call saying things have changed and hence my role and my manager will change. I still went ahead and joined. In last 3 years I saw my role getting marginalized and eventually killed. And the way this was handled or rather not handled, was disappointing - no communication from HR or my manager till 3 weeks before the role was going to be eliminated. In general while the company is growing, it doesn't necessarily mean that you will grow. The company puts more incentives on the ""Core"" or Prime sales and not so much on ""Cloud"" or co-prime sales. Co prime sales are clearly 2nd rate citizens.",Be the first to find this review helpful
34,This is fine,,3.0,Have a good experince in this technology,having knowledge of salesforce adminstration and analytics,Be the first to find this review helpful
35,Great place to work with exceptional benefits,,5.0,Truly a great place to work with some of the most passionate and knowledgeable people in the industry.,Sometimes we let the reports and KPIs get in the way,Be the first to find this review helpful
36,Revealing the reasons why I stay with this company for 10 years!,,5.0,"- Excellent healthcare and wellness benefits - Executives level tirelessly running week after week All-hand call with all employees keeping us stay strong during covid despite of their extremely busy schedules. - Their sharing during the calls are open, transparent with focus on equality, fairness - Strong sense of Ohana (family) within Singapore Finance, people are kind and genuine care to help out each other.","- Pace is fast - constant catching up the changes, I guess this happen very frequent in Tech companies.",1 person found this review helpful
37,"Fast paced, authentic, innovative",,5.0,"Culture, employee support, pace of change, autonomy, innovation",Don’t sign up if you need dependable practises- change is the only constant here which is a gift and a curse,1 person found this review helpful
38,Good Culture！！,,3.0,Good culture Everyone is willing to help,busy at work Many internal meetings,1 person found this review helpful
39,Salesforce review,,5.0,"Great values and culture, really care and listen to the employees, willing to change and adapt.",Becasue it is very large company inter teams dependency can be hard and reduce agility.,Be the first to find this review helpful
40,good,"Jul 1, 2021 - Sales Associate in Indore",4.0,nice good environment cooperativegood staff helarhy,bad time issue and working problems,Be the first to find this review helpful
41,Good Company for Experienced,"Jun 18, 2021 - Software Engineer in Hyderābād",4.0,good perks and brand value,work life balance is not good,1 person found this review helpful
42,Good,"Mar 17, 2021 - Senior DevOps Engineer in Hyderābād",3.0,All good. Work life balance . Free Food.,"I don't feel anything in my experience, except there is a monthly targets for the projects based on the Managers... And more over there are having too many unwanted meetings..",1 person found this review helpful
43,Awesome!,"Mar 17, 2021 - Anonymous Employee",5.0,"culture, benefits, career growth, leadership",HQ centric hiring focus on SF,Be the first to find this review helpful
44,Great Values,"Jun 13, 2021 - Area Vice President of Sales in Oslo",4.0,"Great, sustainable values, excellent customer focus, innovative and strong, positive growth culture",Too much of a start-up in some areas.,Be the first to find this review helpful
45,Literally your Extended Family,"Aug 21, 2020 - Busineess Development in Singapore",5.0,"- Transparant - Positive work culture - Close knit team - Leadership team who care for input and take feedbacks seriously - Effort and Reward - Highly Value and encourage even reward employees' contribution to community - Ecosystem,resource and expert offers absorbed by company for your personal development (frequently invites and arranges global speaker to conduct trainings) - Personal (and family) wellfare and benefit -Manager willnserious discuss,advise and assist you towards your personal development and career developmwnt plan -Inclusive and Respect","- fast,changing, challenging (positive competition) - endless meetings and call ( management resort to send official email refrain conducting business related meeting on Friday.Digital detox)",3 people found this review helpful
46,Great company - careful about becoming too political,"Jan 14, 2021 - Customer Success Manager in Dublin, Dublin",5.0,"Great culture, great values, great people.","the company has had a staggering growth and acquired a lot of companies. It's diluting the initial culture of salesforce (people do not know each other anymore, and COVID didn't help).",Be the first to find this review helpful
47,Great company with significant upside potential,"Jan 29, 2021 - Director in London, England",5.0,"Visionary leadership, Talented colleagues, Career Growth","Constant change, Turf Wars, Role Duplication",1 person found this review helpful
48,Great culture moving to working from anywhere,"Mar 7, 2021 - Account Executive",5.0,Listens to employees and empathetic,None at this moment now,Be the first to find this review helpful
49,Best company in the world,"Mar 7, 2021 - Account Development Representative",5.0,awesome culture throughout entire org,nothing to report on at this stage,Be the first to find this review helpful
50,Great company,"Mar 16, 2021 - Talent Manager in Buenos Aires",5.0,Great salary and promotion opportunities,fast paced and overwellming sometimes,Be the first to find this review helpful
51,Fantastic company to work for,"Jan 23, 2021 - Lead Solution Engineer in London, England",5.0,"Growth mindset, work a lot and have fun, values","slow career progression, promotions not decided in a fair and transparent way",1 person found this review helpful
52,Great company,"Jun 23, 2021 - Executive Assistant",4.0,The people are very friendly.,Too many acronyms used hard to keep up,Be the first to find this review helpful
53,Wonderful company and best place to start your career in sales,"Oct 13, 2020 - Sales Development Representative (SDR) in Dublin, Dublin",5.0,"Every single detail is looked after in order to make you happy and comfortable in order to perform your best and learn every day. You feel part of the ""Ohana"" since day 1, it's incredible how many tools they provide you with to ensure that you develop your full potential in all ways, and that every single individual feels cared and valued all the time. Compensation is really good.","Can't find one, perfect place, great people and wonderful environment and treatment.",Be the first to find this review helpful
54,Great place to work and Career prospects,"Feb 5, 2021 - Technical Training Manager in Bangalore",5.0,Young and vibrant lot of scope for growth working on the latest technology,Need to adopt more professional practices in lot of areas like a large enterprise organization,Be the first to find this review helpful
55,Couldn't be more happier to be here.,"Jan 14, 2021 - Account Executive in Sydney",5.0,"- Depth of knowledge and tools to help you become a better professional at your job. - Collaborative, Competitive, and Autonomous environment. - Literally cares about the employees and their well-being.","Honestly, it's hard to find a true ""Con""",Be the first to find this review helpful
56,Great company to work for,"May 20, 2021 - Account Executive in Dublin, Dublin",4.0,Great team Great benefits Great office when in it,"Working harder from at home no time for breaks Lunch and learns when working from home, should not be asked",1 person found this review helpful
57,1st Year as a Salesforce AE,"Feb 11, 2021 - Account Executive",5.0,"Great Company, they really invest in thier people",It's a gruelling onboarding! But worth it.,Be the first to find this review helpful
58,Amazing,"Mar 17, 2021 - Marketing Apprentice in London, England",5.0,Productive and team like environment,Can't think of any cons,Be the first to find this review helpful
59,Great play for growth,"Jun 7, 2021 - Sales Associate in Toronto, ON",4.0,- Flexible hours - Great Management -Organized work place,Poor pay Not enough time off long hours,Be the first to find this review helpful
60,Review,,4.0,Good Culture. Good Pay. TMP org is full with smart people and exciting work.,"1. BT org is not good to work for smart people 2. Management is not good here, promotions not fair.",Be the first to find this review helpful
61,Pre sales role cooperating with many account executives to develop and deliver a business case and a demo,,2.0,"Lots of exposure to different business models, industries and possibility to learn. You get to talk with C level and you became a role that is in touch with many different stakeholders from the customer side, the implementor side and the internal vendor side. You have the chance to further develop soft skills such as presentation and prioritization.","This job position is at high risk of burn out, because there is a fast sales cycle, a lot of passages to do, and too many Account Executive per solution engineer to support. The result is an overwhelming demand, not covered by the supply of SEs which are not increased as consistently as the Account Executive while the effort demand is always the same if not increasing. The promotion steps are not clear and not transparent, even when brought in front of data. The role seems to be undervalued by the company in general and taken into account only as a mere factor of higher conversion that needs to be applied wherever possible no matter the stretch of the individual.",5 people found this review helpful
62,The best company to work.,,5.0,Trust is the foundation. Either that is with external customer or inter employees,"No cons, this is the best company to work.",Be the first to find this review helpful
63,Good place,,4.0,"Good work / life balance, great benefits, fun team","Gets boring quite quickly, little flexibility in vCard er Progression outside of sales org",Be the first to find this review helpful
64,Hypocritical company and culture,,1.0,"The pay is good Scholarship, Health and benefits monthly allowance Good on your CV You can proceed to show off to your friends to show how high your moral standards are.","No support from HR, managers etc they ask you for feedback that they know you can’t be 100% honest about and then blame you for not telling them once you burn out They don’t listen to the surveys we take about our managers or the company Employees are just numbers and ACV. “You are here to learn” fail once and see what happens Hypocritical behavior from people who wish to empower you, in the end they only talk the talk. Fake political positions, the CEO earns 20m a year, if he was concerned about the earth, poverty etc he would spare some for others. (Many other examples) Women are always preferred to management director positions solely because they are women and not based on their competences Team spirit is inexistant, people won’t hesitate to shame you to their manager and steal deals off you. Toxic environment",18 people found this review helpful
65,Great company,,4.0,Good commission if you make target,Too many layers of management,1 person found this review helpful
66,Good culture,,5.0,"Culture, team, and overall company benefits",low entry salary/grade vs the same role in the US and no clear career path,Be the first to find this review helpful
67,Salesforce review,,5.0,Excellent work culture Extensive benefits Pro equality across the board Challenging and rewarding product line,Can be very long work hours but that is self driven as company promotes work life balance.,Be the first to find this review helpful
68,Great support and culture,,5.0,More freedom to explore different parts of technologies,"Since it is a pretty new team, may need some more coding standard",Be the first to find this review helpful
69,Entry first line management,,3.0,Lots of internal promotions available at this level,Lots of politics and favoritism in play to get promoted. Managers tend to favor and promote people they have personally hired and managed before.,2 people found this review helpful
70,Salesforce AE,"Feb 22, 2021 - Account Executive in Toronto, ON",5.0,"Good earning potential, support and resources to sell",Difficulty climbing the ladder with so many matrixed layers etc.,Be the first to find this review helpful
71,Good company to work for,"Jan 21, 2021 - Senior Business Development Representative in Dublin, Dublin",5.0,"The internal process, the family feeling, the growth, the career development path","There are so many people and products, and the requirements are so high that it is easy to feel stressed",Be the first to find this review helpful
72,Great company to work,"Mar 3, 2021 - Technical Support Engineer in Toronto, ON",5.0,Good benefits/ Convenient office location,I didn't have any serious complains,Be the first to find this review helpful
73,good,"Jun 20, 2021 - Sales Associate in Bangalore",4.0,good place to work during pandemic,all good. no worries for me,Be the first to find this review helpful
74,Best in class company values,"Mar 2, 2021 - Strategy Senior Manager in Madrid",5.0,"Employee care, work life balance",Complex global org to deal with,Be the first to find this review helpful
75,Best company to work for,"Dec 14, 2020 - Business Development Representative in Frankfurt am Main",5.0,- amazing and agile management - fantastic team - transparent career development - time of for volunteering 7 days - education budget 5000 € per year - home-office budget 500€ once - wellness budget 300€ per quarter,- working from home all the time can be challenging and can lead to a blend between leisure and work,Be the first to find this review helpful
76,Workplace,"May 29, 2021 - Senior Manager",4.0,Fast growing company with great potential,"Fast-paced and although there are many support programs, one needs to learn to filter with the overloading of information",Be the first to find this review helpful
77,Great place to work,"Mar 4, 2021 - Anonymous Employee",5.0,Work life balance is good,Nothing is wrong as such,Be the first to find this review helpful
78,Great Company,"Jan 14, 2021 - Manager, Technical Support in Dublin, Dublin",5.0,Really look after employee wellbeing Comms from execs are quite consistent A-ma-zing benefits Great culture,I can't really think of any. As with most giant corporations there isnt a whole lot of wiggle room around HR Process but it's completely understandable,Be the first to find this review helpful
79,"Too big, low learning","Mar 11, 2021 - LMTS, Software Engineering",3.0,"Super secure, best package, it’s the golden handcuff","Slow, bureaucratic, silos, no innovation except when acquiring. Brain wash with Ohana culture. If you are gonna work with Core, move away... it takes 3 hours to compile with a 64gb ram machine. Leadership is a game role and not a behaviour, an action",3 people found this review helpful
80,General review,"Mar 8, 2021 - SDR",4.0,Great benefits and compensation alongside other internal perks,Sometimes your best interest isn't others best interest and you're caught in the middle,Be the first to find this review helpful
81,"Started out great, but company trying to grow to fast","Mar 8, 2021 - Senior Account Executive",4.0,"Put customer first, great values and ability to be authentic self","To many sales people, not enough growth accounts to match targets",Be the first to find this review helpful
82,Professional Services,"Mar 9, 2021 - Anonymous Employee",4.0,"Innovation, Equality, Team Spirit, Interesting Clients",Promotions not decided in a fair way,Be the first to find this review helpful
83,"Great Company, Poor Sales Culture","Mar 6, 2021 - Account Executive in Toronto, ON",3.0,Great company with good benefits and pay,"Sales Culture is 20th century. Monthly pressure to put up a number and the company preaches customer success but push comes to shove its all about revenue. Everything is about internal brand, yet the internal hiring process is completely in the favour of mgmt.",1 person found this review helpful
84,not applicable,"Feb 21, 2021 - Anonymous Employee",5.0,not applicable not applicable not applicable,no downsides at working for this employer,Be the first to find this review helpful
85,"Love it, best career move","Feb 21, 2021 - Solutions Engineer in Sydney",5.0,"Fantastic enablement on product, culture and personal development/soft skills. Very supportive environment. Exciting products. Lovely to work with lots of very smart people","Not really a con, but it is a very fast paced, demanding environment - good to understand this and make sure it suits you before joining",Be the first to find this review helpful
86,good,"Mar 7, 2021 - Manager in Leeds, England",4.0,great to be working here,no cons about the business,Be the first to find this review helpful
87,BDR,"Feb 20, 2021 - Business Development Representative in Toronto, ON",5.0,Fantastic job. Couldn’t have asked for a better job,No cons. Salesforce is a great company,Be the first to find this review helpful
88,Great place!,"Feb 20, 2021 - Partner Account Administrator",5.0,Good benefits and people. Large emphasis on growth as a person.,None I can think of.,Be the first to find this review helpful
89,Nice invention,"Feb 21, 2021 - Sales Executive in Vellore",5.0,Easy to use this application and reminding at correct time,Knowledgeable to collect details about customers,Be the first to find this review helpful
90,"Great for sales development, can depend on luck, focused on metrics.",,4.0,"- Amazing people, Sales Dev can really band together to help lift each other up. - Good compensation - Great benefits, healthcare, wellbeing expenses - Opportunity to speak to and take part in different Salesforce community groups - Volunteer days to give back to community - Walking into the office can definitely make you feel quite spoiled (access to coffee, tea, cold drinks, snacks, occasional breakfasts & lunches) - Access to top sales training with key thought leaders across the globe - BDR work group atmosphere is fun, energetic, supportive - My direct manager is awesome.","- Promotion wise, being in Sales Development means having to get to 100% on a metrics (numerical) based magic quadrant to be eligible for promotion (or lateral hire). Unfortunately for some individuals, this means their time in Sales Development is extremely extended due to external factors such industry pressures, geography and AE/BDR alignment. A little more focus on a combination of the two and finding the right balance between numerical metrics and knowledgable skills & know-how needs to be recognised/implemented. - Exposure really only to sales vs. other business units. It can feel like BDRs are being put into one bucket (sales making machines) vs. ""you can take your career anywhere"" promised in interviews. Appreciate that most are joining to be a part of our amazing sales team, but it would still be nice to see more of that cross-functional organisation and learn more of other business units who are likely using very transferable skills.",1 person found this review helpful
