,reviewer_info,title,rating,review,year,review_translated,reviwe_translated_original
11,男性/ Solution Engineer/ 現職（回答時）/ 新卒入社/ 在籍3年未満/ 正社員,Benefits/office environment,4.9,福利厚生:住宅補助はないが、給料はそれなりに高いと感じる。多くの社員は自社株を購入する制度を一つの投資手段として利用している。福利厚生に関しては、健康維持に使用する費用を月一定程度補助するという制度があり、みんな愛用している。オフィス環境:非常にきれい。空いている席ならどこでも自由に利用できる。マインドフルネスの部屋があり、疲れたらそこで瞑想したりなどして休息を取ることができる。,2022年時点の情報,"[ ' Welfare ' , ' ' , ' ' , ' ' , ' housing ' , ' subsidy ' , ' ' , ' ' , ' feel ' , ' ' , ' ' , ' salary ' , ' ' , ' reasonably ' , ' high ' , ' Many ' , ' employee ' , ' use ' , ' ' , ' system ' , ' ' , ' purchasing ' , ' company ' , ' stock ' , ' ' , ' ' , ' investment ' , ' tool ' , ' ' , ' ' , ' ' , ' welfare ' , ' program ' , ' ' , ' ' , ' ' , ' system ' , ' ' , ' subsidizes ' , ' ' , ' expense ' , ' used ' , ' ' , ' maintaining ' , ' health ' , ' ' , ' ' , ' certain ' , ' amount ' , ' every ' , ' month ' , ' ' , ' everyone ' , ' us ' , ' ' , ' habitually ' , ' Office ' , ' environment ' , ' ' , ' clean ' , ' ' , ' ' , ' free ' , ' ' , ' use ' , ' ' , ' seat ' , ' ' , ' ' , ' vacant ' , ' ' , ' ' , ' ' , ' mindfulness ' , ' room ' , ' ' , ' ' , ' ' , ' meditate ' , ' ' , ' take ' , ' ' , ' rest ' , ' ' , ' ' , ' ' , ' tired ' ]","Welfare: There is no housing subsidy, but I feel that the salary is reasonably high. Many employees use the system of purchasing company stock as an investment tool. As for the welfare program, there is a system that subsidizes the expenses used for maintaining health by a certain amount every month, and everyone uses it habitually. Office environment: very clean. You are free to use any seat that is vacant. There is a mindfulness room where you can meditate and take a rest if you are tired."
12,男性/ アカウントエグゼクティブ/ 現職（回答時）/ 中途入社/ 在籍6～10年/ 正社員/ 営業本部/ 無し,Benefits/office environment,4.9,福利厚生:昔ながらの日本の大企業と比べると、特徴的な福利厚生はない。社員持株会については、会社の株価が右肩あがりの状況につき、利益を得やすい。オフィス環境:現在はリモートワーク中心。オフィスへの出社は人数制限が設けられており、事前申請の上、制限人数内であれば自由に出社は可能。立地は東京駅直結のビルにあり、アクセスは最高。社内のファシリティについてはトップクラスの設備。,2021年時点の情報,"[ ' Benefits ' , ' Compared ' , ' ' , ' traditional ' , ' Japanese ' , ' big ' , ' company ' , ' ' , ' ' , ' ' , ' distinctive ' , ' benefit ' , ' ' , ' ' , ' ' , ' employee ' , ' shareholding ' , ' association ' , ' ' , ' ' , ' easy ' , ' ' , ' make ' , ' ' , ' profit ' , ' ' , ' ' , ' stock ' , ' price ' , ' ' , ' ' , ' company ' , ' continues ' , ' ' , ' rise ' , ' Office ' , ' environment ' , ' Currently ' , ' mainly ' , ' remote ' , ' work ' , ' ' , ' ' , ' ' , ' limit ' , ' ' , ' ' , ' number ' , ' ' , ' people ' , ' ' , ' ' , ' come ' , ' ' , ' ' , ' office ' , ' ' , ' location ' , ' ' , ' ' , ' ' , ' building ' , ' directly ' , ' connected ' , ' ' , ' Tokyo ' , ' Station ' , ' ' , ' access ' , ' ' , ' ' , ' best ' , ' Inhouse ' , ' facility ' , ' ' , ' top ' , ' class ' ]","Benefits: Compared to traditional Japanese big companies, there are no distinctive benefits. As for the employee shareholding association, it is easy to make a profit as the stock price of the company continues to rise. Office environment: Currently mainly remote work. There is a limit on the number of people who can come to the office. The location is in a building directly connected to Tokyo Station, so access is the best. In-house facilities are top class."
13,男性/ 営業/ 現職（回答時）/ 中途入社/ 在籍3～5年/ 正社員,Work style (working hours/holidays/systems),5.0,勤務時間・休日休暇:成果に基づいて賞与が決まるため、成果を求めないのであれば残業を求められるわけではないただ、成果を上げるために自主的に勤務時間外に働くことが普通になっている気がする多様な働き方支援:リモートワークは基本休暇などは自由、取得しやすい、働くことに自主性が求められるので働き方は自己責任、上司がどうこう指示することはない副業などは問題ないのでは,2022年時点の情報,"[ ' Working ' , ' hoursholidays ' , ' ' , ' holiday ' , ' Since ' , ' bonus ' , ' ' , ' determined ' , ' based ' , ' ' , ' performance ' , ' overtime ' , ' work ' , ' ' , ' ' , ' required ' , ' unless ' , ' performance ' , ' ' , ' desired ' , ' Diverse ' , ' work ' , ' style ' , ' support ' , ' remote ' , ' work ' , ' ' , ' basically ' , ' free ' , ' easy ' , ' ' , ' take ' , ' work ' , ' requires ' , ' autonomy ' , ' ' , ' work ' , ' style ' , ' ' , ' selfresponsibility ' , ' bos ' , ' doe ' , ' ' , ' instruct ' , ' ' , ' ' , ' ' , ' side ' , ' job ' , ' etc ' , ' ' , ' ' , ' problem ' , ' maybe ' , ' ' ]","Working hours/holidays and holidays: Since bonuses are determined based on performance, overtime work is not required unless performance is desired. Diverse work style support: remote work is basically free, easy to take, work requires autonomy, so work style is self-responsibility, boss does not instruct how to do side jobs, etc. are a problem maybe not"
14,男性/ AE/ 現職（回答時）/ 中途入社/ 在籍3年未満/ 正社員,Benefits/office environment,5.0,福利厚生:退職金はないですが、それを補ってあまりあるインセンティブの制度があります。日系企業で30年以上勤めてやっともらえる退職金が極端な話1年、半月でもらえるチャンスがあります。結局結果次第ですが、自らの営業力次第ではどこまでも自身の給与を伸ばすことが出来ます。あとは、社員株等もあります。オフィス環境:東京駅から直結しているOfficeなので都会の雰囲気を思う存分味わえます。,2021年時点の情報,"[ ' Benefits ' , ' ' , ' ' , ' ' , ' retirement ' , ' allowance ' , ' ' , ' ' , ' ' , ' ' , ' system ' , ' ' , ' incentive ' , ' ' , ' make ' , ' ' , ' ' , ' ' , ' ' , ' ' , ' ' , ' chance ' , ' ' , ' ' , ' ' , ' receive ' , ' ' , ' retirement ' , ' allowance ' , ' ' , ' working ' , ' ' , ' ' , ' Japanese ' , ' company ' , ' ' , ' ' , ' ' , ' 30 ' , ' year ' , ' ' , ' ' , ' ' , ' receive ' , ' ' , ' ' , ' ' , ' year ' , ' ' , ' half ' , ' ' , ' month ' , ' ' , ' ' , ' ' , ' depends ' , ' ' , ' ' , ' result ' , ' ' , ' depending ' , ' ' , ' ' , ' ' , ' sale ' , ' ability ' , ' ' , ' ' , ' increase ' , ' ' , ' salary ' , ' ' , ' much ' , ' ' , ' ' , ' want ' , ' ' , ' ' , ' also ' , ' employee ' , ' stock ' , ' Office ' , ' environment ' , ' ' , ' office ' , ' ' , ' directly ' , ' connected ' , ' ' , ' Tokyo ' , ' Station ' , ' ' , ' ' , ' ' , ' fully ' , ' enjoy ' , ' ' , ' atmosphere ' , ' ' , ' ' , ' city ' ]","Benefits: There is no retirement allowance, but there is a system of incentives that makes up for it. There is a chance that you can receive a retirement allowance after working for a Japanese company for more than 30 years, but you can receive it in a year or half a month. After all, it depends on the results, but depending on your own sales ability, you can increase your salary as much as you want. There are also employee stocks. Office environment: The office is directly connected to Tokyo Station, so you can fully enjoy the atmosphere of the city."
15,男性/ 広告宣伝/ 退職済み（2019年）/ 中途入社/ 在籍6～10年/ 正社員,Business prospects/strengths/weaknesses,4.3,事業の強み:SFA、つまりB2B企業の営業支援から始まった会社であるため、その領域が変わらず強い。事業の弱み:買収を進めているSFA以外の領域では強みを発揮しづらい状況になってきている印象。分析系事業、eコマース系事業、マーケティング系事業など、B2C領域で強みを発揮することが、B2B領域が強いが故に難しい状況となってしまっている。専門的スキル獲得への資源配分が難しいと観察,2019年時点の情報,"[ ' Business ' , ' strength ' , ' ' , ' ' , ' company ' , ' ' , ' started ' , ' ' , ' SFA ' , ' ' , ' ' , ' sale ' , ' support ' , ' ' , ' B2B ' , ' company ' , ' ' , ' area ' , ' remains ' , ' strong ' , ' Weaknesses ' , ' ' , ' business ' , ' ' , ' ' , ' ' , ' impression ' , ' ' , ' ' , ' ' , ' becoming ' , ' difficult ' , ' ' , ' demonstrate ' , ' strength ' , ' ' , ' area ' , ' ' , ' ' , ' SFA ' , ' ' , ' acquisition ' , ' ' , ' underway ' , ' ' , ' ' , ' difficult ' , ' ' , ' demonstrate ' , ' strength ' , ' ' , ' ' , ' B2C ' , ' area ' , ' ' , ' ' , ' analysis ' , ' ecommerce ' , ' ' , ' marketing ' , ' ' , ' ' , ' B2B ' , ' area ' , ' ' , ' strong ' , ' Observed ' , ' difficulty ' , ' ' , ' allocating ' , ' resource ' , ' ' , ' acquire ' , ' specialized ' , ' skill ' ]","Business strengths: As a company that started with SFA, that is, sales support for B2B companies, this area remains strong. Weaknesses in business: I have the impression that it is becoming difficult to demonstrate strengths in areas other than SFA, where acquisitions are underway. It is difficult to demonstrate strengths in the B2C area, such as analysis, e-commerce, and marketing, because the B2B area is strong. Observed difficulty in allocating resources to acquire specialized skills"
16,女性/ Enablement & Competitive Specialist/ 現職（回答時）/ 新卒入社/ 在籍3年未満/ 正社員/ Sales Enablement & Academy/ Senior Productivity Coordinator,Annual salary/salary,4.8,給与制度:インセンティブの割合が大きいため、新卒と中途、営業か否かで大きな差が生まれるが、ベース給でもプロモーションすれば平均よりは高い印象。予算が潤沢なのでWell-Being手当や在宅補助といった手当も多い。評価制度:日系企業ほど年功序列の風潮はない。評価は明確かつ多方面・大人数の関係者からされるため基本的に不満を抱くような評価を受け取ることはない。,2022年時点の情報,"[ ' Salary ' , ' system ' , ' Since ' , ' ' , ' percentage ' , ' ' , ' incentive ' , ' ' , ' large ' , ' ' , ' ' , ' ' , ' big ' , ' difference ' , ' ' , ' new ' , ' graduate ' , ' midcareer ' , ' employee ' , ' ' , ' whether ' , ' ' , ' ' , ' ' , ' sale ' , ' ' , ' ' , ' Since ' , ' ' , ' budget ' , ' ' , ' abundant ' , ' ' , ' ' , ' many ' , ' allowance ' , ' ' , ' ' , ' wellbeing ' , ' allowance ' , ' ' , ' home ' , ' assistance ' , ' Evaluation ' , ' system ' , ' ' , ' ' , ' ' , ' trend ' , ' ' , ' seniority ' , ' system ' , ' like ' , ' Japanese ' , ' company ' , ' Since ' , ' ' , ' evaluation ' , ' ' , ' clear ' , ' ' , ' made ' , ' ' , ' ' , ' large ' , ' number ' , ' ' , ' people ' , ' involved ' , ' ' , ' various ' , ' field ' , ' basically ' , ' ' , ' ' , ' ' , ' receive ' , ' evaluation ' , ' ' , ' cause ' , ' dissatisfaction ' ]","Salary system: Since the percentage of incentives is large, there is a big difference between new graduates, mid-career employees, and whether they are in sales or not. Since the budget is abundant, there are many allowances such as well-being allowance and home assistance. Evaluation system: There is no trend of seniority system like Japanese companies. Since the evaluation is clear and made by a large number of people involved in various fields, basically we do not receive evaluations that cause dissatisfaction."
17,女性/ インサイドセールス/ 現職（回答時）/ 中途入社/ 在籍3年未満/ 正社員,Benefits/office environment,3.8,福利厚生:企業型確定拠出年金は会社も半分負担してくれる。持株はかなりいい条件で購入できる。日系のように住宅補助や書籍代購入費用負担などはないが、ビジネススクールや外部講座などの費用を年間60万円ほどまで負担してもらえる。また、家族含め病気など何かあった時のケアはかなりある印象。オフィス環境:新しいオフィスに移転が始まっているので現時点では不明,2021年時点の情報,"[ ' Welfare ' , ' ' , ' company ' , ' also ' , ' pay ' , ' half ' , ' ' , ' ' , ' corporatetype ' , ' defined ' , ' contribution ' , ' pension ' , ' ' , ' ' , ' buy ' , ' ' , ' share ' , ' ' , ' pretty ' , ' good ' , ' term ' , ' Unlike ' , ' Japanese ' , ' company ' , ' ' , ' ' , ' ' , ' housing ' , ' subsidy ' , ' ' , ' book ' , ' purchase ' , ' cost ' , ' ' , ' business ' , ' school ' , ' ' , ' outside ' , ' course ' , ' ' , ' ' , ' covered ' , ' ' , ' ' , ' ' , ' 600000 ' , ' yen ' , ' ' , ' year ' , ' Also ' , ' ' , ' ' , ' ' , ' impression ' , ' ' , ' ' , ' ' , ' quite ' , ' ' , ' bit ' , ' ' , ' care ' , ' ' , ' something ' , ' happens ' , ' ' , ' ' , ' illness ' , ' including ' , ' family ' , ' member ' , ' Office ' , ' environment ' , ' Unknown ' , ' ' , ' ' , ' time ' , ' ' , ' ' , ' ' , ' moving ' , ' ' , ' ' , ' new ' , ' office ' ]","Welfare: The company also pays half of the corporate-type defined contribution pension. You can buy your shares on pretty good terms. Unlike Japanese companies, there are no housing subsidies or book purchase costs, but business school and outside courses can be covered up to about 600,000 yen a year. Also, I have the impression that there is quite a bit of care when something happens, such as illness, including family members. Office environment: Unknown at this time as we are moving to a new office"
18,男性/ 営業/ 現職（回答時）/ 中途入社/ 在籍3年未満/ 正社員,Business prospects/strengths/weaknesses,3.8,事業の強み:顧客管理システム（CRM）としてマーケットリーダーのポジションにいるため、実績と信頼をもとにクライアントワークを実施可能。また、分析やマーケティング、APIマネジメントなど周辺のソリューションを買収してポートフォーリオを拡大しているため、幅広いケイパビリティでお客様にクラウドサービスを提案できるインパクトの大きさは魅力的です。またそれらを準備するために各種専門家とコラボレーションを実施していきます。,2022年時点の情報,"[ ' Business ' , ' strengthsBecause ' , ' ' , ' ' , ' ' , ' ' , ' market ' , ' leader ' , ' position ' , ' ' , ' ' , ' customer ' , ' relationship ' , ' management ' , ' system ' , ' CRM ' , ' ' , ' ' , ' carry ' , ' ' , ' client ' , ' work ' , ' based ' , ' ' , ' ' , ' track ' , ' record ' , ' ' , ' trust ' , ' ' , ' addition ' , ' ' , ' ' , ' expanding ' , ' ' , ' portfolio ' , ' ' , ' acquiring ' , ' peripheral ' , ' solution ' , ' ' , ' ' , ' analytics ' , ' marketing ' , ' ' , ' API ' , ' management ' , ' ' , ' ' , ' also ' , ' collaborate ' , ' ' , ' various ' , ' expert ' , ' ' , ' prepare ' , ' ' ]","Business strengths:Because we are in the market leader position as a customer relationship management system (CRM), we can carry out client work based on our track record and trust. In addition, we are expanding our portfolio by acquiring peripheral solutions such as analytics, marketing, and API management. We will also collaborate with various experts to prepare them."
19,女性/ Enablement & Competitive Specialist/ 現職（回答時）/ 新卒入社/ 在籍3年未満/ 正社員/ Sales Enablement & Academy/ Senior Productivity Coordinator,Benefits/office environment,4.8,福利厚生:住宅補助はないが、ストックオプションや各種手当ては充実している。学習費用補助なども存在している。オフィス環境:2022年2月付で大手町の新オフィスに移動。各階にお菓子や飲み物が無料で手に入るショップや、執務スペース、会議スペースを備えている。最上階にはお客様をお迎えするスペースや、別途トレーニング専用スタジオなども存在している。,2022年時点の情報,"[ ' Welfare ' , ' ' , ' ' , ' ' , ' housing ' , ' subsidy ' , ' ' , ' stock ' , ' option ' , ' ' , ' various ' , ' benefit ' , ' ' , ' substantial ' , ' Tuition ' , ' assistance ' , ' ' , ' also ' , ' available ' , ' Office ' , ' environment ' , ' Moved ' , ' ' , ' new ' , ' office ' , ' ' , ' Otemachi ' , ' ' , ' February ' , ' 2022 ' , ' ' , ' floor ' , ' ha ' , ' ' , ' shop ' , ' ' , ' ' , ' ' , ' get ' , ' sweet ' , ' ' , ' drink ' , ' ' , ' free ' , ' office ' , ' space ' , ' ' , ' meeting ' , ' space ' , ' ' , ' ' , ' top ' , ' floor ' , ' ' , ' ' , ' ' , ' space ' , ' ' , ' welcome ' , ' customer ' , ' ' , ' ' , ' separate ' , ' training ' , ' studio ' ]","Welfare: There is no housing subsidy, but stock options and various benefits are substantial. Tuition assistance is also available. Office environment: Moved to new office in Otemachi in February 2022. Each floor has a shop where you can get sweets and drinks for free, office space, and meeting space. On the top floor, there is a space to welcome customers and a separate training studio."
20,男性/ サクセスマネージャー/ 現職（回答時）/ 中途入社/ 在籍3年未満/ 正社員,Benefits/office environment,4.0,オフィス環境:会議室はガラス張りで透明性が保たれている。またカフェにはお菓子やドリンクがフリーでもらえる。コロナ前までは軽食なども提供されていた。オフィスは東京駅直結のため、雨にぬれずに通勤できる。今年の2月からは大手町駅直結となりこちらも駅直結のため雨にぬれずに出社は可能。ただしフルリモートワークのため、オフィスに出社する機会はほとんどない。あったとしても出社前に自社サービスでの事前登録が必要となる。,2022年時点の情報,"[ ' Office ' , ' environment ' , ' Conference ' , ' room ' , ' ' , ' glassenclosed ' , ' ' , ' transparency ' , ' ' , ' ' , ' also ' , ' get ' , ' sweet ' , ' ' , ' drink ' , ' ' , ' free ' , ' ' , ' ' , ' cafe ' , ' ' , ' ' , ' Corona ' , ' light ' , ' meal ' , ' ' , ' also ' , ' provided ' , ' ' , ' office ' , ' ' , ' directly ' , ' connected ' , ' ' , ' Tokyo ' , ' Station ' , ' ' , ' ' , ' ' , ' commute ' , ' without ' , ' getting ' , ' wet ' , ' ' , ' ' , ' rain ' , ' ' , ' February ' , ' ' , ' year ' , ' ' , ' ' , ' ' , ' directly ' , ' connected ' , ' ' , ' Otemachi ' , ' Station ' , ' ' , ' ' , ' ' , ' come ' , ' ' , ' work ' , ' without ' , ' getting ' , ' wet ' , ' ' , ' ' , ' rain ' , ' However ' , ' due ' , ' ' , ' full ' , ' remote ' , ' work ' , ' ' , ' ' , ' ' , ' opportunity ' , ' ' , ' go ' , ' ' , ' ' , ' office ' , ' Even ' , ' ' , ' ' , ' ' , ' ' , ' ' , ' necessary ' , ' ' , ' preregister ' , ' ' , ' ' , ' company ' , ' service ' , ' ' , ' coming ' , ' ' , ' work ' ]","Office environment: Conference rooms are glass-enclosed for transparency. You can also get sweets and drinks for free at the cafe. Until before Corona, light meals were also provided. The office is directly connected to Tokyo Station, so you can commute without getting wet in the rain. From February this year, it will be directly connected to Otemachi Station, so you can come to work without getting wet in the rain. However, due to full remote work, there are few opportunities to go to the office. Even if there is, it is necessary to pre-register with the company's service before coming to work."
21,男性/ アカウントエグゼクティブ/ 現職（回答時）/ 中途入社/ 在籍6～10年/ 正社員/ 営業本部/ 無し,Corporate culture/organizational system,4.9,"企業カルチャー・社風:Ohana,1-1-1モデル,equality（平等）社員同士が助け合い、情報を共有し、切磋琢磨しあう文化組織体制・コミュニケーション:社内SNSを活用して部門や役職を超えたコミュニケーションが可能。ダイバーシティ・多様性:SDGS,LGBTに本気で取り組んでいる",2021年時点の情報,"[ ' Corporate ' , ' culturecorporate ' , ' style ' , ' Ohana ' , ' 111 ' , ' model ' , ' equality ' , ' ' , ' culture ' , ' ' , ' ' , ' employee ' , ' help ' , ' ' , ' ' , ' share ' , ' information ' , ' ' , ' work ' , ' hard ' , ' Organizational ' , ' structurecommunication ' , ' Communication ' , ' beyond ' , ' department ' , ' ' , ' position ' , ' using ' , ' inhouse ' , ' SNS ' , ' ' , ' DiversityDiversity ' , ' Seriously ' , ' working ' , ' ' , ' SDGs ' , ' ' , ' LGBT ' ]","Corporate culture/corporate style: Ohana, 1-1-1 model, equality A culture in which employees help each other, share information, and work hard Organizational structure/communication: Communication beyond departments and positions using in-house SNS Can. Diversity/Diversity: Seriously working on SDGs and LGBT"
22,女性/ インサイドセールス/ 現職（回答時）/ 中途入社/ 在籍3年未満/ 正社員,Corporate culture/organizational system,4.9,企業カルチャー・社風:非常に前向きなコミュニケーションが多く、部門間の壁も低い。困りごとがあれば社内SNSですぐに相談し、対面したことがないスペシャリストからすぐにナレッジ提供が受けられる文化は特筆すべきと感じる。マネージャーとの1:1も密に行われ、適性に沿ったアドバイスがなされる。非常に多様な製品、製品事例、ナレッジ共有が活発に行われているため、入社当初のキャッチアップは少々大変である。,2021年時点の情報,"[ ' Corporate ' , ' culturecorporate ' , ' style ' , ' ' , ' ' , ' ' , ' lot ' , ' ' , ' ' , ' positive ' , ' communication ' , ' ' , ' ' , ' wall ' , ' ' , ' department ' , ' ' , ' low ' , ' ' , ' feel ' , ' ' , ' ' , ' culture ' , ' ' , ' ' , ' able ' , ' ' , ' immediately ' , ' consult ' , ' ' , ' internal ' , ' SNS ' , ' ' , ' ' , ' ' , ' ' , ' problem ' , ' ' , ' receive ' , ' knowledge ' , ' immediately ' , ' ' , ' ' , ' specialist ' , ' ' , ' ha ' , ' never ' , ' met ' , ' facetoface ' , ' ' , ' noteworthy ' , ' ' , ' 11 ' , ' meeting ' , ' ' , ' ' , ' manager ' , ' ' , ' also ' , ' held ' , ' closely ' , ' ' , ' advice ' , ' ' , ' given ' , ' according ' , ' ' , ' aptitude ' , ' Due ' , ' ' , ' ' , ' extremely ' , ' diverse ' , ' range ' , ' ' , ' product ' , ' product ' , ' case ' , ' ' , ' knowledge ' , ' sharing ' , ' ' , ' ' , ' ' , ' ' , ' little ' , ' difficult ' , ' ' , ' catch ' , ' ' , ' ' , ' ' , ' first ' , ' join ' , ' ' , ' company ' ]","Corporate culture/corporate style: There is a lot of very positive communication, and the walls between departments are low. I feel that the culture of being able to immediately consult on internal SNS if there is a problem and receive knowledge immediately from a specialist who has never met face-to-face is noteworthy. A 1:1 meeting with the manager is also held closely, and advice is given according to aptitude. Due to the extremely diverse range of products, product cases, and knowledge sharing, it can be a little difficult to catch up when you first join the company."
