,reviewer_info,title,rating,review,year,review_translated,reviwe_translated_original
0,男性/ 営業/ 現職（回答時）/ 中途入社/ 在籍3年未満/ 正社員,Work style (working hours/holidays/systems),4.7,勤務時間・休日休暇:ワークライフバランスをとるかどうかは自分次第。ベースとなる勤務時間は9：00－18：00だが、コアタイムのないスーパーフレックス。そのため、自分でコントロールする必要あり。ただ、自己学習、資料作成、顧客調査、それぞれやらなければならないことが多く、業務時間以外に勉強時間の確保が必要。勉強時間を勤務時間内に作ることができればよいが、顧客対応と商談を進めるための調査、社内ミーティング等で業務時間外になることがほとんど。どこかで割り切って、やることとやらないことを決めていけばワークライフバランスはとれるが、全てやろうとすると毎日深夜まで仕事しても終わらず休日も仕事に追われ、バランスを崩す。精神的に図太くない人はなかなか割り切れず、自分を追い込んでオーバーワークになり、体調を崩しがち。自分のコントロール次第。多様な働き方支援:リモートワークは部署次第。フルでリモートの部署もあれば、週1～2で出勤という部署もある。ただ、家庭の事情等は考慮してもらえるため、無理に強制的に出社させられることはない。スーパーフレックスのため、家庭の都合で子供を保育園に送ってから出社するため、朝の開始を遅らせる、迎えに行くので早帰りする等は調整可能。,2022年時点の情報,"[ ' Working ' , ' HoursHolidaysHolidays ' , ' ' , ' ' , ' ' , ' ' , ' ' , ' find ' , ' ' , ' worklife ' , ' balance ' , ' ' , ' basic ' , ' working ' , ' hour ' , ' ' , ' ' , ' 900 ' , ' ' , ' 1800 ' , ' ' , ' ' , ' ' , ' ' , ' super ' , ' flextime ' , ' ' , ' ' , ' core ' , ' time ' , ' Therefore ' , ' ' , ' ' , ' ' , ' control ' , ' ' , ' ' , ' However ' , ' ' , ' ' , ' many ' , ' thing ' , ' ' , ' must ' , ' ' , ' done ' , ' ' , ' ' , ' selfstudy ' , ' document ' , ' preparation ' , ' ' , ' customer ' , ' survey ' , ' ' , ' ' , ' ' , ' necessary ' , ' ' , ' secure ' , ' study ' , ' time ' , ' outside ' , ' ' , ' work ' , ' hour ' , ' ' , ' would ' , ' ' , ' nice ' , ' ' , ' ' , ' could ' , ' make ' , ' time ' , ' ' , ' study ' , ' ' , ' working ' , ' hour ' , ' ' , ' ' , ' ' , ' ' , ' time ' , ' ' , ' spend ' , ' outside ' , ' working ' , ' hour ' , ' due ' , ' ' , ' customer ' , ' support ' , ' research ' , ' ' , ' advance ' , ' business ' , ' negotiation ' , ' internal ' , ' meeting ' , ' etc ' , ' ' , ' ' , ' maintain ' , ' ' , ' good ' , ' worklife ' , ' balance ' , ' ' , ' ' , ' decide ' , ' ' , ' ' , ' ' , ' ' , ' ' , ' ' , ' ' , ' ' , ' People ' , ' ' , ' arent ' , ' mentally ' , ' bold ' , ' tend ' , ' ' , ' ' , ' hardpressed ' , ' push ' , ' ' , ' ' , ' overwork ' , ' ' , ' get ' , ' sick ' , ' ' , ' ' , ' ' , ' control ' , ' Diverse ' , ' work ' , ' style ' , ' support ' , ' Remote ' , ' work ' , ' depends ' , ' ' , ' ' , ' department ' , ' ' , ' department ' , ' ' , ' fully ' , ' remote ' , ' ' , ' others ' , ' come ' , ' ' , ' work ' , ' ' , ' ' , ' twice ' , ' ' , ' week ' , ' However ' , ' ' , ' ' , ' ' , ' forced ' , ' ' , ' come ' , ' ' , ' work ' , ' ' , ' family ' , ' circumstance ' , ' ' , ' taken ' , ' ' , ' consideration ' , ' ' , ' ' , ' super ' , ' flextime ' , ' ' , ' ' , ' possible ' , ' ' , ' adjust ' , ' ' , ' schedule ' , ' ' , ' ' , ' delaying ' , ' ' , ' start ' , ' ' , ' ' , ' morning ' , ' ' , ' go ' , ' ' , ' work ' , ' ' , ' sending ' , ' ' , ' child ' , ' ' , ' nursery ' , ' school ' , ' ' , ' family ' , ' reason ' , ' ' , ' leaving ' , ' early ' , ' ' , ' pick ' , ' ' , ' ' , ' child ' ]","Working Hours/Holidays/Holidays: It's up to you to find a work-life balance. The basic working hours are from 9:00 to 18:00, but it is a super flextime with no core time. Therefore, you have to control it yourself. However, there are many things that must be done, such as self-study, document preparation, and customer surveys, so it is necessary to secure study time outside of work hours. It would be nice if I could make time to study during working hours, but most of the time I spend outside working hours due to customer support, research to advance business negotiations, internal meetings, etc. You can maintain a good work-life balance if you decide what to do and what not to do. People who aren't mentally bold tend to be hard-pressed, push themselves into overwork, and get sick. up to your control. Diverse work style support: Remote work depends on the department. Some departments are fully remote, while others come to work once or twice a week. However, they are not forced to come to work because family circumstances are taken into consideration. Because of super flextime, it is possible to adjust the schedule, such as delaying the start of the morning to go to work after sending the child to nursery school for family reasons, or leaving early to pick up the child."
1,男性/ 営業/ 現職（回答時）/ 中途入社/ 在籍3年未満/ 正社員,Work style (working hours/holidays/systems),4.7,勤務時間・休日休暇:ワークライフバランスを保てるかどうかは自分次第。強制的に残業や休日の仕事を強いられることはない。ただし、慣れないうちは1個1個の作業に非常に時間がかかり、仕事が全く進まず、結果的に深夜や休日も仕事をせざるを得ない。慣れたら自分の裁量で仕事を早く終わらせ、しっかり休むことができるようになるのかと思うが、ベテラン、マネージャーを見ても深夜でもステータスがほぼ毎日オンライン。ワーカーホリック多数という印象。時間内は顧客対応と社内会議、時間外に社内で飛び交っている情報の確認、勉強、顧客調査、提案資料作成というスケジュール。これらが深夜で収まらないと休日に残りを対応。多様な働き方支援:コロナ期間中は完全リモートワーク。顧客対応で出勤せざるを得ない場合は承認制。移動手段はタクシーまたは自家用車で、公共交通機関利用不可。コロナ後は公共交通機関は当然利用可になるが、週1～2で出勤、その他リモートというシフトになると予想。成果主義で勤務時間に対する拘束は非常に緩いため、子供の保育園の送り迎えを業務時間に対応することも可能。ただし時間内に業務を全て終えることはほぼ不可能なため、その分早朝、深夜、休日に仕事をしている人多数。,2021年時点の情報,"[ ' Working ' , ' HoursHolidaysHolidays ' , ' ' , ' ' , ' ' , ' ' , ' ' , ' ' , ' ' , ' maintain ' , ' ' , ' worklife ' , ' balance ' , ' Employees ' , ' ' , ' ' , ' forced ' , ' ' , ' work ' , ' overtime ' , ' ' , ' work ' , ' ' , ' holiday ' , ' However ' , ' ' , ' ' , ' get ' , ' used ' , ' ' , ' ' , ' ' , ' take ' , ' ' , ' lot ' , ' ' , ' time ' , ' ' , ' work ' , ' ' , ' ' , ' item ' , ' ' , ' ' , ' work ' , ' doesnt ' , ' progress ' , ' ' , ' ' , ' ' , ' ' , ' ' , ' result ' , ' ' , ' ' , ' ' , ' work ' , ' late ' , ' ' , ' night ' , ' ' , ' ' , ' holiday ' , ' ' , ' ' , ' get ' , ' used ' , ' ' , ' ' , ' ' , ' think ' , ' ' , ' ' , ' ' , ' able ' , ' ' , ' finish ' , ' ' , ' work ' , ' early ' , ' ' , ' take ' , ' ' , ' good ' , ' rest ' , ' ' , ' ' , ' ' , ' discretion ' , ' ' , ' even ' , ' ' , ' ' , ' see ' , ' ' , ' veteran ' , ' ' , ' manager ' , ' ' , ' status ' , ' ' , ' online ' , ' almost ' , ' every ' , ' day ' , ' even ' , ' late ' , ' ' , ' night ' , ' Impression ' , ' ' , ' ' , ' ' , ' many ' , ' workaholic ' , ' ' , ' working ' , ' hour ' , ' ' , ' ' , ' customer ' , ' support ' , ' ' , ' internal ' , ' meeting ' , ' ' , ' ' , ' hour ' , ' ' , ' ' , ' ' , ' schedule ' , ' ' , ' checking ' , ' information ' , ' ' , ' ' , ' flying ' , ' around ' , ' ' , ' company ' , ' studying ' , ' ' , ' customer ' , ' research ' , ' ' , ' creating ' , ' proposal ' , ' material ' , ' ' , ' ' , ' ' , ' ' , ' fit ' , ' ' , ' ' , ' middle ' , ' ' , ' ' , ' night ' , ' ' , ' ' , ' deal ' , ' ' , ' ' , ' rest ' , ' ' , ' holiday ' , ' Diverse ' , ' work ' , ' style ' , ' support ' , ' Complete ' , ' remote ' , ' work ' , ' ' , ' ' , ' corona ' , ' period ' , ' Approval ' , ' system ' , ' ' , ' ' , ' ' , ' ' , ' go ' , ' ' , ' work ' , ' ' , ' respond ' , ' ' , ' customer ' , ' Transportation ' , ' ' , ' ' , ' taxi ' , ' ' , ' private ' , ' car ' , ' public ' , ' transportation ' , ' ' , ' ' , ' available ' , ' Public ' , ' transportation ' , ' ' , ' ' , ' course ' , ' ' , ' available ' , ' ' , ' COVID19 ' , ' ' , ' ' , ' ' , ' expected ' , ' ' , ' people ' , ' ' , ' go ' , ' ' , ' work ' , ' ' , ' ' , ' twice ' , ' ' , ' week ' , ' ' , ' ' , ' shift ' , ' ' , ' ' , ' remote ' , ' Since ' , ' ' , ' ' , ' performancebased ' , ' ' , ' ' , ' restriction ' , ' ' , ' working ' , ' hour ' , ' ' , ' ' , ' loose ' , ' ' , ' ' , ' possible ' , ' ' , ' pick ' , ' ' , ' ' , ' drop ' , ' ' , ' child ' , ' ' , ' nursery ' , ' school ' , ' ' , ' working ' , ' hour ' , ' However ' , ' ' , ' ' , ' almost ' , ' impossible ' , ' ' , ' finish ' , ' ' , ' work ' , ' ' , ' time ' , ' ' , ' many ' , ' people ' , ' work ' , ' early ' , ' ' , ' ' , ' morning ' , ' late ' , ' ' , ' night ' , ' ' , ' ' , ' holiday ' ]","Working Hours/Holidays/Holidays: It's up to you if you can maintain a work-life balance. Employees are not forced to work overtime or work on holidays. However, until you get used to it, it takes a lot of time to work on each item, and the work doesn't progress at all, and as a result, you have to work late at night and on holidays. Once I get used to it, I think I will be able to finish my work early and take a good rest at my own discretion, but even if I see a veteran or manager, my status is online almost every day, even late at night. Impression that there are many workaholics. During working hours, I have customer support and internal meetings, and after hours, I have a schedule of checking information that is flying around the company, studying, doing customer research, and creating proposal materials. If these do not fit in the middle of the night, we will deal with the rest on holidays. Diverse work style support: Complete remote work during the corona period. Approval system if you have to go to work to respond to customers. Transportation is by taxi or private car, public transportation is not available. Public transportation will of course be available after COVID-19, but it is expected that people will go to work once or twice a week, and other shifts will be remote. Since it is performance-based and the restrictions on working hours are very loose, it is possible to pick up and drop off children from nursery school during working hours. However, it is almost impossible to finish all work in time, so many people work early in the morning, late at night, and on holidays."
2,男性/ Solution Engineer/ 現職（回答時）/ 中途入社/ 在籍3～5年/ 正社員/ SE本部/ SE,Annual salary/salary,5.0,給与制度:提示される想定年収の8割が固定給で残り2割がインセンティブインセンティブは四半期ごとに支払われる。インセンティブの計算は個人の数字よりも、Japan全体の数字による影響が大きいため、良くも悪くも、当初提示された想定年収とほぼ同じか、それ以上がもらえる。当初の想定を大きく変えた額が貰えることは少ないが、当初想定を下回ることもない。評価制度:年に2度昇格のチャンスがある。前提として個人の目標を達成していることは重要な判断基準になり、達成していなければそもそも昇格候補者にならない。達成している人の中で、その他の活動も加味して貢献度の高い人や、提案の質の高い人が昇格する。昇格とは別に昇給もあり、昇給は年に1度のチャンスがある。昇給は普通に活動していればできるもので、大体年に3〜5%くらい給与が上がる。もともと比較的に給与の高い会社なので、仮に前年1000万であれば、翌年は昇格しなくても年収が50万上がる。,2020年時点の情報,"[ ' Salary ' , ' system ' , ' 80 ' , ' ' , ' ' , ' estimated ' , ' annual ' , ' income ' , ' presented ' , ' ' , ' fixed ' , ' salary ' , ' ' , ' ' , ' remaining ' , ' 20 ' , ' ' , ' incentive ' , ' Incentives ' , ' ' , ' paid ' , ' quarterly ' , ' ' , ' calculation ' , ' ' , ' incentive ' , ' ' , ' ' , ' influenced ' , ' ' , ' ' , ' figure ' , ' ' , ' Japan ' , ' ' , ' ' , ' whole ' , ' ' , ' ' , ' figure ' , ' ' , ' individual ' , ' ' , ' ' , ' better ' , ' ' , ' worse ' , ' ' , ' ' , ' get ' , ' almost ' , ' ' , ' ' , ' ' , ' ' , ' income ' , ' ' , ' ' , ' initially ' , ' presented ' , ' assumed ' , ' annual ' , ' income ' , ' ' , ' ' , ' rare ' , ' ' , ' ' , ' ' , ' receive ' , ' ' , ' amount ' , ' ' , ' ' , ' significantly ' , ' different ' , ' ' , ' ' , ' initial ' , ' assumption ' , ' ' , ' ' , ' ' , ' ' , ' ' , ' le ' , ' ' , ' ' , ' initial ' , ' assumption ' , ' Evaluation ' , ' system ' , ' Opportunity ' , ' ' , ' promotion ' , ' twice ' , ' ' , ' year ' , ' ' , ' ' , ' premise ' , ' ' , ' achievement ' , ' ' , ' individual ' , ' goal ' , ' ' , ' ' , ' important ' , ' criterion ' , ' ' , ' judgment ' , ' ' , ' ' , ' ' , ' ' , ' ' , ' achieve ' , ' ' , ' ' , ' ' , ' ' , ' ' , ' candidate ' , ' ' , ' promotion ' , ' ' , ' ' , ' first ' , ' place ' , ' Among ' , ' ' , ' ' , ' ' , ' achieved ' , ' ' , ' goal ' , ' ' , ' ' , ' make ' , ' ' , ' high ' , ' degree ' , ' ' , ' contribution ' , ' ' , ' consideration ' , ' ' , ' ' , ' activity ' , ' ' , ' ' , ' ' , ' make ' , ' highquality ' , ' proposal ' , ' ' , ' promoted ' , ' ' , ' ' , ' also ' , ' ' , ' pay ' , ' raise ' , ' apart ' , ' ' , ' promotion ' , ' ' , ' ' , ' ' , ' ' , ' chance ' , ' ' , ' ' , ' pay ' , ' raise ' , ' ' , ' ' , ' year ' , ' Salary ' , ' increase ' , ' ' , ' something ' , ' ' , ' ' , ' ' , ' done ' , ' ' , ' ' , ' ' , ' working ' , ' normally ' , ' ' , ' ' , ' salary ' , ' ' , ' increase ' , ' ' , ' ' , ' 3 ' , ' ' , ' 5 ' , ' ' , ' year ' , ' ' , ' salary ' , ' ' , ' ' , ' company ' , ' ' , ' relatively ' , ' high ' , ' ' , ' begin ' , ' ' , ' ' , ' ' , ' ' , ' salary ' , ' ' , ' 10 ' , ' million ' , ' yen ' , ' ' , ' ' , ' previous ' , ' year ' , ' ' , ' annual ' , ' income ' , ' ' , ' increase ' , ' ' , ' 500000 ' , ' yen ' , ' ' , ' following ' , ' year ' , ' even ' , ' ' , ' ' , ' ' , ' ' , ' promoted ' ]","Salary system: 80% of the estimated annual income presented is fixed salary and the remaining 20% ​​is incentives Incentives are paid quarterly. The calculation of incentives is more influenced by the figures of Japan as a whole than the figures of individuals, so for better or worse, you can get almost the same or more income than the initially presented assumed annual income. It is rare that you will receive an amount that is significantly different from the initial assumption, but it will not be less than the initial assumption. Evaluation system: Opportunity for promotion twice a year. As a premise, the achievement of individual goals is an important criterion for judgment, and if they do not achieve them, they will not be candidates for promotion in the first place. Among those who have achieved the goal, those who make a high degree of contribution in consideration of other activities and those who make high-quality proposals are promoted. There is also a pay raise apart from promotion, and there is a chance for a pay raise once a year. Salary increases are something that can be done if you are working normally, and your salary will increase by about 3 to 5% a year. The salary of the company is relatively high to begin with, so if your salary is 10 million yen in the previous year, your annual income will increase by 500,000 yen the following year, even if you are not promoted."
3,男性/ 6903/ 現職（回答時）/ 中途入社/ 在籍6～10年/ 正社員,Corporate culture/organizational system,4.9,企業カルチャー・社風:カスタマーサクセスを打ち出しており、導入後も運用をサポートする部門が支援する社員やステークホルダーをオハナ（家族）と呼んで大切にする文化がありファミリーデー（家族参加イベント）などもある組織体制・コミュニケーション:社内SNSで副社長から一般社員までコミュニケーションできる文化がある。海外へのメッセージも可能。メールのように堅い挨拶文がいらないので目的に合わせたシンプルなメッセージでフラットにやりとりできる。ダイバーシティ・多様性:常に強化しておりトレーニングも毎年行われるクレーム窓口もオープンに案内されている役員の女性登用もある,2021年時点の情報,"[ ' Corporate ' , ' culturecorporate ' , ' culture ' , ' ' , ' company ' , ' ' , ' committed ' , ' ' , ' customer ' , ' success ' , ' ' , ' ' , ' ' , ' ' , ' culture ' , ' ' , ' valuing ' , ' employee ' , ' ' , ' stakeholder ' , ' ' , ' ' , ' supported ' , ' ' , ' ' , ' department ' , ' ' , ' support ' , ' operation ' , ' even ' , ' ' , ' introduction ' , ' calling ' , ' ' , ' Ohana ' , ' family ' , ' ' , ' holding ' , ' family ' , ' day ' , ' family ' , ' participation ' , ' event ' , ' Organizational ' , ' structurecommunication ' , ' ' , ' ' , ' ' , ' culture ' , ' ' , ' allows ' , ' communication ' , ' ' , ' ' , ' vice ' , ' president ' , ' ' , ' general ' , ' employee ' , ' ' , ' ' , ' company ' , ' SNS ' , ' ' , ' ' , ' also ' , ' possible ' , ' ' , ' send ' , ' message ' , ' overseas ' , ' ' , ' dont ' , ' need ' , ' formal ' , ' greeting ' , ' like ' , ' email ' , ' ' , ' ' , ' ' , ' communicate ' , ' flatly ' , ' ' , ' simple ' , ' message ' , ' ' , ' match ' , ' ' , ' purpose ' , ' DiversityDiversity ' , ' Continually ' , ' strengthened ' , ' ' , ' training ' , ' ' , ' provided ' , ' every ' , ' year ' , ' Complaint ' , ' contact ' , ' point ' , ' ' , ' openly ' , ' guided ' , ' ' , ' ' , ' also ' , ' ' , ' appointment ' , ' ' , ' woman ' , ' ' , ' officer ' ]","Corporate culture/corporate culture: The company is committed to customer success, and there is a culture of valuing employees and stakeholders who are supported by the department that supports operations even after introduction, calling them Ohana (family), and holding family days (family participation events). Organizational structure/communication: There is a culture that allows communication from the vice president to general employees on the company's SNS. It is also possible to send messages overseas. You don't need formal greetings like e-mail, so you can communicate flatly with simple messages that match your purpose. Diversity/Diversity: Continually strengthened and training is provided every year Complaint contact points are openly guided There is also the appointment of women as officers"
4,男性/ カスタマーサクセス/ 現職（回答時）/ 中途入社/ 在籍11～15年/ 正社員/ ディレクター,Benefits/office environment,5.0,福利厚生:オフィス内のカフェテリアは充実している。エスプレッソマシンは自動であるが、豆もそれ専用の焙煎が行われたものが鮮度よく補充されるので、なかなかこのクオリティの味は本格的な店でも味わえないと思う。食べ物も当初はお菓子が多かったが、従業員の声を受けて、ドライフルーツや果物、ナッツ、ヨーグルトなどがヘルシーなものが提供されるようになり、どれくらいのコストがかかっているのか不安になることもある。外資系で一般的なESPPやRSUもあり株価が上がっている現時点では給与以外の資産形成の助けになっている。オフィス環境:増える従業員に対してスペースが足りていないので、フリーデスクが一般的。会議室は結構な数があるが足りていない。オフィス家具はしっかり投資されていて、アーロンチェアやスタンドアップデスクは長時間仕事をする身としては非常にありがたい。,2020年時点の情報,"[ ' Welfare ' , ' ' , ' ' , ' ' , ' good ' , ' cafeteria ' , ' ' , ' ' , ' office ' , ' ' , ' espresso ' , ' machine ' , ' ' , ' automatic ' , ' ' , ' ' , ' bean ' , ' ' , ' specially ' , ' roasted ' , ' ' , ' replenished ' , ' ' , ' good ' , ' freshness ' , ' ' , ' first ' , ' ' , ' ' , ' ' , ' food ' , ' wa ' , ' sweet ' , ' ' , ' ' , ' response ' , ' ' , ' ' , ' voice ' , ' ' , ' employee ' , ' healthy ' , ' item ' , ' ' , ' ' , ' dried ' , ' fruit ' , ' fruit ' , ' nut ' , ' ' , ' yogurt ' , ' ' , ' offered ' , ' ' , ' ' , ' wa ' , ' worried ' , ' ' , ' ' , ' much ' , ' ' , ' would ' , ' cost ' , ' Sometimes ' , ' ESPP ' , ' ' , ' RSU ' , ' ' , ' ' , ' common ' , ' ' , ' foreign ' , ' company ' , ' ' , ' helping ' , ' ' , ' build ' , ' asset ' , ' ' , ' ' , ' salary ' , ' ' , ' ' , ' time ' , ' ' , ' stock ' , ' price ' , ' ' , ' rising ' , ' Office ' , ' Environment ' , ' Free ' , ' desk ' , ' ' , ' common ' , ' due ' , ' ' , ' lack ' , ' ' , ' space ' , ' ' , ' ' , ' increasing ' , ' number ' , ' ' , ' employee ' , ' ' , ' ' , ' quite ' , ' ' , ' ' , ' meeting ' , ' room ' , ' ' , ' ' , ' ' , ' ' , ' enough ' , ' ' , ' office ' , ' furniture ' , ' ' , ' wellinvested ' , ' ' , ' ' , ' Aeron ' , ' chair ' , ' ' , ' standup ' , ' desk ' , ' ' , ' ' , ' big ' , ' plus ' , ' ' , ' someone ' , ' ' , ' work ' , ' long ' , ' hour ' ]","Welfare: There is a good cafeteria in the office. The espresso machine is automatic, but the beans are specially roasted and replenished with good freshness. At first, most of the food was sweets, but in response to the voices of employees, healthy items such as dried fruits, fruits, nuts, and yogurt were offered, and I was worried about how much it would cost. Sometimes. ESPP and RSU, which are common in foreign companies, are helping to build assets other than salary at this time when stock prices are rising. Office Environment: Free desks are common due to lack of space for the increasing number of employees. There are quite a few meeting rooms, but they are not enough. The office furniture is well-invested, and the Aeron chair and stand-up desk are a big plus for someone who works long hours."
5,女性/ アカウントエグゼクティブ/ 退職済み（2022年）/ 中途入社/ 在籍3～5年/ 正社員,Work style (working hours/holidays/systems),2.8,勤務時間・休日休暇:ワークライフバランスは、アカウントエグゼクティブをしている限りはない。達成したければ毎日23時以降や夜中まで働き、土日も仕事、一日中9時から19時まで5件ほどアポを組めと言われる。アポがあまり入っていないと、カレンダーのスクショを会社に公開されて晒しものにされたりもある。もちろん資料作りはそれ以降に行う。コマーシャル営業はそれに加えてお客様のシステム構築をさせられる。多様な働き方支援:リモート可能しかし、コマーシャルは最近出社義務になってきている早帰りも可能家から仕事していいよということ。副業はOKです。,2022年時点の情報,"[ ' Working ' , ' HoursHoliday ' , ' Leave ' , ' Worklife ' , ' balance ' , ' ' , ' nonexistent ' , ' ' , ' long ' , ' ' , ' youre ' , ' ' , ' account ' , ' executive ' , ' ' , ' ' , ' want ' , ' ' , ' achieve ' , ' ' , ' ' , ' ' , ' told ' , ' ' , ' work ' , ' every ' , ' day ' , ' ' , ' 2300 ' , ' ' , ' ' , ' midnight ' , ' work ' , ' ' , ' Saturdays ' , ' ' , ' Sundays ' , ' ' , ' make ' , ' five ' , ' appointment ' , ' ' , ' day ' , ' ' , ' 900 ' , ' ' , ' 1900 ' , ' ' , ' ' , ' dont ' , ' ' , ' many ' , ' appointment ' , ' ' , ' calendar ' , ' screenshots ' , ' ' , ' ' , ' made ' , ' public ' , ' ' , ' exposed ' , ' ' , ' ' , ' company ' , ' ' , ' course ' , ' ' , ' documentation ' , ' ' , ' ' , ' done ' , ' ' , ' ' , ' ' , ' addition ' , ' ' , ' ' , ' commercial ' , ' sale ' , ' ' , ' made ' , ' ' , ' build ' , ' ' , ' customer ' , ' system ' , ' Diverse ' , ' work ' , ' style ' , ' support ' , ' remote ' , ' possible ' , ' However ' , ' commercial ' , ' ' , ' recently ' , ' become ' , ' obligatory ' , ' ' , ' come ' , ' ' , ' work ' , ' ' , ' ' , ' ' , ' possible ' , ' ' , ' go ' , ' home ' , ' earlyIt ' , ' mean ' , ' ' , ' ' , ' ' , ' work ' , ' ' , ' home ' , ' Side ' , ' job ' , ' ' , ' OK ' ]","Working Hours/Holiday Leave: Work-life balance is non-existent as long as you're an account executive. If you want to achieve this, you are told to work every day after 23:00 or until midnight, work on Saturdays and Sundays, and make five appointments all day from 9:00 to 19:00. If you don't have many appointments, your calendar screenshots will be made public and exposed to the company. Of course, the documentation will be done after that. In addition to that, commercial sales are made to build the customer's system. Diverse work style support: remote possible However, commercials have recently become obligatory to come to work, so it is possible to go home early.It means that you can work from home. Side jobs are OK."
