,reviewer_info,title,rating,review,year,review_translated,reviwe_translated_original
98,女性/ 営業系（営業、MR、営業企画 他）/ 現職（回答時）/ 非正社員,Work style (working hours/holidays/systems),4.5,勤務時間・休日休暇：【長期休暇の取得】夏休みやクリスマス～年末年始にかけてアメリカ本社や各国の同僚が長期休暇を取ることもあるため、社員は長期休暇を取りやすい文化だと思います。営業も1週間程休みを取り、お互いの営業代理をして休暇のために助け合っているようです。また派遣社員も派遣会社から有給休暇が付与されていれば長期で有給休暇が取得できます。もし有給休暇が付与されていなくても欠勤扱いで長期休暇を取ることが相談できる雰囲気はあります。,2019年時点の情報,"[ ' Working ' , ' hoursholidays ' , ' [ Taking ' , ' long ' , ' vacations ] ' , ' ' , ' think ' , ' ' , ' ' , ' culture ' , ' make ' , ' ' , ' easy ' , ' ' , ' employee ' , ' ' , ' take ' , ' long ' , ' vacation ' , ' ' , ' colleague ' , ' ' , ' ' , ' US ' , ' headquarters ' , ' ' , ' ' , ' ' , ' country ' , ' sometimes ' , ' take ' , ' long ' , ' vacation ' , ' ' , ' ' , ' summer ' , ' vacation ' , ' Christmas ' , ' ' , ' yearend ' , ' ' , ' New ' , ' Year ' , ' holiday ' , ' ' , ' seems ' , ' ' , ' ' , ' sale ' , ' ' , ' also ' , ' taking ' , ' ' , ' break ' , ' ' , ' ' , ' ' , ' week ' , ' ' , ' ' , ' ' , ' helping ' , ' ' , ' ' , ' ' , ' ' , ' holiday ' , ' ' , ' acting ' , ' ' , ' sale ' , ' agent ' , ' ' , ' ' , ' ' , ' Temporary ' , ' employee ' , ' ' , ' also ' , ' take ' , ' longterm ' , ' paid ' , ' holiday ' , ' ' , ' ' , ' ' , ' granted ' , ' paid ' , ' holiday ' , ' ' , ' ' , ' temporary ' , ' staffing ' , ' company ' , ' Even ' , ' ' , ' ' , ' paid ' , ' vacation ' , ' ' , ' granted ' , ' ' , ' ' , ' ' , ' atmosphere ' , ' ' , ' ' , ' ' , ' ' , ' possible ' , ' ' , ' discus ' , ' taking ' , ' long ' , ' vacation ' , ' ' , ' absenteeism ' ]","Working hours/holidays: [Taking long vacations] I think that our culture makes it easy for employees to take long vacations, as colleagues at the US headquarters and in other countries sometimes take long vacations during the summer vacation, Christmas, and year-end and New Year holidays. It seems that the sales are also taking a break for about a week, and they are helping each other for the holidays by acting as sales agents for each other. Temporary employees can also take long-term paid holidays if they are granted paid holidays by the temporary staffing company. Even if no paid vacation is granted, there is an atmosphere in which it is possible to discuss taking long vacations as absenteeism."
99,女性/ SalesStrategyAccosiate/ 現職（回答時）/ 中途入社/ 在籍3年未満/ 契約社員,Benefits/office environment,2.8,福利厚生:住宅補助などはないが、月々の健康補助や在宅手当、持株会がある。オフィス環境:新社屋に移転したが使用する機会はほとんどない。前は、きれいなオフィスというのが良かったけど、それを活用する機会が来ることはあるかわからない。,2022年時点の情報,"[ ' Welfare ' , ' ' , ' ' , ' ' , ' housing ' , ' subsidy ' , ' ' , ' ' , ' ' , ' monthly ' , ' health ' , ' subsidy ' , ' home ' , ' allowance ' , ' ' , ' stock ' , ' ownership ' , ' association ' , ' Office ' , ' environment ' , ' ' , ' ' , ' moved ' , ' ' , ' ' , ' new ' , ' office ' , ' building ' , ' ' , ' ' , ' ' , ' ' , ' opportunity ' , ' ' , ' use ' , ' ' , ' ' , ' used ' , ' ' , ' ' , ' nice ' , ' ' , ' ' , ' ' , ' clean ' , ' office ' , ' ' , ' ' , ' dont ' , ' know ' , ' ' , ' Ill ' , ' ever ' , ' ' , ' ' , ' opportunity ' , ' ' , ' make ' , ' use ' , ' ' , ' ' ]","Welfare: There is no housing subsidy, but there are monthly health subsidies, home allowances, and stock ownership associations. Office environment: We have moved to a new office building, but there are few opportunities to use it. It used to be nice to have a clean office, but I don't know if I'll ever have the opportunity to make use of it."
0,男性/ 営業系（営業、MR、営業企画 他）/ 退職済み/ 正社員,Business prospects/strengths/weaknesses,4.6,成長性・将来性：CRM、営業支援を中心としたサービスはまだまだニーズは多くあり継続した成長はしていく。またデジタルマーケティング領域においてもB2C領域に力を入れてきているので今までカバレッジできていなかった小売業へもアプローチが加速していく。各営業へのスキルアップを非常に力を入れているので優秀な営業が多く育ってきているのも要因になる。将来に向けては、顧客情報を全方位で集めていくプラットフォームを目指していくことによりより提案の幅が広がってくるのではないかと感じる,2018年時点の情報,"[ ' Growth ' , ' potentialfuture ' , ' potential ' , ' ' , ' ' , ' still ' , ' many ' , ' need ' , ' ' , ' service ' , ' centered ' , ' ' , ' CRM ' , ' ' , ' sale ' , ' support ' , ' ' , ' ' , ' ' , ' continue ' , ' ' , ' grow ' , ' Also ' , ' ' , ' ' , ' digital ' , ' marketing ' , ' area ' , ' ' , ' ' , ' focusing ' , ' ' , ' ' , ' B2C ' , ' area ' , ' ' , ' ' , ' ' , ' accelerate ' , ' ' , ' approach ' , ' ' , ' ' , ' retail ' , ' industry ' , ' ' , ' ' , ' ' , ' ' , ' ' , ' able ' , ' ' , ' cover ' , ' ' , ' far ' , ' ' , ' ' , ' also ' , ' ' , ' factor ' , ' ' , ' many ' , ' excellent ' , ' sale ' , ' people ' , ' ' , ' growing ' , ' ' , ' ' , ' put ' , ' ' , ' lot ' , ' ' , ' effort ' , ' ' , ' improving ' , ' ' , ' skill ' , ' ' , ' ' , ' sale ' , ' person ' , ' ' , ' ' , ' future ' , ' ' , ' feel ' , ' ' , ' ' , ' range ' , ' ' , ' proposal ' , ' ' , ' ' , ' expanded ' , ' ' , ' aiming ' , ' ' , ' ' , ' platform ' , ' ' , ' collect ' , ' customer ' , ' information ' , ' ' , ' ' , ' direction ' ]","Growth potential/future potential: There are still many needs for services centered on CRM and sales support, and we will continue to grow. Also, in the digital marketing area, we are focusing on the B2C area, so we will accelerate our approach to the retail industry, which we have not been able to cover so far. It is also a factor that many excellent sales people are growing because they put a lot of effort into improving the skills of each sales person. In the future, I feel that the range of proposals will be expanded by aiming for a platform that collects customer information from all directions."
1,男性/ 営業系（営業、MR、営業企画 他）/ 退職済み/ 正社員,Business prospects/strengths/weaknesses,4.6,事業での社会貢献：この会社の良いところは社会貢献を全面に出していることです。1ー1ー1というモデルを自社だけではなく他社へも影響を与えている。入社当初からボランティアをすることが大事であると伝えられて自分の就業時間の1%を使うことが権利となっている。各部署にはボランティア推進担当もおり、積極的に参加できるようにイベントなども実施している。オフサイトなどもよくやるが、通常の研修＋社会貢献を実施し。地域の清掃や恵まれていない子どもへの支援もやっている,2018年時点の情報,"[ ' Social ' , ' Contribution ' , ' ' , ' Business ' , ' ' , ' good ' , ' thing ' , ' ' , ' ' , ' company ' , ' ' , ' ' , ' ' , ' put ' , ' ' , ' social ' , ' contribution ' , ' ' , ' ' , ' front ' , ' ' , ' model ' , ' ' , ' 111 ' , ' ' , ' affecting ' , ' ' , ' ' , ' ' , ' company ' , ' ' , ' also ' , ' ' , ' company ' , ' ' , ' ' , ' time ' , ' ' , ' joined ' , ' ' , ' company ' , ' ' , ' wa ' , ' told ' , ' ' , ' ' , ' wa ' , ' important ' , ' ' , ' ' , ' volunteer ' , ' work ' , ' ' , ' ' , ' wa ' , ' given ' , ' ' , ' right ' , ' ' , ' spend ' , ' 1 ' , ' ' , ' ' , ' working ' , ' hour ' , ' ' , ' department ' , ' ha ' , ' ' , ' staff ' , ' ' , ' charge ' , ' ' , ' promoting ' , ' volunteer ' , ' ' , ' event ' , ' ' , ' held ' , ' ' , ' ' , ' ' , ' ' , ' actively ' , ' participate ' , ' ' , ' often ' , ' ' , ' offsite ' , ' training ' , ' ' , ' ' , ' also ' , ' carry ' , ' ' , ' regular ' , ' training ' , ' ' , ' social ' , ' contribution ' , ' ' , ' also ' , ' clean ' , ' ' , ' ' , ' area ' , ' ' , ' support ' , ' underprivileged ' , ' child ' ]","Social Contribution in Business: The good thing about this company is that it puts out social contribution on all fronts. The model of 1-1-1 is affecting not only our company but also other companies. From the time I joined the company, I was told that it was important to do volunteer work, and I was given the right to spend 1% of my working hours. Each department has a staff in charge of promoting volunteers, and events are held so that they can actively participate. We often do off-site training, but we also carry out regular training and social contribution. We also clean up the area and support underprivileged children."
2,男性/ 営業系（営業、MR、営業企画 他）/ 退職済み/ 正社員,Annual salary/salary,4.6,給与水準：給与は前職を考慮した形だが、ベースだけで前職を超えることはない。基本インセンティブが提供されることが前提のためそれを入れて前職よりも多くの給与となる。インセンティブは上限額がないため達成すれば大きな金額が入ってくる。120%などを超えるとアクセラレートがかかりより増える。これはEnterpriseとSmallでは体型が違う。若手でも数字を出すことができれば良い給与を稼げる企業となりそれがモチベーションにもつながっている,2018年時点の情報,"[ ' Salary ' , ' level ' , ' ' , ' salary ' , ' ' , ' based ' , ' ' , ' ' , ' previous ' , ' job ' , ' ' , ' ' , ' base ' , ' alone ' , ' ' , ' ' , ' exceed ' , ' ' , ' previous ' , ' job ' , ' Since ' , ' ' , ' ' , ' premised ' , ' ' , ' basic ' , ' incentive ' , ' ' , ' provided ' , ' ' , ' salary ' , ' ' , ' ' , ' ' , ' ' , ' ' , ' previous ' , ' job ' , ' including ' , ' ' , ' ' , ' ' , ' ' , ' upper ' , ' limit ' , ' ' , ' incentive ' , ' ' , ' ' , ' ' , ' achieve ' , ' ' , ' ' , ' ' , ' receive ' , ' ' , ' large ' , ' amount ' , ' ' , ' money ' , ' ' , ' ' , ' exceeds ' , ' 120 ' , ' etc ' , ' ' , ' ' , ' ' , ' accelerated ' , ' ' , ' ' , ' ' , ' increase ' , ' ' , ' ' , ' ' , ' different ' , ' ' , ' Enterprise ' , ' ' , ' Small ' , ' ' , ' even ' , ' young ' , ' people ' , ' ' , ' produce ' , ' number ' , ' ' , ' ' , ' become ' , ' ' , ' company ' , ' ' , ' ' , ' ' , ' earn ' , ' good ' , ' salary ' , ' ' , ' ' , ' also ' , ' connected ' , ' ' , ' ' , ' motivation ' ]","Salary level: The salary is based on the previous job, but the base alone will not exceed the previous job. Since it is premised that basic incentives are provided, the salary will be more than the previous job, including that. There is no upper limit for incentives, so if you achieve them, you will receive a large amount of money. If it exceeds 120% etc., it will be accelerated and it will increase more. This is different between Enterprise and Small. If even young people can produce numbers, it will become a company where they can earn good salaries, which is also connected to their motivation."
3,男性/ 営業系（営業、MR、営業企画 他）/ 退職済み/ 正社員,Benefits/office environment,4.6,オフィス環境：オフィス環境はとても素晴らしい環境です。カフェスペースではコーヒー、飲料などもお店と遜色ないレベルで無料で飲むことが可能。おにぎりやヨーグルトなども提供されている。内装などもグローバルで統一されており居心地が良い環境。お客様様をこちらに呼びたくなる環境です。東京駅前の立地であり通勤や営業へ行くのも非常に便利であり、地方に行くのにも快適。受付なども丁寧対応となっておりお客様をお迎えするという感じとなっております。,2018年時点の情報,"[ ' Office ' , ' environment ' , ' ' , ' office ' , ' environment ' , ' ' , ' ' , ' ' , ' nice ' , ' environment ' , ' ' , ' ' , ' cafe ' , ' space ' , ' ' , ' ' , ' drink ' , ' coffee ' , ' ' , ' drink ' , ' ' , ' free ' , ' ' , ' ' , ' level ' , ' comparable ' , ' ' , ' ' , ' ' , ' shop ' , ' Rice ' , ' ball ' , ' ' , ' yogurt ' , ' ' , ' also ' , ' provided ' , ' ' , ' interior ' , ' ' , ' globally ' , ' standardized ' , ' ' , ' ha ' , ' ' , ' comfortable ' , ' environment ' , ' ' , ' ' , ' environment ' , ' ' , ' make ' , ' ' , ' want ' , ' ' , ' invite ' , ' customer ' , ' ' , ' Located ' , ' ' , ' front ' , ' ' , ' Tokyo ' , ' Station ' , ' ' , ' ' , ' ' , ' convenient ' , ' ' , ' commuting ' , ' ' , ' business ' , ' ' , ' ' , ' ' , ' comfortable ' , ' ' , ' go ' , ' ' , ' ' , ' countryside ' , ' ' , ' reception ' , ' ' , ' also ' , ' polite ' , ' ' , ' ' , ' feel ' , ' like ' , ' welcoming ' , ' customer ' ]","Office environment: The office environment is a very nice environment. In the cafe space, you can drink coffee and drinks for free at a level comparable to that of shops. Rice balls and yogurt are also provided. The interior is globally standardized and has a comfortable environment. It's an environment that makes you want to invite customers here. Located in front of Tokyo Station, it is very convenient for commuting and business, and it is comfortable to go to the countryside. The reception is also polite and it feels like welcoming customers."
4,,Growth/motivation,4.5,成長・キャリア開発：【新しい仕事に挑戦できる環境か】超大企業向けの営業担当には、全く新しいフィールドにチャレンジできない。    完全に担当企業を割り振られて、基本的にはそのおもりのような仕事になってしまいます。    営業がフロントで、他部門も責任回避（担当範囲のことしかやらないので、外資系企業としては当然）の風潮が強い。    また営業の常務が3人ほどいるが、いずれも責任感も行動力も全くありません。,2012年時点の情報,"[ ' GrowthCareer ' , ' Development ' , ' [ Environment ' , ' ' , ' ' , ' ' , ' challenge ' , ' new ' , ' jobs ] ' , ' Sales ' , ' representative ' , ' ' , ' super ' , ' large ' , ' company ' , ' cannot ' , ' challenge ' , ' completely ' , ' new ' , ' field ' , ' ' , ' company ' , ' ' , ' charge ' , ' ' , ' completely ' , ' assigned ' , ' ' , ' basically ' , ' ' , ' work ' , ' becomes ' , ' like ' , ' ' , ' weight ' , ' ' , ' ' , ' front ' , ' office ' , ' ' , ' department ' , ' tend ' , ' ' , ' avoid ' , ' responsibility ' , ' ' , ' ' , ' ' , ' natural ' , ' ' , ' ' , ' foreignaffiliated ' , ' company ' , ' ' , ' ' , ' ' , ' ' , ' ' , ' ' , ' ' , ' responsible ' , ' ' , ' ' , ' strong ' , ' ' , ' addition ' , ' ' , ' ' , ' ' , ' three ' , ' managing ' , ' director ' , ' ' , ' sale ' , ' ' , ' none ' , ' ' , ' ' , ' ' , ' ' , ' sense ' , ' ' , ' responsibility ' , ' ' , ' ' , ' ability ' , ' ' , ' take ' , ' action ' ]","Growth/Career Development: [Environment where you can challenge new jobs] Sales representatives for super large companies cannot challenge completely new fields.   The company in charge is completely assigned, and basically the work becomes like a weight.                                                from the front office, other departments tend to avoid responsibility (it is only natural for a foreign-affiliated company, as they only do what they are responsible for), is strong.   In addition, there are about three managing directors in sales, but none of them have a sense of responsibility or the ability to take action."
5,男性/ 営業系（営業、MR、営業企画 他）/ 現職（回答時）/ 正社員,Business prospects/strengths/weaknesses,5.0,会社の安定性：いわゆるSIや売り切り型のパッケージソフトビジネスではなくサブスクリプション型のビジネスなので、ライセンスを解約されないかぎりずっと契約が積み上がり右肩上がりの成長をする。解約されないように定着支援や既存顧客のフォロー(ユーザ会など含め)についても仕組みがあるので、裏表なく「お客様のため（Customer  Success)」という視点で仕事ができるので気持ちが良い。,2016年時点の情報,"[ ' Company ' , ' stability ' , ' Since ' , ' ' , ' ' , ' ' , ' subscriptiontype ' , ' business ' , ' ' , ' ' , ' socalled ' , ' SI ' , ' ' , ' oneoff ' , ' package ' , ' software ' , ' business ' , ' contract ' , ' continue ' , ' ' , ' accumulate ' , ' ' , ' grow ' , ' steadily ' , ' unless ' , ' ' , ' license ' , ' ' , ' cancelled ' , ' ' , ' ' , ' ' , ' mechanism ' , ' ' , ' retention ' , ' support ' , ' ' , ' followup ' , ' ' , ' existing ' , ' customer ' , ' including ' , ' user ' , ' meeting ' , ' etc ' , ' ' , ' ' , ' ' , ' ' , ' ' , ' cancel ' , ' ' , ' ' , ' feel ' , ' good ' , ' ' , ' ' , ' able ' , ' ' , ' work ' , ' ' , ' ' , ' perspective ' , ' ' , ' customer ' , ' success ' ]","Company stability: Since it is a subscription-type business, not a so-called SI or one-off package software business, contracts continue to accumulate and grow steadily unless the license is cancelled. There is a mechanism for retention support and follow-up of existing customers (including user meetings, etc.) so that they do not cancel, so it feels good to be able to work from the perspective of ""customer success""."
6,,Growth/motivation,4.5,成長・キャリア開発：【成長を感じるとき】自分の成果が数字やボーナスにダイレクトに反映される。上司や人事部長との個人面談も頻繁に行われて、その際に的確に自分の評価をしてもらえる。自分が頑張って来たことをちゃんと上の人が見てくれているので、常に成長したい意欲、そしてそれに対して頻度にフィードバックをもらえるので、実になっていることが実感できる。,2013年時点の情報,"[ ' Growthcareer ' , ' development ' , ' [ ' , ' ' , ' feel ' , ' growth ] ' , ' ' , ' achievement ' , ' ' , ' directly ' , ' reflected ' , ' ' , ' number ' , ' ' , ' bonus ' , ' Personal ' , ' interview ' , ' ' , ' superior ' , ' ' , ' personnel ' , ' manager ' , ' ' , ' also ' , ' frequently ' , ' held ' , ' ' , ' ' , ' ' , ' time ' , ' employee ' , ' ' , ' accurately ' , ' evaluate ' , ' ' , ' ' , ' ' , ' feel ' , ' ' , ' ' , ' hard ' , ' work ' , ' ' , ' ' , ' seen ' , ' ' , ' ' , ' superior ' , ' ' , ' ' , ' ' , ' always ' , ' motivated ' , ' ' , ' grow ' , ' ' , ' ' , ' get ' , ' feedback ' , ' ' , ' ' , ' often ' , ' ' , ' want ' , ' ' , ' grow ' ]","Growth/career development: [When you feel growth] Your achievements are directly reflected in numbers and bonuses. Personal interviews with superiors and personnel managers are also frequently held, and at these times, employees can accurately evaluate themselves. I can feel that my hard work is being seen by my superiors, so I am always motivated to grow, and I get feedback on how often I want to grow."
7,男性/ 営業系（営業、MR、営業企画 他）/ 現職（回答時）/ 正社員,Work style (working hours/holidays/systems),5.0,勤務時間・休日休暇：営業部門は有給消化率は低くなりがち。ただ、結果だけでなくプロセスも全てSalesforceで可視化されているので、「やることをきちんとやっている」人が休むことについて文句を言われることは少ない。また、「やることをきちんとやる」が徹底できていればきちんと営業数字が上がることも可視化されているので、各人に納得感がある。,2016年時点の情報,"[ ' Working ' , ' hoursholidaysholidays ' , ' Paid ' , ' usage ' , ' rate ' , ' tends ' , ' ' , ' ' , ' low ' , ' ' , ' ' , ' sale ' , ' department ' , ' However ' , ' ' , ' ' , ' result ' , ' ' , ' also ' , ' ' , ' process ' , ' ' , ' visualized ' , ' ' , ' Salesforce ' , ' ' , ' people ' , ' ' , ' ' , ' ' , ' ' , ' ' , ' properly ' , ' rarely ' , ' complain ' , ' ' , ' taking ' , ' ' , ' break ' , ' ' , ' addition ' , ' ' , ' ' , ' visualized ' , ' ' , ' sale ' , ' number ' , ' ' , ' increase ' , ' ' , ' ' , ' ' , ' thoroughly ' , ' ' , ' ' , ' ' , ' ' , ' ' , ' ' , ' person ' , ' ha ' , ' ' , ' sense ' , ' ' , ' satisfaction ' ]","Working hours/holidays/holidays: Paid usage rate tends to be low in the sales department. However, not only results but also all processes are visualized in Salesforce, so people who ""do what they do properly"" rarely complain about taking a break. In addition, it is visualized that sales numbers will increase if we can thoroughly ""do what we do"", so each person has a sense of satisfaction."
8,男性/ IT系エンジニア（アプリ開発、ITコンサル 他）/ 現職（回答時）/ 正社員,Benefits/office environment,4.2,福利厚生：外資だからなのか、かなり充実している印象があります。英会話のレッスンに対する補助が出たり、健康増進のためにスポーツジムへ通うための補助が出たりしています。そういうのはかなり助かりますね。ボランティアを推奨していることも特徴の一つで、土日にボランティア活動を行ったら、業務の一環として代休を取ることも可能です。,2013年時点の情報,"[ ' Welfare ' , ' Perhaps ' , ' ' , ' ' , ' ' , ' ' , ' foreign ' , ' company ' , ' ' , ' ' , ' ' , ' impression ' , ' ' , ' ' , ' ' , ' quite ' , ' substantial ' , ' ' , ' ' , ' subsidy ' , ' ' , ' English ' , ' conversation ' , ' lesson ' , ' ' , ' subsidy ' , ' ' , ' going ' , ' ' , ' ' , ' gym ' , ' ' , ' improve ' , ' health ' , ' Thats ' , ' really ' , ' helpful ' , ' One ' , ' ' , ' ' , ' feature ' , ' ' , ' ' , ' ' , ' encourage ' , ' volunteer ' , ' ' , ' ' , ' ' , ' ' , ' volunteer ' , ' work ' , ' ' , ' Saturdays ' , ' ' , ' Sundays ' , ' ' , ' ' , ' take ' , ' compensatory ' , ' leave ' , ' ' , ' part ' , ' ' , ' ' , ' work ' ]","Welfare: Perhaps because it is a foreign company, I have the impression that it is quite substantial. There are subsidies for English conversation lessons and subsidies for going to the gym to improve health. That's really helpful. One of the features is that we encourage volunteers, and if you do volunteer work on Saturdays and Sundays, you can take compensatory leave as part of your work."
9,男性/ IT系エンジニア（アプリ開発、ITコンサル 他）/ 現職（回答時）/ 正社員,Annual salary/salary,4.2,給与水準：給与水準はかなり高いほうではないでしょうか。インセンティブも多いし、金銭面での社員のモチベート要因は非常に多いですね。また、表彰がよく行われていて、一定の成績を上げるとiPad  miniなどの商品がもらえたり、年度を通じて好成績を上げた社員は、ハワイへ無料で招待してもらえるなど、給与以外でも待遇はいいです。,2013年時点の情報,"[ ' Salary ' , ' level ' , ' ' , ' salary ' , ' level ' , ' ' , ' quite ' , ' high ' , ' isnt ' , ' ' , ' ' , ' ' , ' many ' , ' incentive ' , ' ' , ' ' , ' ' , ' many ' , ' factor ' , ' ' , ' motivate ' , ' employee ' , ' financially ' , ' ' , ' addition ' , ' award ' , ' ' , ' often ' , ' given ' , ' ' , ' ' , ' ' , ' achieve ' , ' ' , ' certain ' , ' level ' , ' ' , ' performance ' , ' ' , ' ' , ' receive ' , ' product ' , ' ' , ' ' , ' ' , ' iPad ' , ' mini ' , ' ' , ' employee ' , ' ' , ' ' , ' achieved ' , ' good ' , ' result ' , ' throughout ' , ' ' , ' year ' , ' ' , ' ' , ' invited ' , ' ' , ' Hawaii ' , ' ' , ' free ' , ' ' ]","Salary level: The salary level is quite high, isn't it? There are many incentives, and there are many factors that motivate employees financially. In addition, awards are often given, and if you achieve a certain level of performance, you can receive products such as an iPad mini, and employees who have achieved good results throughout the year can be invited to Hawaii for free. is."
