,reviewer_info,title,rating,review,year,review_translated,reviwe_translated_original
50,男性/ 営業系（営業、MR、営業企画 他）/ 現職（回答時）/ 正社員,Growth/motivation,3.9,教育・研修：過去の成功事例のナレッジシェアなどが積極的に行われている。それは個人間はもちろんだがチーム、部と全社としてそういう風土がある。他の外資ではあまりないサポート体制。また、入社年次の浅い中途社員には手厚くサービスについての勉強会など行われるため比較的キャッチアップのための土壌がしっかりある。入社後もしっかり1ヶ月研修もあるためこれから中途で入社する人でもある一定の活躍することができる環境が整っている。,2020年時点の情報,"[ ' EducationTraining ' , ' Knowledge ' , ' sharing ' , ' ' , ' past ' , ' successful ' , ' case ' , ' ' , ' actively ' , ' carried ' , ' ' , ' ' , ' ' , ' true ' , ' ' , ' ' , ' ' , ' individual ' , ' ' , ' also ' , ' within ' , ' team ' , ' department ' , ' ' , ' ' , ' company ' , ' ' , ' ' , ' whole ' , ' ' , ' support ' , ' system ' , ' ' , ' ' , ' ' , ' often ' , ' found ' , ' ' , ' ' , ' foreign ' , ' company ' , ' ' , ' addition ' , ' since ' , ' midcareer ' , ' employee ' , ' ' , ' ' , ' ' , ' joined ' , ' ' , ' company ' , ' ' , ' ' , ' short ' , ' time ' , ' ' , ' given ' , ' generous ' , ' study ' , ' session ' , ' ' , ' service ' , ' ' , ' ' , ' ' , ' relatively ' , ' solid ' , ' foundation ' , ' ' , ' catching ' , ' ' , ' ' , ' ' , ' also ' , ' ' , ' onemonth ' , ' training ' , ' ' , ' joining ' , ' ' , ' company ' , ' ' , ' ' , ' ' , ' ' , ' environment ' , ' ' , ' place ' , ' ' , ' people ' , ' ' , ' join ' , ' ' , ' company ' , ' midcareer ' , ' ' , ' play ' , ' ' , ' active ' , ' role ' ]","Education/Training: Knowledge sharing of past successful cases is actively carried out. This is true not only between individuals, but also within teams, departments and the company as a whole. A support system that is not often found in other foreign companies. In addition, since mid-career employees who have not joined the company for a short time are given generous study sessions on services, there is a relatively solid foundation for catching up. There is also a one-month training after joining the company, so there is an environment in place where people who join the company mid-career can play an active role."
51,男性/ アカウントエグゼクティブ/ 退職済み（2020年）/ 中途入社/ 在籍21年以上/ 正社員,Business prospects/strengths/weaknesses,4.5,事業展望:正直だいぶ買収などで広がってきましたが、今後は鈍化するのではと思います。日本でも大手企業の大規模導入はかなり進んだので、今後のホワイトスペースは微妙かなと。あとは、営業1人あたりの目標売上は上がっているのに、人が増えて担当アカウントは減るという流れなので、旨味であるインセンティブはどんどん稼げなくなっている印象,2020年時点の情報,"[ ' Business ' , ' outlook ' , ' ' , ' ' , ' honest ' , ' ' , ' ha ' , ' spread ' , ' considerably ' , ' due ' , ' ' , ' acquisition ' , ' ' , ' ' , ' think ' , ' ' , ' ' , ' slow ' , ' ' , ' ' , ' ' , ' future ' , ' Largescale ' , ' introduction ' , ' ' , ' major ' , ' company ' , ' ha ' , ' progressed ' , ' considerably ' , ' ' , ' Japan ' , ' ' , ' well ' , ' ' , ' ' , ' wonder ' , ' ' , ' ' , ' ' , ' ' , ' ' , ' white ' , ' space ' , ' ' , ' ' , ' future ' , ' ' , ' ' , ' even ' , ' though ' , ' ' , ' target ' , ' sale ' , ' per ' , ' sale ' , ' person ' , ' ' , ' increasing ' , ' ' , ' number ' , ' ' , ' people ' , ' ' , ' charge ' , ' ' , ' increasing ' , ' ' , ' ' , ' number ' , ' ' , ' account ' , ' ' , ' charge ' , ' ' , ' decreasing ' , ' ' , ' ' , ' impression ' , ' ' , ' ' , ' incentive ' , ' ' , ' ' , ' umami ' , ' ' , ' getting ' , ' le ' , ' ' , ' le ' ]","Business outlook: To be honest, it has spread considerably due to acquisitions, but I think it will slow down in the future. Large-scale introduction by major companies has progressed considerably in Japan as well, so I wonder if there will be any white space in the future. After that, even though the target sales per sales person is increasing, the number of people in charge is increasing and the number of accounts in charge is decreasing, so the impression that the incentive that is umami is getting less and less."
52,男性/ 6903/ 現職（回答時）/ 中途入社/ 在籍6～10年/ 正社員,Work style (working hours/holidays/systems),4.9,勤務時間・休日休暇:フレックスだが結果を出すために働かなければならない量はとにかく多い、トレーニングも非常に充実しており逆に言えばかかる時間も多い多様な働き方支援:グローバル企業なこともあり人種やジェンダー、家庭環境などの平等性には力を入れており自由にしていく方向性が強く,2021年時点の情報,"[ ' Working ' , ' hoursholidaysholidays ' , ' Flexibility ' , ' ' , ' ' , ' amount ' , ' ' , ' work ' , ' ' , ' must ' , ' ' , ' done ' , ' ' , ' produce ' , ' result ' , ' ' , ' large ' , ' Emphasis ' , ' ' , ' placed ' , ' ' , ' equality ' , ' ' , ' race ' , ' gender ' , ' family ' , ' environment ' , ' etc ' , ' ' , ' ' , ' direction ' , ' ' , ' freedom ' , ' ' , ' strong ' ]","Working hours/holidays/holidays: Flexibility, but the amount of work that must be done to produce results is large. Emphasis is placed on equality of race, gender, family environment, etc., and the direction of freedom is strong."
53,男性/ アカウントエグゼクティブ/ 現職（回答時）/ 中途入社/ 在籍6～10年/ 正社員/ 営業本部/ 無し,Work style (working hours/holidays/systems),4.9,勤務時間・休日休暇:一定年数が経てば、ワークライフバランスは満足できるレベル。休日についてはほぼ仕事はない。目標については高いが、それを支援する体制・仕組み・製品は揃っている。多様な働き方支援:リモートワークはおそらくコロナ後も望めば続けることができる,2021年時点の情報,"[ ' Working ' , ' hoursholidays ' , ' ' , ' holiday ' , ' ' , ' ' , ' certain ' , ' number ' , ' ' , ' year ' , ' ' , ' worklife ' , ' balance ' , ' ' , ' ' , ' ' , ' satisfactory ' , ' level ' , ' Almost ' , ' ' , ' work ' , ' ' , ' holiday ' , ' ' , ' ' , ' high ' , ' goal ' , ' ' , ' ' , ' ' , ' system ' , ' system ' , ' ' , ' product ' , ' ' , ' support ' , ' ' , ' Diverse ' , ' work ' , ' style ' , ' support ' , ' Remote ' , ' work ' , ' ' , ' probably ' , ' ' , ' continued ' , ' even ' , ' ' , ' COVID19 ' , ' ' , ' desired ' ]","Working hours/holidays and holidays: After a certain number of years, the work-life balance is at a satisfactory level. Almost no work on holidays. We have high goals, but we have systems, systems, and products to support them. Diverse work style support: Remote work can probably be continued even after COVID-19 if desired"
54,男性/ 一般社員/ 現職（回答時）/ 中途入社/ 在籍3年未満/ 正社員/ 営業本部/ 営業,Annual salary/salary,3.8,給与制度:給余水準は高い上に納得感のある報酬が支払われている。高い業績を出し続けるため、現場の教育環境もしっかりと整っており、厳しい営業戦線に耐えうる組織力を有しているので、活躍することができるようになれば年収数千万単位で稼ぐこともできる。評価制度:公平だとおもう,2021年時点の情報,"[ ' Salary ' , ' system ' , ' Salary ' , ' level ' , ' ' , ' high ' , ' ' , ' remuneration ' , ' ' , ' paid ' , ' ' , ' ' , ' sense ' , ' ' , ' satisfaction ' , ' ' , ' order ' , ' ' , ' continue ' , ' ' , ' produce ' , ' high ' , ' performance ' , ' ' , ' ' , ' ' , ' welldeveloped ' , ' onsite ' , ' educational ' , ' environment ' , ' ' , ' organizational ' , ' strength ' , ' ' , ' ' , ' withstand ' , ' ' , ' tough ' , ' sale ' , ' battle ' , ' ' , ' also ' , ' Evaluation ' , ' system ' , ' ' , ' think ' , ' ' , ' fair ' ]","Salary system: Salary level is high and remuneration is paid with a sense of satisfaction. In order to continue to produce high performance, we have a well-developed on-site educational environment and organizational strength that can withstand a tough sales battle. can also Evaluation system: I think it's fair"
55,男性/ 営業（法人向け）/ 現職（回答時）/ 中途入社/ 在籍3年未満/ 正社員/ インダストリーバリューセリング事業本部/ リードソリューションエンジニア,Annual salary/salary,4.1,給与制度:基本給、業績給に分かれており、業績給については各従業員の目標を上司との相談で柔軟に定義することができる。評価制度:ジョブグレードが明確に定義されていて、昇進に必要な基準などがはっきりしている。年齢や性別など、仕事の結果以外の評価基準はほとんど存在しない。,2021年時点の情報,"[ ' Salary ' , ' system ' , ' Divided ' , ' ' , ' basic ' , ' salary ' , ' ' , ' performancebased ' , ' salary ' , ' ' , ' performancebased ' , ' salary ' , ' ' , ' employee ' , ' goal ' , ' ' , ' ' , ' flexibly ' , ' defined ' , ' ' , ' consultation ' , ' ' , ' ' , ' superior ' , ' Evaluation ' , ' system ' , ' Job ' , ' grade ' , ' ' , ' clearly ' , ' defined ' , ' ' , ' ' , ' criterion ' , ' required ' , ' ' , ' promotion ' , ' ' , ' clear ' , ' Evaluation ' , ' criterion ' , ' ' , ' ' , ' work ' , ' result ' , ' ' , ' ' , ' age ' , ' ' , ' gender ' , ' ' , ' almost ' , ' nonexistent ' ]","Salary system: Divided into basic salary and performance-based salary. For performance-based salary, each employee's goals can be flexibly defined in consultation with their superiors. Evaluation system: Job grades are clearly defined, and the criteria required for promotion are clear. Evaluation criteria other than work results, such as age and gender, are almost non-existent."
56,男性/ 営業/ 現職（回答時）/ 中途入社/ 在籍3年未満/ 正社員,Benefits/office environment,5.0,福利厚生:ベネフィットステーション、IT健保以外は基本なし。転勤者には家賃や交通費など手厚い手当がある。オフィス環境:どこの事務所も好立地に事務所があり、飲み物、おやつが常備されている。現在はコロナでリモートワークがメインのため、出社してる人はかなり限られる。,2020年時点の情報,"[ ' Welfare ' , ' ' , ' benefit ' , ' ' , ' ' , ' benefit ' , ' station ' , ' ' , ' ' , ' health ' , ' insurance ' , ' Transferees ' , ' receive ' , ' generous ' , ' benefit ' , ' ' , ' ' , ' rent ' , ' ' , ' transportation ' , ' expense ' , ' Office ' , ' environment ' , ' ' , ' office ' , ' ' , ' located ' , ' ' , ' good ' , ' location ' , ' ' , ' ' , ' always ' , ' stocked ' , ' ' , ' drink ' , ' ' , ' snack ' , ' Currently ' , ' remote ' , ' work ' , ' ' , ' ' , ' main ' , ' thing ' , ' ' , ' Corona ' , ' ' , ' ' , ' number ' , ' ' , ' people ' , ' ' , ' come ' , ' ' , ' work ' , ' ' , ' quite ' , ' limited ' ]","Welfare: No benefits other than benefit station and IT health insurance. Transferees receive generous benefits such as rent and transportation expenses. Office environment: All offices are located in good locations and are always stocked with drinks and snacks. Currently, remote work is the main thing in Corona, so the number of people who come to work is quite limited."
57,男性/ 税務/ 現職（回答時）/ 中途入社/ 在籍6～10年/ 正社員/ 税務/ 部長,Annual salary/salary,3.7,給与制度:同業他社に比べて少し高いです。ストックオプションの付与があります。評価制度:新しい会社なので年功序列はありません。ほとんどが中途採用です。完全実力主義ではありませんが実力は求められます。英語力が有れば優位になります。,2021年時点の情報,"[ ' Salary ' , ' system ' , ' ' , ' little ' , ' higher ' , ' ' , ' ' , ' company ' , ' ' , ' ' , ' ' , ' industry ' , ' Granted ' , ' stock ' , ' option ' , ' Evaluation ' , ' system ' , ' Since ' , ' ' , ' ' , ' ' , ' new ' , ' company ' , ' ' , ' ' , ' ' , ' seniority ' , ' system ' , ' ' , ' ' , ' ' , ' ' , ' midcareer ' , ' hire ' , ' ' , ' ' , ' ' , ' perfect ' , ' meritocracy ' , ' ' , ' ability ' , ' ' , ' required ' , ' English ' , ' proficiency ' , ' ' , ' ' , ' ' , ' advantage ' ]","Salary system: A little higher than other companies in the same industry. Granted stock options. Evaluation system: Since this is a new company, there is no seniority system. Most of them are mid-career hires. It's not a perfect meritocracy, but ability is required. English proficiency will be an advantage."
58,男性/ 広告宣伝/ 退職済み（2019年）/ 中途入社/ 在籍6～10年/ 正社員,Corporate culture/organizational system,4.3,企業カルチャー・社風:やはり名前の通り、営業が強く、営業中心の組織風土。営業を中心に周りの組織が動いているイメージダイバーシティ・多様性:日本は国柄的に海外と比べて性別、人種などの多様性が低いが、本企業においては女性登用や障害者の雇用など継続的に注力している,2019年時点の情報,"[ ' Corporate ' , ' CultureCulture ' , ' ' , ' ' , ' name ' , ' suggests ' , ' sale ' , ' ' , ' strong ' , ' ' , ' ' , ' organizational ' , ' climate ' , ' ' , ' salesoriented ' , ' Image ' , ' ' , ' surrounding ' , ' organization ' , ' centering ' , ' ' , ' sale ' , ' DiversityDiversity ' , ' Compared ' , ' ' , ' ' , ' country ' , ' Japan ' , ' ha ' , ' le ' , ' diversity ' , ' ' , ' term ' , ' ' , ' gender ' , ' ' , ' race ' , ' ' , ' ' , ' country ' , ' ' , ' ' , ' ' , ' company ' , ' ' , ' ' , ' promoting ' , ' woman ' , ' ' , ' hiring ' , ' people ' , ' ' , ' disability ' , ' continuing ' , ' focus ' ]","Corporate Culture/Culture: As the name suggests, sales are strong and the organizational climate is sales-oriented. Image of surrounding organizations centering on sales Diversity/Diversity: Compared to other countries, Japan has less diversity in terms of gender and race than other countries, but in this company, we are promoting women and hiring people with disabilities. continuing focus"
59,男性/ サポート/ 現職（回答時）/ 中途入社/ 在籍21年以上/ 正社員,Annual salary/salary,4.7,給与制度:年俸の10パーセントがボーナス。ボーナスは全額支給されるとは限らない。全額支給されたとすると、ボーナスの75パーセントが4月に、残りの25パーセントが10月に支給される。評価制度:プロモーションについての明確な基準があり、全社員に公開されている。,2021年時点の情報,"[ ' Salary ' , ' system ' , ' 10 ' , ' ' , ' annual ' , ' salary ' , ' ' , ' bonus ' , ' Bonuses ' , ' ' , ' ' , ' necessarily ' , ' paid ' , ' ' , ' full ' , ' Assuming ' , ' full ' , ' payment ' , ' 75 ' , ' percent ' , ' ' , ' ' , ' bonus ' , ' ' , ' ' , ' paid ' , ' ' , ' April ' , ' ' , ' ' , ' remaining ' , ' 25 ' , ' percent ' , ' ' , ' October ' , ' Evaluation ' , ' system ' , ' ' , ' ' , ' clear ' , ' criterion ' , ' ' , ' promotion ' , ' ' , ' ' , ' open ' , ' ' , ' ' , ' employee ' ]","Salary system: 10% of annual salary is bonus. Bonuses are not necessarily paid in full. Assuming full payment, 75 percent of the bonus will be paid in April and the remaining 25 percent in October. Evaluation system: There are clear criteria for promotion, which are open to all employees."
60,女性/ インサイドセールス/ 現職（回答時）/ 中途入社/ 在籍21年以上/ 正社員,Growth/motivation,3.5,成長・キャリア開発:キャリアの選択肢が広いようで、狭まれているように感じる。特に異業種から転職をする場合、インサイドセールスからキャリアを始めることになるが、その後のキャリアは外勤営業以外選びにくいような状況。枠がないなどで、キャリアを選択できずにインサイドセールスに残り転職活動を始める人が多い。,2022年時点の情報,"[ ' Growthcareer ' , ' development ' , ' Career ' , ' option ' , ' seem ' , ' ' , ' ' , ' wide ' , ' ' , ' ' , ' feel ' , ' ' , ' ' , ' ' , ' narrow ' , ' ' , ' particular ' , ' ' , ' changing ' , ' job ' , ' ' , ' ' , ' different ' , ' industry ' , ' ' , ' career ' , ' begin ' , ' ' , ' inside ' , ' sale ' , ' ' , ' ' , ' ' , ' ' , ' ' , ' difficult ' , ' ' , ' choose ' , ' ' , ' career ' , ' ' , ' ' , ' outside ' , ' sale ' , ' ' , ' ' , ' many ' , ' people ' , ' ' , ' cant ' , ' choose ' , ' ' , ' career ' , ' ' , ' ' , ' ' , ' ' , ' frame ' , ' ' , ' ' , ' stay ' , ' ' , ' inside ' , ' sale ' , ' ' , ' start ' , ' looking ' , ' ' , ' ' , ' new ' , ' job ' ]","Growth/career development: Career options seem to be wide, but I feel that they are narrow. In particular, when changing jobs from a different industry, the career begins with inside sales, but after that it is difficult to choose a career other than outside sales. There are many people who can't choose a career because there is no frame, so they stay in inside sales and start looking for a new job."
61,女性/ ストラテジー/ 現職（回答時）/ 中途入社/ 在籍6～10年/ 正社員,Benefits/office environment,3.8,福利厚生:ストックオプションや持株制度は、株価が上がり続けていることからメリットになります。オフィス環境:オフィス環境にはかなりお金もかけていて、2021年秋には新たなオフィスもオープン予定。社内のカフェには常時スナックや飲み物が豊富です。,2021年時点の情報,"[ ' Benefits ' , ' Stock ' , ' option ' , ' ' , ' shareholding ' , ' plan ' , ' benefit ' , ' ' , ' ' , ' everrising ' , ' stock ' , ' price ' , ' Office ' , ' environment ' , ' ' , ' ' , ' spent ' , ' ' , ' lot ' , ' ' , ' money ' , ' ' , ' ' , ' office ' , ' environment ' , ' ' , ' ' , ' ' , ' planning ' , ' ' , ' open ' , ' ' , ' new ' , ' office ' , ' ' , ' ' , ' fall ' , ' ' , ' 2021 ' , ' ' , ' inhouse ' , ' cafe ' , ' ' , ' always ' , ' stocked ' , ' ' , ' snack ' , ' ' , ' drink ' ]","Benefits: Stock options and shareholding plans benefit from the ever-rising stock price. Office environment: We have spent a lot of money on the office environment, and we are planning to open a new office in the fall of 2021. Our in-house cafe is always stocked with snacks and drinks."
62,男性/ カスタマーサクセス/ 現職（回答時）/ 中途入社/ 在籍11～15年/ 正社員/ ディレクター,Work style (working hours/holidays/systems),5.0,多様な働き方支援:コロナの制限が明け、自由に出勤ができるようになったが、週1ー2日の出勤がモデルとされているが、実際出勤している社員は2-3割、人レベルで言うと、出社しない人は月1ー2回、する人は毎日と、人によりけり。全社員出社を受け入れられるキャパはないので、この流れは続くと考えます。,2022年時点の情報,"[ ' Diverse ' , ' work ' , ' style ' , ' support ' , ' ' , ' ' , ' end ' , ' ' , ' corona ' , ' restriction ' , ' ' , ' ' , ' ' , ' possible ' , ' ' , ' go ' , ' ' , ' work ' , ' freely ' , ' ' , ' ' , ' model ' , ' ' , ' 12 ' , ' day ' , ' ' , ' week ' , ' ' , ' ' , ' 2030 ' , ' ' , ' employee ' , ' actually ' , ' go ' , ' ' , ' work ' , ' ' , ' ' , ' personal ' , ' level ' , ' people ' , ' ' , ' dont ' , ' come ' , ' ' , ' work ' , ' ' , ' ' , ' twice ' , ' ' , ' month ' , ' ' , ' people ' , ' ' , ' ' , ' every ' , ' day ' , ' ' , ' depends ' , ' ' , ' ' , ' person ' , ' ' , ' ' , ' ' , ' ' , ' ' , ' capacity ' , ' ' , ' accept ' , ' ' , ' employee ' , ' coming ' , ' ' , ' work ' , ' ' , ' ' , ' think ' , ' ' , ' trend ' , ' ' , ' continue ' ]","Diverse work style support: With the end of corona restrictions, it is now possible to go to work freely, but the model is 1-2 days a week, but only 20-30% of employees actually go to work. On a personal level, people who don't come to work once or twice a month, and people who do, every day, it depends on the person. We do not have the capacity to accept all employees coming to work, so I think this trend will continue."
63,男性/ 営業（法人向け）/ 現職（回答時）/ 中途入社/ 在籍3年未満/ 正社員/ インダストリーバリューセリング事業本部/ リードソリューションエンジニア,Work style (working hours/holidays/systems),4.1,勤務時間・休日休暇:在宅勤務、オフィス勤務、いずれも選択することができ、時間のコントロールは非常にやりやすい。多様な働き方支援:リモートワークはもちろん、勤務時間の管理も個人に任されている。従業員の自主性を重んじてもらえることは非常にありがたい。,2021年時点の情報,"[ ' Working ' , ' hour ' , ' ' , ' holiday ' , ' ' , ' ' , ' choose ' , ' ' , ' work ' , ' ' , ' home ' , ' ' , ' work ' , ' ' , ' ' , ' office ' , ' making ' , ' ' , ' ' , ' easy ' , ' ' , ' control ' , ' ' , ' time ' , ' Diverse ' , ' work ' , ' style ' , ' support ' , ' ' , ' ' , ' remote ' , ' work ' , ' ' , ' also ' , ' ' , ' management ' , ' ' , ' working ' , ' hour ' , ' ' , ' left ' , ' ' , ' ' , ' individual ' , ' ' , ' ' , ' ' , ' grateful ' , ' ' , ' ' , ' autonomy ' , ' ' , ' ' , ' employee ' , ' ' , ' respected ' ]","Working hours and holidays: You can choose to work from home or work in the office, making it very easy to control your time. Diverse work style support: Not only remote work, but also the management of working hours is left to the individual. I am very grateful that the autonomy of the employees is respected."
64,男性/ 営業/ 現職（回答時）/ 中途入社/ 在籍21年以上/ 正社員,Work style (working hours/holidays/systems),3.9,勤務時間・休日休暇:勤務は人それぞれ。案件をどこまで巻き取るか次第のところが強い。売れてればコントロールもできるので働きやすい人としんどい人は二極化してるイメージ多様な働き方支援:リモートワークかつフルフレックスなので働き方は自由である。,2021年時点の情報,"[ ' Working ' , ' HoursHolidaysHolidays ' , ' Everyone ' , ' work ' , ' differently ' , ' ' , ' ' , ' strong ' , ' depending ' , ' ' , ' ' , ' far ' , ' ' , ' project ' , ' ' , ' involved ' , ' ' , ' ' , ' sell ' , ' ' , ' ' , ' control ' , ' ' , ' ' , ' ' , ' image ' , ' ' , ' people ' , ' ' , ' ' , ' easy ' , ' ' , ' work ' , ' ' , ' people ' , ' ' , ' ' , ' hard ' , ' work ' , ' ' , ' polarized ' , ' Diverse ' , ' work ' , ' style ' , ' support ' , ' Remote ' , ' work ' , ' ' , ' full ' , ' flex ' , ' ' , ' work ' , ' style ' , ' ' , ' free ' ]","Working Hours/Holidays/Holidays: Everyone works differently. It is strong depending on how far the project is involved. If it sells, you can control it, so the image of people who are easy to work and people who are hard work is polarized Diverse work style support: Remote work and full flex, so work style is free."
65,男性/ AE/ 退職済み（2019年）/ 中途入社/ 在籍3～5年/ 正社員/ EBU/ AE,Benefits/office environment,5.0,福利厚生:福利厚生はないに等しいオフィス環境:オフィス環境は奇麗な環境であると思う、お菓子や飲み物が自由に取得できるのはありがたいまた、定期的にイベントが開催され、そこでもいろんな食べ物がもらえる（結局はバックオフィス組が貰っているが）,2019年時点の情報,"[ ' Welfare ' , ' Welfare ' , ' ' , ' almost ' , ' nonexistent ' , ' Office ' , ' environment ' , ' ' , ' think ' , ' ' , ' office ' , ' environment ' , ' ' , ' ' , ' beautiful ' , ' environment ' , ' ' , ' ' , ' nice ' , ' ' , ' ' , ' able ' , ' ' , ' get ' , ' snack ' , ' ' , ' drink ' , ' freely ' , ' ' , ' ' , ' get ' , ' ' , ' although ' , ' ' , ' back ' , ' office ' , ' group ' , ' get ' , ' ' , ' ' , ' ' ]","Welfare: Welfare is almost non-existent Office environment: I think the office environment is a beautiful environment, and it's nice to be able to get snacks and drinks freely. You can get it (although the back office group gets it after all)"
